
         /\      Grafana   /‾‾/  
    /\  /  \     |\  __   /  /   
   /  \/    \    | |/ /  /   ‾‾\ 
  /          \   |   (  |  (‾)  |
 / __________ \  |_|\_\  \_____/ 

     execution: local
        script: load-testing/k6/stress/auth.stress.js
        output: -

     scenarios: (100.00%) 1 scenario, 50 max VUs, 5m40s max duration (incl. graceful stop):
              * stress_test: Up to 50 looping VUs for 5m10s over 6 stages (gracefulRampDown: 30s, gracefulStop: 30s)


running (0m01.0s), 05/50 VUs, 0 complete and 0 interrupted iterations
stress_test   [   0% ] 05/50 VUs  0m01.0s/5m10.0s

running (0m02.0s), 05/50 VUs, 5 complete and 0 interrupted iterations
stress_test   [   1% ] 05/50 VUs  0m02.0s/5m10.0s

running (0m03.0s), 05/50 VUs, 10 complete and 0 interrupted iterations
stress_test   [   1% ] 05/50 VUs  0m03.0s/5m10.0s

running (0m04.0s), 05/50 VUs, 15 complete and 0 interrupted iterations
stress_test   [   1% ] 05/50 VUs  0m04.0s/5m10.0s

running (0m05.0s), 05/50 VUs, 20 complete and 0 interrupted iterations
stress_test   [   2% ] 05/50 VUs  0m05.0s/5m10.0s

running (0m06.0s), 05/50 VUs, 25 complete and 0 interrupted iterations
stress_test   [   2% ] 05/50 VUs  0m06.0s/5m10.0s

running (0m07.0s), 05/50 VUs, 30 complete and 0 interrupted iterations
stress_test   [   2% ] 05/50 VUs  0m07.0s/5m10.0s

running (0m08.0s), 05/50 VUs, 30 complete and 0 interrupted iterations
stress_test   [   3% ] 05/50 VUs  0m08.0s/5m10.0s

running (0m09.0s), 05/50 VUs, 35 complete and 0 interrupted iterations
stress_test   [   3% ] 05/50 VUs  0m09.0s/5m10.0s

running (0m10.0s), 05/50 VUs, 40 complete and 0 interrupted iterations
stress_test   [   3% ] 05/50 VUs  0m10.0s/5m10.0s

running (0m11.0s), 05/50 VUs, 45 complete and 0 interrupted iterations
stress_test   [   4% ] 05/50 VUs  0m11.0s/5m10.0s

running (0m12.0s), 05/50 VUs, 50 complete and 0 interrupted iterations
stress_test   [   4% ] 05/50 VUs  0m12.0s/5m10.0s

running (0m13.0s), 06/50 VUs, 55 complete and 0 interrupted iterations
stress_test   [   4% ] 06/50 VUs  0m13.0s/5m10.0s

running (0m14.0s), 06/50 VUs, 61 complete and 0 interrupted iterations
stress_test   [   5% ] 06/50 VUs  0m14.0s/5m10.0s

running (0m15.0s), 06/50 VUs, 67 complete and 0 interrupted iterations
stress_test   [   5% ] 06/50 VUs  0m15.0s/5m10.0s

running (0m16.0s), 06/50 VUs, 73 complete and 0 interrupted iterations
stress_test   [   5% ] 06/50 VUs  0m16.0s/5m10.0s

running (0m17.0s), 06/50 VUs, 79 complete and 0 interrupted iterations
stress_test   [   5% ] 06/50 VUs  0m17.0s/5m10.0s

running (0m18.0s), 06/50 VUs, 81 complete and 0 interrupted iterations
stress_test   [   6% ] 06/50 VUs  0m18.0s/5m10.0s

running (0m19.0s), 06/50 VUs, 86 complete and 0 interrupted iterations
stress_test   [   6% ] 06/50 VUs  0m19.0s/5m10.0s

running (0m20.0s), 06/50 VUs, 92 complete and 0 interrupted iterations
stress_test   [   6% ] 06/50 VUs  0m20.0s/5m10.0s

running (0m21.0s), 06/50 VUs, 98 complete and 0 interrupted iterations
stress_test   [   7% ] 06/50 VUs  0m21.0s/5m10.0s

running (0m22.0s), 06/50 VUs, 104 complete and 0 interrupted iterations
stress_test   [   7% ] 06/50 VUs  0m22.0s/5m10.0s

running (0m23.0s), 06/50 VUs, 109 complete and 0 interrupted iterations
stress_test   [   7% ] 06/50 VUs  0m23.0s/5m10.0s

running (0m24.0s), 06/50 VUs, 115 complete and 0 interrupted iterations
stress_test   [   8% ] 06/50 VUs  0m24.0s/5m10.0s

running (0m25.0s), 07/50 VUs, 121 complete and 0 interrupted iterations
stress_test   [   8% ] 07/50 VUs  0m25.0s/5m10.0s

running (0m26.0s), 07/50 VUs, 128 complete and 0 interrupted iterations
stress_test   [   8% ] 07/50 VUs  0m26.0s/5m10.0s

running (0m27.0s), 07/50 VUs, 135 complete and 0 interrupted iterations
stress_test   [   9% ] 07/50 VUs  0m27.0s/5m10.0s

running (0m28.0s), 07/50 VUs, 142 complete and 0 interrupted iterations
stress_test   [   9% ] 07/50 VUs  0m28.0s/5m10.0s

running (0m29.0s), 07/50 VUs, 144 complete and 0 interrupted iterations
stress_test   [   9% ] 07/50 VUs  0m29.0s/5m10.0s

running (0m30.0s), 07/50 VUs, 151 complete and 0 interrupted iterations
stress_test   [  10% ] 07/50 VUs  0m30.0s/5m10.0s

running (0m31.0s), 07/50 VUs, 158 complete and 0 interrupted iterations
stress_test   [  10% ] 07/50 VUs  0m31.0s/5m10.0s

running (0m32.0s), 07/50 VUs, 165 complete and 0 interrupted iterations
stress_test   [  10% ] 07/50 VUs  0m32.0s/5m10.0s

running (0m33.0s), 07/50 VUs, 172 complete and 0 interrupted iterations
stress_test   [  11% ] 07/50 VUs  0m33.0s/5m10.0s

running (0m34.0s), 07/50 VUs, 177 complete and 0 interrupted iterations
stress_test   [  11% ] 07/50 VUs  0m34.0s/5m10.0s

running (0m35.0s), 07/50 VUs, 184 complete and 0 interrupted iterations
stress_test   [  11% ] 07/50 VUs  0m35.0s/5m10.0s

running (0m36.0s), 07/50 VUs, 191 complete and 0 interrupted iterations
stress_test   [  12% ] 07/50 VUs  0m36.0s/5m10.0s

running (0m37.0s), 08/50 VUs, 198 complete and 0 interrupted iterations
stress_test   [  12% ] 08/50 VUs  0m37.0s/5m10.0s

running (0m38.0s), 08/50 VUs, 206 complete and 0 interrupted iterations
stress_test   [  12% ] 08/50 VUs  0m38.0s/5m10.0s

running (0m39.0s), 08/50 VUs, 214 complete and 0 interrupted iterations
stress_test   [  13% ] 08/50 VUs  0m39.0s/5m10.0s

running (0m40.0s), 08/50 VUs, 222 complete and 0 interrupted iterations
stress_test   [  13% ] 08/50 VUs  0m40.0s/5m10.0s

running (0m41.0s), 08/50 VUs, 225 complete and 0 interrupted iterations
stress_test   [  13% ] 08/50 VUs  0m41.0s/5m10.0s

running (0m42.0s), 08/50 VUs, 233 complete and 0 interrupted iterations
stress_test   [  14% ] 08/50 VUs  0m42.0s/5m10.0s

running (0m43.0s), 08/50 VUs, 241 complete and 0 interrupted iterations
stress_test   [  14% ] 08/50 VUs  0m43.0s/5m10.0s

running (0m44.0s), 08/50 VUs, 249 complete and 0 interrupted iterations
stress_test   [  14% ] 08/50 VUs  0m44.0s/5m10.0s

running (0m45.0s), 08/50 VUs, 255 complete and 0 interrupted iterations
stress_test   [  15% ] 08/50 VUs  0m45.0s/5m10.0s

running (0m46.0s), 08/50 VUs, 262 complete and 0 interrupted iterations
stress_test   [  15% ] 08/50 VUs  0m46.0s/5m10.0s

running (0m47.0s), 08/50 VUs, 270 complete and 0 interrupted iterations
stress_test   [  15% ] 08/50 VUs  0m47.0s/5m10.0s

running (0m48.0s), 08/50 VUs, 278 complete and 0 interrupted iterations
stress_test   [  15% ] 08/50 VUs  0m48.0s/5m10.0s

running (0m49.0s), 09/50 VUs, 286 complete and 0 interrupted iterations
stress_test   [  16% ] 09/50 VUs  0m49.0s/5m10.0s

running (0m50.0s), 09/50 VUs, 295 complete and 0 interrupted iterations
stress_test   [  16% ] 09/50 VUs  0m50.0s/5m10.0s

running (0m51.0s), 09/50 VUs, 304 complete and 0 interrupted iterations
stress_test   [  16% ] 09/50 VUs  0m51.0s/5m10.0s

running (0m52.0s), 09/50 VUs, 308 complete and 0 interrupted iterations
stress_test   [  17% ] 09/50 VUs  0m52.0s/5m10.0s

running (0m53.0s), 09/50 VUs, 317 complete and 0 interrupted iterations
stress_test   [  17% ] 09/50 VUs  0m53.0s/5m10.0s

running (0m54.0s), 09/50 VUs, 326 complete and 0 interrupted iterations
stress_test   [  17% ] 09/50 VUs  0m54.0s/5m10.0s

running (0m55.0s), 09/50 VUs, 335 complete and 0 interrupted iterations
stress_test   [  18% ] 09/50 VUs  0m55.0s/5m10.0s

running (0m56.0s), 09/50 VUs, 344 complete and 0 interrupted iterations
stress_test   [  18% ] 09/50 VUs  0m56.0s/5m10.0s

running (0m57.0s), 09/50 VUs, 350 complete and 0 interrupted iterations
stress_test   [  18% ] 09/50 VUs  0m57.0s/5m10.0s

running (0m58.0s), 09/50 VUs, 359 complete and 0 interrupted iterations
stress_test   [  19% ] 09/50 VUs  0m58.0s/5m10.0s

running (0m59.0s), 09/50 VUs, 367 complete and 0 interrupted iterations
stress_test   [  19% ] 09/50 VUs  0m59.0s/5m10.0s

running (1m00.0s), 09/50 VUs, 376 complete and 0 interrupted iterations
stress_test   [  19% ] 09/50 VUs  1m00.0s/5m10.0s

running (1m01.0s), 10/50 VUs, 385 complete and 0 interrupted iterations
stress_test   [  20% ] 10/50 VUs  1m01.0s/5m10.0s

running (1m02.0s), 10/50 VUs, 390 complete and 0 interrupted iterations
stress_test   [  20% ] 10/50 VUs  1m02.0s/5m10.0s

running (1m03.0s), 10/50 VUs, 400 complete and 0 interrupted iterations
stress_test   [  20% ] 10/50 VUs  1m03.0s/5m10.0s

running (1m04.0s), 10/50 VUs, 410 complete and 0 interrupted iterations
stress_test   [  21% ] 10/50 VUs  1m04.0s/5m10.0s

running (1m05.0s), 10/50 VUs, 420 complete and 0 interrupted iterations
stress_test   [  21% ] 10/50 VUs  1m05.0s/5m10.0s

running (1m06.0s), 10/50 VUs, 430 complete and 0 interrupted iterations
stress_test   [  21% ] 10/50 VUs  1m06.0s/5m10.0s

running (1m07.0s), 10/50 VUs, 440 complete and 0 interrupted iterations
stress_test   [  22% ] 10/50 VUs  1m07.0s/5m10.0s

running (1m08.0s), 10/50 VUs, 450 complete and 0 interrupted iterations
stress_test   [  22% ] 10/50 VUs  1m08.0s/5m10.0s

running (1m09.0s), 10/50 VUs, 457 complete and 0 interrupted iterations
stress_test   [  22% ] 10/50 VUs  1m09.0s/5m10.0s

running (1m10.0s), 10/50 VUs, 466 complete and 0 interrupted iterations
stress_test   [  23% ] 10/50 VUs  1m10.0s/5m10.0s

running (1m11.0s), 10/50 VUs, 476 complete and 0 interrupted iterations
stress_test   [  23% ] 10/50 VUs  1m11.0s/5m10.0s

running (1m12.0s), 10/50 VUs, 486 complete and 0 interrupted iterations
stress_test   [  23% ] 10/50 VUs  1m12.0s/5m10.0s

running (1m13.0s), 10/50 VUs, 490 complete and 0 interrupted iterations
stress_test   [  24% ] 10/50 VUs  1m13.0s/5m10.0s

running (1m14.0s), 10/50 VUs, 500 complete and 0 interrupted iterations
stress_test   [  24% ] 10/50 VUs  1m14.0s/5m10.0s

running (1m15.0s), 10/50 VUs, 510 complete and 0 interrupted iterations
stress_test   [  24% ] 10/50 VUs  1m15.0s/5m10.0s

running (1m16.0s), 10/50 VUs, 520 complete and 0 interrupted iterations
stress_test   [  25% ] 10/50 VUs  1m16.0s/5m10.0s

running (1m17.0s), 11/50 VUs, 530 complete and 0 interrupted iterations
stress_test   [  25% ] 11/50 VUs  1m17.0s/5m10.0s

running (1m18.0s), 11/50 VUs, 541 complete and 0 interrupted iterations
stress_test   [  25% ] 11/50 VUs  1m18.0s/5m10.0s

running (1m19.0s), 11/50 VUs, 552 complete and 0 interrupted iterations
stress_test   [  25% ] 11/50 VUs  1m19.0s/5m10.0s

running (1m20.0s), 11/50 VUs, 559 complete and 0 interrupted iterations
stress_test   [  26% ] 11/50 VUs  1m20.0s/5m10.0s

running (1m21.0s), 11/50 VUs, 570 complete and 0 interrupted iterations
stress_test   [  26% ] 11/50 VUs  1m21.0s/5m10.0s

running (1m22.0s), 11/50 VUs, 581 complete and 0 interrupted iterations
stress_test   [  26% ] 11/50 VUs  1m22.0s/5m10.0s

running (1m23.0s), 12/50 VUs, 592 complete and 0 interrupted iterations
stress_test   [  27% ] 12/50 VUs  1m23.0s/5m10.0s

running (1m24.0s), 12/50 VUs, 598 complete and 0 interrupted iterations
stress_test   [  27% ] 12/50 VUs  1m24.0s/5m10.0s

running (1m25.0s), 12/50 VUs, 610 complete and 0 interrupted iterations
stress_test   [  27% ] 12/50 VUs  1m25.0s/5m10.0s

running (1m26.0s), 12/50 VUs, 621 complete and 0 interrupted iterations
stress_test   [  28% ] 12/50 VUs  1m26.0s/5m10.0s

running (1m27.0s), 12/50 VUs, 633 complete and 0 interrupted iterations
stress_test   [  28% ] 12/50 VUs  1m27.0s/5m10.0s

running (1m28.0s), 12/50 VUs, 645 complete and 0 interrupted iterations
stress_test   [  28% ] 12/50 VUs  1m28.0s/5m10.0s

running (1m29.0s), 13/50 VUs, 657 complete and 0 interrupted iterations
stress_test   [  29% ] 13/50 VUs  1m29.0s/5m10.0s

running (1m30.0s), 13/50 VUs, 666 complete and 0 interrupted iterations
stress_test   [  29% ] 13/50 VUs  1m30.0s/5m10.0s

running (1m31.0s), 13/50 VUs, 679 complete and 0 interrupted iterations
stress_test   [  29% ] 13/50 VUs  1m31.0s/5m10.0s

running (1m32.0s), 13/50 VUs, 692 complete and 0 interrupted iterations
stress_test   [  30% ] 13/50 VUs  1m32.0s/5m10.0s

running (1m33.0s), 13/50 VUs, 705 complete and 0 interrupted iterations
stress_test   [  30% ] 13/50 VUs  1m33.0s/5m10.0s

running (1m34.0s), 13/50 VUs, 717 complete and 0 interrupted iterations
stress_test   [  30% ] 13/50 VUs  1m34.0s/5m10.0s

running (1m35.0s), 14/50 VUs, 730 complete and 0 interrupted iterations
stress_test   [  31% ] 14/50 VUs  1m35.0s/5m10.0s

running (1m36.0s), 14/50 VUs, 737 complete and 0 interrupted iterations
stress_test   [  31% ] 14/50 VUs  1m36.0s/5m10.0s

running (1m37.0s), 14/50 VUs, 751 complete and 0 interrupted iterations
stress_test   [  31% ] 14/50 VUs  1m37.0s/5m10.0s

running (1m38.0s), 14/50 VUs, 765 complete and 0 interrupted iterations
stress_test   [  32% ] 14/50 VUs  1m38.0s/5m10.0s

running (1m39.0s), 14/50 VUs, 779 complete and 0 interrupted iterations
stress_test   [  32% ] 14/50 VUs  1m39.0s/5m10.0s

running (1m40.0s), 14/50 VUs, 788 complete and 0 interrupted iterations
stress_test   [  32% ] 14/50 VUs  1m40.0s/5m10.0s

running (1m41.0s), 15/50 VUs, 802 complete and 0 interrupted iterations
stress_test   [  33% ] 15/50 VUs  1m41.0s/5m10.0s

running (1m42.0s), 15/50 VUs, 817 complete and 0 interrupted iterations
stress_test   [  33% ] 15/50 VUs  1m42.0s/5m10.0s

running (1m43.0s), 15/50 VUs, 832 complete and 0 interrupted iterations
stress_test   [  33% ] 15/50 VUs  1m43.0s/5m10.0s

running (1m44.0s), 15/50 VUs, 847 complete and 0 interrupted iterations
stress_test   [  34% ] 15/50 VUs  1m44.0s/5m10.0s

running (1m45.0s), 15/50 VUs, 862 complete and 0 interrupted iterations
stress_test   [  34% ] 15/50 VUs  1m45.0s/5m10.0s

running (1m46.0s), 15/50 VUs, 877 complete and 0 interrupted iterations
stress_test   [  34% ] 15/50 VUs  1m46.0s/5m10.0s

running (1m47.0s), 16/50 VUs, 883 complete and 0 interrupted iterations
stress_test   [  35% ] 16/50 VUs  1m47.0s/5m10.0s

running (1m48.0s), 16/50 VUs, 899 complete and 0 interrupted iterations
stress_test   [  35% ] 16/50 VUs  1m48.0s/5m10.0s

running (1m49.0s), 16/50 VUs, 915 complete and 0 interrupted iterations
stress_test   [  35% ] 16/50 VUs  1m49.0s/5m10.0s

running (1m50.0s), 16/50 VUs, 925 complete and 0 interrupted iterations
stress_test   [  35% ] 16/50 VUs  1m50.0s/5m10.0s

running (1m51.0s), 16/50 VUs, 941 complete and 0 interrupted iterations
stress_test   [  36% ] 16/50 VUs  1m51.0s/5m10.0s

running (1m52.0s), 16/50 VUs, 957 complete and 0 interrupted iterations
stress_test   [  36% ] 16/50 VUs  1m52.0s/5m10.0s

running (1m53.0s), 17/50 VUs, 973 complete and 0 interrupted iterations
stress_test   [  36% ] 17/50 VUs  1m53.0s/5m10.0s

running (1m54.0s), 17/50 VUs, 990 complete and 0 interrupted iterations
stress_test   [  37% ] 17/50 VUs  1m54.0s/5m10.0s

running (1m55.0s), 17/50 VUs, 1007 complete and 0 interrupted iterations
stress_test   [  37% ] 17/50 VUs  1m55.0s/5m10.0s

running (1m56.0s), 17/50 VUs, 1024 complete and 0 interrupted iterations
stress_test   [  37% ] 17/50 VUs  1m56.0s/5m10.0s

running (1m57.0s), 17/50 VUs, 1031 complete and 0 interrupted iterations
stress_test   [  38% ] 17/50 VUs  1m57.0s/5m10.0s

running (1m58.0s), 17/50 VUs, 1048 complete and 0 interrupted iterations
stress_test   [  38% ] 17/50 VUs  1m58.0s/5m10.0s

running (1m59.0s), 18/50 VUs, 1065 complete and 0 interrupted iterations
stress_test   [  38% ] 18/50 VUs  1m59.0s/5m10.0s

running (2m00.0s), 18/50 VUs, 1083 complete and 0 interrupted iterations
stress_test   [  39% ] 18/50 VUs  2m00.0s/5m10.0s

running (2m01.0s), 18/50 VUs, 1101 complete and 0 interrupted iterations
stress_test   [  39% ] 18/50 VUs  2m01.0s/5m10.0s

running (2m02.0s), 18/50 VUs, 1113 complete and 0 interrupted iterations
stress_test   [  39% ] 18/50 VUs  2m02.0s/5m10.0s

running (2m03.0s), 18/50 VUs, 1130 complete and 0 interrupted iterations
stress_test   [  40% ] 18/50 VUs  2m03.0s/5m10.0s

running (2m04.0s), 18/50 VUs, 1148 complete and 0 interrupted iterations
stress_test   [  40% ] 18/50 VUs  2m04.0s/5m10.0s

running (2m05.0s), 19/50 VUs, 1166 complete and 0 interrupted iterations
stress_test   [  40% ] 19/50 VUs  2m05.0s/5m10.0s

running (2m06.0s), 19/50 VUs, 1185 complete and 0 interrupted iterations
stress_test   [  41% ] 19/50 VUs  2m06.0s/5m10.0s

running (2m07.0s), 19/50 VUs, 1204 complete and 0 interrupted iterations
stress_test   [  41% ] 19/50 VUs  2m07.0s/5m10.0s

running (2m08.0s), 19/50 VUs, 1213 complete and 0 interrupted iterations
stress_test   [  41% ] 19/50 VUs  2m08.0s/5m10.0s

running (2m09.0s), 19/50 VUs, 1231 complete and 0 interrupted iterations
stress_test   [  42% ] 19/50 VUs  2m09.0s/5m10.0s

running (2m10.0s), 19/50 VUs, 1250 complete and 0 interrupted iterations
stress_test   [  42% ] 19/50 VUs  2m10.0s/5m10.0s

running (2m11.0s), 20/50 VUs, 1269 complete and 0 interrupted iterations
stress_test   [  42% ] 20/50 VUs  2m11.0s/5m10.0s

running (2m12.0s), 20/50 VUs, 1289 complete and 0 interrupted iterations
stress_test   [  43% ] 20/50 VUs  2m12.0s/5m10.0s

running (2m13.0s), 20/50 VUs, 1309 complete and 0 interrupted iterations
stress_test   [  43% ] 20/50 VUs  2m13.0s/5m10.0s

running (2m14.0s), 20/50 VUs, 1321 complete and 0 interrupted iterations
stress_test   [  43% ] 20/50 VUs  2m14.0s/5m10.0s

running (2m15.0s), 20/50 VUs, 1341 complete and 0 interrupted iterations
stress_test   [  44% ] 20/50 VUs  2m15.0s/5m10.0s

running (2m16.0s), 20/50 VUs, 1361 complete and 0 interrupted iterations
stress_test   [  44% ] 20/50 VUs  2m16.0s/5m10.0s

running (2m17.0s), 21/50 VUs, 1381 complete and 0 interrupted iterations
stress_test   [  44% ] 21/50 VUs  2m17.0s/5m10.0s

running (2m18.0s), 21/50 VUs, 1402 complete and 0 interrupted iterations
stress_test   [  45% ] 21/50 VUs  2m18.0s/5m10.0s

running (2m19.0s), 21/50 VUs, 1418 complete and 0 interrupted iterations
stress_test   [  45% ] 21/50 VUs  2m19.0s/5m10.0s

running (2m20.0s), 21/50 VUs, 1433 complete and 0 interrupted iterations
stress_test   [  45% ] 21/50 VUs  2m20.0s/5m10.0s

running (2m21.0s), 21/50 VUs, 1453 complete and 0 interrupted iterations
stress_test   [  45% ] 21/50 VUs  2m21.0s/5m10.0s

running (2m22.0s), 21/50 VUs, 1474 complete and 0 interrupted iterations
stress_test   [  46% ] 21/50 VUs  2m22.0s/5m10.0s

running (2m23.0s), 22/50 VUs, 1495 complete and 0 interrupted iterations
stress_test   [  46% ] 22/50 VUs  2m23.0s/5m10.0s

running (2m24.0s), 22/50 VUs, 1517 complete and 0 interrupted iterations
stress_test   [  46% ] 22/50 VUs  2m24.0s/5m10.0s

running (2m25.0s), 22/50 VUs, 1531 complete and 0 interrupted iterations
stress_test   [  47% ] 22/50 VUs  2m25.0s/5m10.0s

running (2m26.0s), 22/50 VUs, 1553 complete and 0 interrupted iterations
stress_test   [  47% ] 22/50 VUs  2m26.0s/5m10.0s

running (2m27.0s), 22/50 VUs, 1574 complete and 0 interrupted iterations
stress_test   [  47% ] 22/50 VUs  2m27.0s/5m10.0s

running (2m28.0s), 22/50 VUs, 1596 complete and 0 interrupted iterations
stress_test   [  48% ] 22/50 VUs  2m28.0s/5m10.0s

running (2m29.0s), 23/50 VUs, 1618 complete and 0 interrupted iterations
stress_test   [  48% ] 23/50 VUs  2m29.0s/5m10.0s

running (2m30.0s), 23/50 VUs, 1630 complete and 0 interrupted iterations
stress_test   [  48% ] 23/50 VUs  2m30.0s/5m10.0s

running (2m31.0s), 23/50 VUs, 1653 complete and 0 interrupted iterations
stress_test   [  49% ] 23/50 VUs  2m31.0s/5m10.0s

running (2m32.0s), 23/50 VUs, 1676 complete and 0 interrupted iterations
stress_test   [  49% ] 23/50 VUs  2m32.0s/5m10.0s

running (2m33.0s), 23/50 VUs, 1697 complete and 0 interrupted iterations
stress_test   [  49% ] 23/50 VUs  2m33.0s/5m10.0s

running (2m34.0s), 23/50 VUs, 1720 complete and 0 interrupted iterations
stress_test   [  50% ] 23/50 VUs  2m34.0s/5m10.0s

running (2m35.0s), 24/50 VUs, 1743 complete and 0 interrupted iterations
stress_test   [  50% ] 24/50 VUs  2m35.0s/5m10.0s

running (2m36.0s), 24/50 VUs, 1767 complete and 0 interrupted iterations
stress_test   [  50% ] 24/50 VUs  2m36.0s/5m10.0s

running (2m37.0s), 24/50 VUs, 1782 complete and 0 interrupted iterations
stress_test   [  51% ] 24/50 VUs  2m37.0s/5m10.0s

running (2m38.0s), 24/50 VUs, 1806 complete and 0 interrupted iterations
stress_test   [  51% ] 24/50 VUs  2m38.0s/5m10.0s

running (2m39.0s), 24/50 VUs, 1818 complete and 0 interrupted iterations
stress_test   [  51% ] 24/50 VUs  2m39.0s/5m10.0s

running (2m40.0s), 24/50 VUs, 1842 complete and 0 interrupted iterations
stress_test   [  52% ] 24/50 VUs  2m40.0s/5m10.0s

running (2m41.0s), 25/50 VUs, 1866 complete and 0 interrupted iterations
stress_test   [  52% ] 25/50 VUs  2m41.0s/5m10.0s

running (2m42.0s), 25/50 VUs, 1891 complete and 0 interrupted iterations
stress_test   [  52% ] 25/50 VUs  2m42.0s/5m10.0s

running (2m43.0s), 25/50 VUs, 1916 complete and 0 interrupted iterations
stress_test   [  53% ] 25/50 VUs  2m43.0s/5m10.0s

running (2m44.0s), 25/50 VUs, 1941 complete and 0 interrupted iterations
stress_test   [  53% ] 25/50 VUs  2m44.0s/5m10.0s

running (2m45.0s), 25/50 VUs, 1963 complete and 0 interrupted iterations
stress_test   [  53% ] 25/50 VUs  2m45.0s/5m10.0s

running (2m46.0s), 25/50 VUs, 1988 complete and 0 interrupted iterations
stress_test   [  54% ] 25/50 VUs  2m46.0s/5m10.0s

running (2m47.0s), 26/50 VUs, 2013 complete and 0 interrupted iterations
stress_test   [  54% ] 26/50 VUs  2m47.0s/5m10.0s

running (2m48.0s), 26/50 VUs, 2030 complete and 0 interrupted iterations
stress_test   [  54% ] 26/50 VUs  2m48.0s/5m10.0s

running (2m49.0s), 26/50 VUs, 2046 complete and 0 interrupted iterations
stress_test   [  55% ] 26/50 VUs  2m49.0s/5m10.0s

running (2m50.0s), 26/50 VUs, 2070 complete and 0 interrupted iterations
stress_test   [  55% ] 26/50 VUs  2m50.0s/5m10.0s

running (2m51.0s), 26/50 VUs, 2095 complete and 0 interrupted iterations
stress_test   [  55% ] 26/50 VUs  2m51.0s/5m10.0s

running (2m52.0s), 26/50 VUs, 2121 complete and 0 interrupted iterations
stress_test   [  55% ] 26/50 VUs  2m52.0s/5m10.0s

running (2m53.0s), 27/50 VUs, 2147 complete and 0 interrupted iterations
stress_test   [  56% ] 27/50 VUs  2m53.0s/5m10.0s

running (2m54.0s), 27/50 VUs, 2174 complete and 0 interrupted iterations
stress_test   [  56% ] 27/50 VUs  2m54.0s/5m10.0s

running (2m55.0s), 27/50 VUs, 2201 complete and 0 interrupted iterations
stress_test   [  56% ] 27/50 VUs  2m55.0s/5m10.0s

running (2m56.0s), 27/50 VUs, 2228 complete and 0 interrupted iterations
stress_test   [  57% ] 27/50 VUs  2m56.0s/5m10.0s

running (2m57.0s), 27/50 VUs, 2252 complete and 0 interrupted iterations
stress_test   [  57% ] 27/50 VUs  2m57.0s/5m10.0s

running (2m58.0s), 27/50 VUs, 2265 complete and 0 interrupted iterations
stress_test   [  57% ] 27/50 VUs  2m58.0s/5m10.0s

running (2m59.0s), 28/50 VUs, 2289 complete and 0 interrupted iterations
stress_test   [  58% ] 28/50 VUs  2m59.0s/5m10.0s

running (3m00.0s), 28/50 VUs, 2317 complete and 0 interrupted iterations
stress_test   [  58% ] 28/50 VUs  3m00.0s/5m10.0s

running (3m01.0s), 28/50 VUs, 2344 complete and 0 interrupted iterations
stress_test   [  58% ] 28/50 VUs  3m01.0s/5m10.0s

running (3m02.0s), 28/50 VUs, 2367 complete and 0 interrupted iterations
stress_test   [  59% ] 28/50 VUs  3m02.0s/5m10.0s

running (3m03.0s), 28/50 VUs, 2394 complete and 0 interrupted iterations
stress_test   [  59% ] 28/50 VUs  3m03.0s/5m10.0s

running (3m04.0s), 28/50 VUs, 2422 complete and 0 interrupted iterations
stress_test   [  59% ] 28/50 VUs  3m04.0s/5m10.0s

running (3m05.0s), 29/50 VUs, 2450 complete and 0 interrupted iterations
stress_test   [  60% ] 29/50 VUs  3m05.0s/5m10.0s

running (3m06.0s), 29/50 VUs, 2458 complete and 0 interrupted iterations
stress_test   [  60% ] 29/50 VUs  3m06.0s/5m10.0s

running (3m07.0s), 29/50 VUs, 2487 complete and 0 interrupted iterations
stress_test   [  60% ] 29/50 VUs  3m07.0s/5m10.0s

running (3m08.0s), 29/50 VUs, 2516 complete and 0 interrupted iterations
stress_test   [  61% ] 29/50 VUs  3m08.0s/5m10.0s

running (3m09.0s), 29/50 VUs, 2545 complete and 0 interrupted iterations
stress_test   [  61% ] 29/50 VUs  3m09.0s/5m10.0s

running (3m10.0s), 29/50 VUs, 2574 complete and 0 interrupted iterations
stress_test   [  61% ] 29/50 VUs  3m10.0s/5m10.0s

running (3m11.0s), 30/50 VUs, 2603 complete and 0 interrupted iterations
stress_test   [  62% ] 30/50 VUs  3m11.0s/5m10.0s

running (3m12.0s), 30/50 VUs, 2633 complete and 0 interrupted iterations
stress_test   [  62% ] 30/50 VUs  3m12.0s/5m10.0s

running (3m13.0s), 30/50 VUs, 2663 complete and 0 interrupted iterations
stress_test   [  62% ] 30/50 VUs  3m13.0s/5m10.0s

running (3m14.0s), 30/50 VUs, 2684 complete and 0 interrupted iterations
stress_test   [  63% ] 30/50 VUs  3m14.0s/5m10.0s

running (3m15.0s), 30/50 VUs, 2703 complete and 0 interrupted iterations
stress_test   [  63% ] 30/50 VUs  3m15.0s/5m10.0s

running (3m16.0s), 30/50 VUs, 2728 complete and 0 interrupted iterations
stress_test   [  63% ] 30/50 VUs  3m16.0s/5m10.0s

running (3m17.0s), 31/50 VUs, 2754 complete and 0 interrupted iterations
stress_test   [  64% ] 31/50 VUs  3m17.0s/5m10.0s

running (3m18.0s), 31/50 VUs, 2785 complete and 0 interrupted iterations
stress_test   [  64% ] 31/50 VUs  3m18.0s/5m10.0s

running (3m19.0s), 31/50 VUs, 2816 complete and 0 interrupted iterations
stress_test   [  64% ] 31/50 VUs  3m19.0s/5m10.0s

running (3m20.0s), 31/50 VUs, 2847 complete and 0 interrupted iterations
stress_test   [  65% ] 31/50 VUs  3m20.0s/5m10.0s

running (3m21.0s), 31/50 VUs, 2877 complete and 0 interrupted iterations
stress_test   [  65% ] 31/50 VUs  3m21.0s/5m10.0s

running (3m22.0s), 31/50 VUs, 2908 complete and 0 interrupted iterations
stress_test   [  65% ] 31/50 VUs  3m22.0s/5m10.0s

running (3m23.0s), 32/50 VUs, 2939 complete and 0 interrupted iterations
stress_test   [  65% ] 32/50 VUs  3m23.0s/5m10.0s

running (3m24.0s), 32/50 VUs, 2956 complete and 0 interrupted iterations
stress_test   [  66% ] 32/50 VUs  3m24.0s/5m10.0s

running (3m25.0s), 32/50 VUs, 2984 complete and 0 interrupted iterations
stress_test   [  66% ] 32/50 VUs  3m25.0s/5m10.0s

running (3m26.0s), 32/50 VUs, 3016 complete and 0 interrupted iterations
stress_test   [  66% ] 32/50 VUs  3m26.0s/5m10.0s

running (3m27.0s), 32/50 VUs, 3048 complete and 0 interrupted iterations
stress_test   [  67% ] 32/50 VUs  3m27.0s/5m10.0s

running (3m28.0s), 32/50 VUs, 3076 complete and 0 interrupted iterations
stress_test   [  67% ] 32/50 VUs  3m28.0s/5m10.0s

running (3m29.0s), 33/50 VUs, 3101 complete and 0 interrupted iterations
stress_test   [  67% ] 33/50 VUs  3m29.0s/5m10.0s

running (3m30.0s), 33/50 VUs, 3134 complete and 0 interrupted iterations
stress_test   [  68% ] 33/50 VUs  3m30.0s/5m10.0s

running (3m31.0s), 33/50 VUs, 3167 complete and 0 interrupted iterations
stress_test   [  68% ] 33/50 VUs  3m31.0s/5m10.0s

running (3m32.0s), 33/50 VUs, 3187 complete and 0 interrupted iterations
stress_test   [  68% ] 33/50 VUs  3m32.0s/5m10.0s

running (3m33.0s), 33/50 VUs, 3212 complete and 0 interrupted iterations
stress_test   [  69% ] 33/50 VUs  3m33.0s/5m10.0s

running (3m34.0s), 33/50 VUs, 3245 complete and 0 interrupted iterations
stress_test   [  69% ] 33/50 VUs  3m34.0s/5m10.0s

running (3m35.0s), 34/50 VUs, 3278 complete and 0 interrupted iterations
stress_test   [  69% ] 34/50 VUs  3m35.0s/5m10.0s

running (3m36.0s), 34/50 VUs, 3312 complete and 0 interrupted iterations
stress_test   [  70% ] 34/50 VUs  3m36.0s/5m10.0s

running (3m37.0s), 34/50 VUs, 3346 complete and 0 interrupted iterations
stress_test   [  70% ] 34/50 VUs  3m37.0s/5m10.0s

running (3m38.0s), 34/50 VUs, 3368 complete and 0 interrupted iterations
stress_test   [  70% ] 34/50 VUs  3m38.0s/5m10.0s

running (3m39.0s), 34/50 VUs, 3402 complete and 0 interrupted iterations
stress_test   [  71% ] 34/50 VUs  3m39.0s/5m10.0s

running (3m40.0s), 34/50 VUs, 3436 complete and 0 interrupted iterations
stress_test   [  71% ] 34/50 VUs  3m40.0s/5m10.0s

running (3m41.0s), 35/50 VUs, 3465 complete and 0 interrupted iterations
stress_test   [  71% ] 35/50 VUs  3m41.0s/5m10.0s

running (3m42.0s), 35/50 VUs, 3492 complete and 0 interrupted iterations
stress_test   [  72% ] 35/50 VUs  3m42.0s/5m10.0s

running (3m43.0s), 35/50 VUs, 3522 complete and 0 interrupted iterations
stress_test   [  72% ] 35/50 VUs  3m43.0s/5m10.0s

running (3m44.0s), 35/50 VUs, 3553 complete and 0 interrupted iterations
stress_test   [  72% ] 35/50 VUs  3m44.0s/5m10.0s

running (3m45.0s), 35/50 VUs, 3588 complete and 0 interrupted iterations
stress_test   [  73% ] 35/50 VUs  3m45.0s/5m10.0s

running (3m46.0s), 35/50 VUs, 3623 complete and 0 interrupted iterations
stress_test   [  73% ] 35/50 VUs  3m46.0s/5m10.0s

running (3m47.0s), 36/50 VUs, 3658 complete and 0 interrupted iterations
stress_test   [  73% ] 36/50 VUs  3m47.0s/5m10.0s

running (3m48.0s), 36/50 VUs, 3684 complete and 0 interrupted iterations
stress_test   [  74% ] 36/50 VUs  3m48.0s/5m10.0s

running (3m49.0s), 36/50 VUs, 3718 complete and 0 interrupted iterations
stress_test   [  74% ] 36/50 VUs  3m49.0s/5m10.0s

running (3m50.0s), 36/50 VUs, 3754 complete and 0 interrupted iterations
stress_test   [  74% ] 36/50 VUs  3m50.0s/5m10.0s

running (3m51.0s), 36/50 VUs, 3790 complete and 0 interrupted iterations
stress_test   [  75% ] 36/50 VUs  3m51.0s/5m10.0s

running (3m52.0s), 36/50 VUs, 3826 complete and 0 interrupted iterations
stress_test   [  75% ] 36/50 VUs  3m52.0s/5m10.0s

running (3m53.0s), 37/50 VUs, 3849 complete and 0 interrupted iterations
stress_test   [  75% ] 37/50 VUs  3m53.0s/5m10.0s

running (3m54.0s), 37/50 VUs, 3876 complete and 0 interrupted iterations
stress_test   [  75% ] 37/50 VUs  3m54.0s/5m10.0s

running (3m55.0s), 37/50 VUs, 3913 complete and 0 interrupted iterations
stress_test   [  76% ] 37/50 VUs  3m55.0s/5m10.0s

running (3m56.0s), 37/50 VUs, 3950 complete and 0 interrupted iterations
stress_test   [  76% ] 37/50 VUs  3m56.0s/5m10.0s

running (3m57.0s), 37/50 VUs, 3987 complete and 0 interrupted iterations
stress_test   [  76% ] 37/50 VUs  3m57.0s/5m10.0s

running (3m58.0s), 37/50 VUs, 4011 complete and 0 interrupted iterations
stress_test   [  77% ] 37/50 VUs  3m58.0s/5m10.0s

running (3m59.0s), 38/50 VUs, 4048 complete and 0 interrupted iterations
stress_test   [  77% ] 38/50 VUs  3m59.0s/5m10.0s

running (4m00.0s), 38/50 VUs, 4086 complete and 0 interrupted iterations
stress_test   [  77% ] 38/50 VUs  4m00.0s/5m10.0s

running (4m01.0s), 38/50 VUs, 4115 complete and 0 interrupted iterations
stress_test   [  78% ] 38/50 VUs  4m01.0s/5m10.0s

running (4m02.0s), 38/50 VUs, 4138 complete and 0 interrupted iterations
stress_test   [  78% ] 38/50 VUs  4m02.0s/5m10.0s

running (4m03.0s), 38/50 VUs, 4176 complete and 0 interrupted iterations
stress_test   [  78% ] 38/50 VUs  4m03.0s/5m10.0s

running (4m04.0s), 38/50 VUs, 4214 complete and 0 interrupted iterations
stress_test   [  79% ] 38/50 VUs  4m04.0s/5m10.0s

running (4m05.0s), 39/50 VUs, 4252 complete and 0 interrupted iterations
stress_test   [  79% ] 39/50 VUs  4m05.0s/5m10.0s

running (4m06.0s), 39/50 VUs, 4291 complete and 0 interrupted iterations
stress_test   [  79% ] 39/50 VUs  4m06.0s/5m10.0s

running (4m07.0s), 39/50 VUs, 4330 complete and 0 interrupted iterations
stress_test   [  80% ] 39/50 VUs  4m07.0s/5m10.0s

running (4m08.0s), 39/50 VUs, 4366 complete and 0 interrupted iterations
stress_test   [  80% ] 39/50 VUs  4m08.0s/5m10.0s

running (4m09.0s), 39/50 VUs, 4394 complete and 0 interrupted iterations
stress_test   [  80% ] 39/50 VUs  4m09.0s/5m10.0s

running (4m10.0s), 39/50 VUs, 4416 complete and 0 interrupted iterations
stress_test   [  81% ] 39/50 VUs  4m10.0s/5m10.0s

running (4m11.0s), 40/50 VUs, 4455 complete and 0 interrupted iterations
stress_test   [  81% ] 40/50 VUs  4m11.0s/5m10.0s

running (4m12.0s), 40/50 VUs, 4495 complete and 0 interrupted iterations
stress_test   [  81% ] 40/50 VUs  4m12.0s/5m10.0s

running (4m13.0s), 40/50 VUs, 4532 complete and 0 interrupted iterations
stress_test   [  82% ] 40/50 VUs  4m13.0s/5m10.0s

running (4m14.0s), 40/50 VUs, 4567 complete and 0 interrupted iterations
stress_test   [  82% ] 40/50 VUs  4m14.0s/5m10.0s

running (4m15.0s), 40/50 VUs, 4607 complete and 0 interrupted iterations
stress_test   [  82% ] 40/50 VUs  4m15.0s/5m10.0s

running (4m16.0s), 40/50 VUs, 4647 complete and 0 interrupted iterations
stress_test   [  83% ] 40/50 VUs  4m16.0s/5m10.0s

running (4m17.0s), 41/50 VUs, 4675 complete and 0 interrupted iterations
stress_test   [  83% ] 41/50 VUs  4m17.0s/5m10.0s

running (4m18.0s), 41/50 VUs, 4709 complete and 0 interrupted iterations
stress_test   [  83% ] 41/50 VUs  4m18.0s/5m10.0s

running (4m19.0s), 41/50 VUs, 4740 complete and 0 interrupted iterations
stress_test   [  84% ] 41/50 VUs  4m19.0s/5m10.0s

running (4m20.0s), 41/50 VUs, 4778 complete and 0 interrupted iterations
stress_test   [  84% ] 41/50 VUs  4m20.0s/5m10.0s

running (4m21.0s), 41/50 VUs, 4819 complete and 0 interrupted iterations
stress_test   [  84% ] 41/50 VUs  4m21.0s/5m10.0s

running (4m22.0s), 41/50 VUs, 4860 complete and 0 interrupted iterations
stress_test   [  85% ] 41/50 VUs  4m22.0s/5m10.0s

running (4m23.0s), 42/50 VUs, 4901 complete and 0 interrupted iterations
stress_test   [  85% ] 42/50 VUs  4m23.0s/5m10.0s

running (4m24.0s), 42/50 VUs, 4943 complete and 0 interrupted iterations
stress_test   [  85% ] 42/50 VUs  4m24.0s/5m10.0s

running (4m25.0s), 42/50 VUs, 4977 complete and 0 interrupted iterations
stress_test   [  85% ] 42/50 VUs  4m25.0s/5m10.0s

running (4m26.0s), 42/50 VUs, 5019 complete and 0 interrupted iterations
stress_test   [  86% ] 42/50 VUs  4m26.0s/5m10.0s

running (4m27.0s), 42/50 VUs, 5047 complete and 0 interrupted iterations
stress_test   [  86% ] 42/50 VUs  4m27.0s/5m10.0s

running (4m28.0s), 42/50 VUs, 5086 complete and 0 interrupted iterations
stress_test   [  86% ] 42/50 VUs  4m28.0s/5m10.0s

running (4m29.0s), 43/50 VUs, 5124 complete and 0 interrupted iterations
stress_test   [  87% ] 43/50 VUs  4m29.0s/5m10.0s

running (4m30.0s), 43/50 VUs, 5155 complete and 0 interrupted iterations
stress_test   [  87% ] 43/50 VUs  4m30.0s/5m10.0s

running (4m31.0s), 43/50 VUs, 5198 complete and 0 interrupted iterations
stress_test   [  87% ] 43/50 VUs  4m31.0s/5m10.0s

running (4m32.0s), 43/50 VUs, 5241 complete and 0 interrupted iterations
stress_test   [  88% ] 43/50 VUs  4m32.0s/5m10.0s

running (4m33.0s), 43/50 VUs, 5284 complete and 0 interrupted iterations
stress_test   [  88% ] 43/50 VUs  4m33.0s/5m10.0s

running (4m34.0s), 43/50 VUs, 5326 complete and 0 interrupted iterations
stress_test   [  88% ] 43/50 VUs  4m34.0s/5m10.0s

running (4m35.0s), 44/50 VUs, 5369 complete and 0 interrupted iterations
stress_test   [  89% ] 44/50 VUs  4m35.0s/5m10.0s

running (4m36.0s), 44/50 VUs, 5405 complete and 0 interrupted iterations
stress_test   [  89% ] 44/50 VUs  4m36.0s/5m10.0s

running (4m37.0s), 44/50 VUs, 5449 complete and 0 interrupted iterations
stress_test   [  89% ] 44/50 VUs  4m37.0s/5m10.0s

running (4m38.0s), 44/50 VUs, 5469 complete and 0 interrupted iterations
stress_test   [  90% ] 44/50 VUs  4m38.0s/5m10.0s

running (4m39.0s), 44/50 VUs, 5509 complete and 0 interrupted iterations
stress_test   [  90% ] 44/50 VUs  4m39.0s/5m10.0s

running (4m40.0s), 44/50 VUs, 5547 complete and 0 interrupted iterations
stress_test   [  90% ] 44/50 VUs  4m40.0s/5m10.0s

running (4m41.0s), 45/50 VUs, 5591 complete and 0 interrupted iterations
stress_test   [  91% ] 45/50 VUs  4m41.0s/5m10.0s

running (4m42.0s), 45/50 VUs, 5636 complete and 0 interrupted iterations
stress_test   [  91% ] 45/50 VUs  4m42.0s/5m10.0s

running (4m43.0s), 45/50 VUs, 5681 complete and 0 interrupted iterations
stress_test   [  91% ] 45/50 VUs  4m43.0s/5m10.0s

running (4m44.0s), 45/50 VUs, 5726 complete and 0 interrupted iterations
stress_test   [  92% ] 45/50 VUs  4m44.0s/5m10.0s

running (4m45.0s), 45/50 VUs, 5771 complete and 0 interrupted iterations
stress_test   [  92% ] 45/50 VUs  4m45.0s/5m10.0s

running (4m46.0s), 45/50 VUs, 5806 complete and 0 interrupted iterations
stress_test   [  92% ] 45/50 VUs  4m46.0s/5m10.0s

running (4m47.0s), 46/50 VUs, 5843 complete and 0 interrupted iterations
stress_test   [  93% ] 46/50 VUs  4m47.0s/5m10.0s

running (4m48.0s), 46/50 VUs, 5874 complete and 0 interrupted iterations
stress_test   [  93% ] 46/50 VUs  4m48.0s/5m10.0s

running (4m49.0s), 46/50 VUs, 5920 complete and 0 interrupted iterations
stress_test   [  93% ] 46/50 VUs  4m49.0s/5m10.0s

running (4m50.0s), 46/50 VUs, 5965 complete and 0 interrupted iterations
stress_test   [  94% ] 46/50 VUs  4m50.0s/5m10.0s

running (4m51.0s), 46/50 VUs, 6000 complete and 0 interrupted iterations
stress_test   [  94% ] 46/50 VUs  4m51.0s/5m10.0s

running (4m52.0s), 46/50 VUs, 6046 complete and 0 interrupted iterations
stress_test   [  94% ] 46/50 VUs  4m52.0s/5m10.0s

running (4m53.0s), 47/50 VUs, 6092 complete and 0 interrupted iterations
stress_test   [  95% ] 47/50 VUs  4m53.0s/5m10.0s

running (4m54.0s), 47/50 VUs, 6139 complete and 0 interrupted iterations
stress_test   [  95% ] 47/50 VUs  4m54.0s/5m10.0s

running (4m55.0s), 47/50 VUs, 6186 complete and 0 interrupted iterations
stress_test   [  95% ] 47/50 VUs  4m55.0s/5m10.0s

running (4m56.0s), 47/50 VUs, 6215 complete and 0 interrupted iterations
stress_test   [  95% ] 47/50 VUs  4m56.0s/5m10.0s

running (4m57.0s), 47/50 VUs, 6256 complete and 0 interrupted iterations
stress_test   [  96% ] 47/50 VUs  4m57.0s/5m10.0s

running (4m58.0s), 47/50 VUs, 6293 complete and 0 interrupted iterations
stress_test   [  96% ] 47/50 VUs  4m58.0s/5m10.0s

running (4m59.0s), 48/50 VUs, 6340 complete and 0 interrupted iterations
stress_test   [  96% ] 48/50 VUs  4m59.0s/5m10.0s

running (5m00.0s), 48/50 VUs, 6388 complete and 0 interrupted iterations
stress_test   [  97% ] 48/50 VUs  5m00.0s/5m10.0s

running (5m01.0s), 48/50 VUs, 6436 complete and 0 interrupted iterations
stress_test   [  97% ] 48/50 VUs  5m01.0s/5m10.0s

running (5m02.0s), 48/50 VUs, 6478 complete and 0 interrupted iterations
stress_test   [  97% ] 48/50 VUs  5m02.0s/5m10.0s

running (5m03.0s), 48/50 VUs, 6519 complete and 0 interrupted iterations
stress_test   [  98% ] 48/50 VUs  5m03.0s/5m10.0s

running (5m04.0s), 48/50 VUs, 6567 complete and 0 interrupted iterations
stress_test   [  98% ] 48/50 VUs  5m04.0s/5m10.0s

running (5m05.0s), 49/50 VUs, 6608 complete and 0 interrupted iterations
stress_test   [  98% ] 49/50 VUs  5m05.0s/5m10.0s

running (5m06.0s), 49/50 VUs, 6645 complete and 0 interrupted iterations
stress_test   [  99% ] 49/50 VUs  5m06.0s/5m10.0s

running (5m07.0s), 49/50 VUs, 6689 complete and 0 interrupted iterations
stress_test   [  99% ] 49/50 VUs  5m07.0s/5m10.0s

running (5m08.0s), 49/50 VUs, 6727 complete and 0 interrupted iterations
stress_test   [  99% ] 49/50 VUs  5m08.0s/5m10.0s

running (5m09.0s), 49/50 VUs, 6776 complete and 0 interrupted iterations
stress_test   [ 100% ] 49/50 VUs  5m09.0s/5m10.0s

running (5m10.0s), 49/50 VUs, 6825 complete and 0 interrupted iterations
stress_test   [ 100% ] 49/50 VUs  5m10.0s/5m10.0s


  █ THRESHOLDS 

    failures
    ✓ 'rate<0.01' rate=0.00%

    http_req_duration
    ✓ 'p(95)<1500' p(95)=112.55ms

    http_req_failed
    ✓ 'rate<0.01' rate=0.00%


  █ TOTAL RESULTS 

    checks_total.......: 20622   66.343455/s
    checks_succeeded...: 100.00% 20622 out of 20622
    checks_failed......: 0.00%   0 out of 20622

    ✓ login page status 200
    ✓ login redirect success
    ✓ logout redirect success

    CUSTOM
    failures.......................: 0.00%  0 out of 0

    HTTP
    http_req_duration..............: avg=27.03ms min=132µs med=1.66ms max=257.91ms p(90)=101.59ms p(95)=112.55ms p(99)=144.27ms
      { expected_response:true }...: avg=27.03ms min=132µs med=1.66ms max=257.91ms p(90)=101.59ms p(95)=112.55ms p(99)=144.27ms
    http_req_failed................: 0.00%  0 out of 27496
    http_reqs......................: 27496  88.45794/s

    EXECUTION
    iteration_duration.............: avg=1.1s    min=1.08s med=1.1s   max=1.44s    p(90)=1.13s    p(95)=1.14s    p(99)=1.18s   
    iterations.....................: 6874   22.114485/s
    vus............................: 49     min=5          max=49
    vus_max........................: 50     min=50         max=50

    NETWORK
    data_received..................: 61 MB  196 kB/s
    data_sent......................: 5.9 MB 19 kB/s




running (5m10.8s), 00/50 VUs, 6874 complete and 0 interrupted iterations
stress_test ✓ [ 100% ] 00/50 VUs  5m10s
