
         /\      Grafana   /‾‾/  
    /\  /  \     |\  __   /  /   
   /  \/    \    | |/ /  /   ‾‾\ 
  /          \   |   (  |  (‾)  |
 / __________ \  |_|\_\  \_____/ 

     execution: local
        script: load-testing/k6/stress/auth.stress.js
        output: -

     scenarios: (100.00%) 1 scenario, 200 max VUs, 6m40s max duration (incl. graceful stop):
              * stress_test: Up to 200 looping VUs for 6m10s over 7 stages (gracefulRampDown: 30s, gracefulStop: 30s)


running (0m01.0s), 005/200 VUs, 0 complete and 0 interrupted iterations
stress_test   [   0% ] 005/200 VUs  0m01.0s/6m10.0s

running (0m02.0s), 005/200 VUs, 5 complete and 0 interrupted iterations
stress_test   [   1% ] 005/200 VUs  0m02.0s/6m10.0s

running (0m03.0s), 005/200 VUs, 10 complete and 0 interrupted iterations
stress_test   [   1% ] 005/200 VUs  0m03.0s/6m10.0s

running (0m04.0s), 005/200 VUs, 15 complete and 0 interrupted iterations
stress_test   [   1% ] 005/200 VUs  0m04.0s/6m10.0s

running (0m05.0s), 005/200 VUs, 20 complete and 0 interrupted iterations
stress_test   [   1% ] 005/200 VUs  0m05.0s/6m10.0s

running (0m06.0s), 005/200 VUs, 25 complete and 0 interrupted iterations
stress_test   [   2% ] 005/200 VUs  0m06.0s/6m10.0s

running (0m07.0s), 005/200 VUs, 30 complete and 0 interrupted iterations
stress_test   [   2% ] 005/200 VUs  0m07.0s/6m10.0s

running (0m08.0s), 005/200 VUs, 35 complete and 0 interrupted iterations
stress_test   [   2% ] 005/200 VUs  0m08.0s/6m10.0s

running (0m09.0s), 005/200 VUs, 40 complete and 0 interrupted iterations
stress_test   [   2% ] 005/200 VUs  0m09.0s/6m10.0s

running (0m10.0s), 005/200 VUs, 45 complete and 0 interrupted iterations
stress_test   [   3% ] 005/200 VUs  0m10.0s/6m10.0s

running (0m11.0s), 005/200 VUs, 50 complete and 0 interrupted iterations
stress_test   [   3% ] 005/200 VUs  0m11.0s/6m10.0s

running (0m12.0s), 005/200 VUs, 50 complete and 0 interrupted iterations
stress_test   [   3% ] 005/200 VUs  0m12.0s/6m10.0s

running (0m13.0s), 006/200 VUs, 55 complete and 0 interrupted iterations
stress_test   [   4% ] 006/200 VUs  0m13.0s/6m10.0s

running (0m14.0s), 006/200 VUs, 61 complete and 0 interrupted iterations
stress_test   [   4% ] 006/200 VUs  0m14.0s/6m10.0s

running (0m15.0s), 006/200 VUs, 67 complete and 0 interrupted iterations
stress_test   [   4% ] 006/200 VUs  0m15.0s/6m10.0s

running (0m16.0s), 006/200 VUs, 73 complete and 0 interrupted iterations
stress_test   [   4% ] 006/200 VUs  0m16.0s/6m10.0s

running (0m17.0s), 006/200 VUs, 79 complete and 0 interrupted iterations
stress_test   [   5% ] 006/200 VUs  0m17.0s/6m10.0s

running (0m18.0s), 006/200 VUs, 85 complete and 0 interrupted iterations
stress_test   [   5% ] 006/200 VUs  0m18.0s/6m10.0s

running (0m19.0s), 006/200 VUs, 91 complete and 0 interrupted iterations
stress_test   [   5% ] 006/200 VUs  0m19.0s/6m10.0s

running (0m20.0s), 006/200 VUs, 97 complete and 0 interrupted iterations
stress_test   [   5% ] 006/200 VUs  0m20.0s/6m10.0s

running (0m21.0s), 006/200 VUs, 103 complete and 0 interrupted iterations
stress_test   [   6% ] 006/200 VUs  0m21.0s/6m10.0s

running (0m22.0s), 006/200 VUs, 109 complete and 0 interrupted iterations
stress_test   [   6% ] 006/200 VUs  0m22.0s/6m10.0s

running (0m23.0s), 006/200 VUs, 115 complete and 0 interrupted iterations
stress_test   [   6% ] 006/200 VUs  0m23.0s/6m10.0s

running (0m24.0s), 006/200 VUs, 115 complete and 0 interrupted iterations
stress_test   [   6% ] 006/200 VUs  0m24.0s/6m10.0s

running (0m25.0s), 007/200 VUs, 121 complete and 0 interrupted iterations
stress_test   [   7% ] 007/200 VUs  0m25.0s/6m10.0s

running (0m26.0s), 007/200 VUs, 128 complete and 0 interrupted iterations
stress_test   [   7% ] 007/200 VUs  0m26.0s/6m10.0s

running (0m27.0s), 007/200 VUs, 135 complete and 0 interrupted iterations
stress_test   [   7% ] 007/200 VUs  0m27.0s/6m10.0s

running (0m28.0s), 007/200 VUs, 142 complete and 0 interrupted iterations
stress_test   [   8% ] 007/200 VUs  0m28.0s/6m10.0s

running (0m29.0s), 007/200 VUs, 149 complete and 0 interrupted iterations
stress_test   [   8% ] 007/200 VUs  0m29.0s/6m10.0s

running (0m30.0s), 007/200 VUs, 156 complete and 0 interrupted iterations
stress_test   [   8% ] 007/200 VUs  0m30.0s/6m10.0s

running (0m31.0s), 007/200 VUs, 163 complete and 0 interrupted iterations
stress_test   [   8% ] 007/200 VUs  0m31.0s/6m10.0s

running (0m32.0s), 007/200 VUs, 170 complete and 0 interrupted iterations
stress_test   [   9% ] 007/200 VUs  0m32.0s/6m10.0s

running (0m33.0s), 007/200 VUs, 177 complete and 0 interrupted iterations
stress_test   [   9% ] 007/200 VUs  0m33.0s/6m10.0s

running (0m34.0s), 007/200 VUs, 184 complete and 0 interrupted iterations
stress_test   [   9% ] 007/200 VUs  0m34.0s/6m10.0s

running (0m35.0s), 007/200 VUs, 184 complete and 0 interrupted iterations
stress_test   [   9% ] 007/200 VUs  0m35.0s/6m10.0s

running (0m36.0s), 007/200 VUs, 191 complete and 0 interrupted iterations
stress_test   [  10% ] 007/200 VUs  0m36.0s/6m10.0s

running (0m37.0s), 008/200 VUs, 198 complete and 0 interrupted iterations
stress_test   [  10% ] 008/200 VUs  0m37.0s/6m10.0s

running (0m38.0s), 008/200 VUs, 206 complete and 0 interrupted iterations
stress_test   [  10% ] 008/200 VUs  0m38.0s/6m10.0s

running (0m39.0s), 008/200 VUs, 214 complete and 0 interrupted iterations
stress_test   [  11% ] 008/200 VUs  0m39.0s/6m10.0s

running (0m40.0s), 008/200 VUs, 222 complete and 0 interrupted iterations
stress_test   [  11% ] 008/200 VUs  0m40.0s/6m10.0s

running (0m41.0s), 008/200 VUs, 230 complete and 0 interrupted iterations
stress_test   [  11% ] 008/200 VUs  0m41.0s/6m10.0s

running (0m42.0s), 008/200 VUs, 238 complete and 0 interrupted iterations
stress_test   [  11% ] 008/200 VUs  0m42.0s/6m10.0s

running (0m43.0s), 008/200 VUs, 246 complete and 0 interrupted iterations
stress_test   [  12% ] 008/200 VUs  0m43.0s/6m10.0s

running (0m44.0s), 008/200 VUs, 254 complete and 0 interrupted iterations
stress_test   [  12% ] 008/200 VUs  0m44.0s/6m10.0s

running (0m45.0s), 008/200 VUs, 262 complete and 0 interrupted iterations
stress_test   [  12% ] 008/200 VUs  0m45.0s/6m10.0s

running (0m46.0s), 008/200 VUs, 262 complete and 0 interrupted iterations
stress_test   [  12% ] 008/200 VUs  0m46.0s/6m10.0s

running (0m47.0s), 008/200 VUs, 270 complete and 0 interrupted iterations
stress_test   [  13% ] 008/200 VUs  0m47.0s/6m10.0s

running (0m48.0s), 008/200 VUs, 278 complete and 0 interrupted iterations
stress_test   [  13% ] 008/200 VUs  0m48.0s/6m10.0s

running (0m49.0s), 009/200 VUs, 286 complete and 0 interrupted iterations
stress_test   [  13% ] 009/200 VUs  0m49.0s/6m10.0s

running (0m50.0s), 009/200 VUs, 295 complete and 0 interrupted iterations
stress_test   [  14% ] 009/200 VUs  0m50.0s/6m10.0s

running (0m51.0s), 009/200 VUs, 304 complete and 0 interrupted iterations
stress_test   [  14% ] 009/200 VUs  0m51.0s/6m10.0s

running (0m52.0s), 009/200 VUs, 313 complete and 0 interrupted iterations
stress_test   [  14% ] 009/200 VUs  0m52.0s/6m10.0s

running (0m53.0s), 009/200 VUs, 322 complete and 0 interrupted iterations
stress_test   [  14% ] 009/200 VUs  0m53.0s/6m10.0s

running (0m54.0s), 009/200 VUs, 331 complete and 0 interrupted iterations
stress_test   [  15% ] 009/200 VUs  0m54.0s/6m10.0s

running (0m55.0s), 009/200 VUs, 340 complete and 0 interrupted iterations
stress_test   [  15% ] 009/200 VUs  0m55.0s/6m10.0s

running (0m56.0s), 009/200 VUs, 349 complete and 0 interrupted iterations
stress_test   [  15% ] 009/200 VUs  0m56.0s/6m10.0s

running (0m57.0s), 009/200 VUs, 358 complete and 0 interrupted iterations
stress_test   [  15% ] 009/200 VUs  0m57.0s/6m10.0s

running (0m58.0s), 009/200 VUs, 359 complete and 0 interrupted iterations
stress_test   [  16% ] 009/200 VUs  0m58.0s/6m10.0s

running (0m59.0s), 009/200 VUs, 367 complete and 0 interrupted iterations
stress_test   [  16% ] 009/200 VUs  0m59.0s/6m10.0s

running (1m00.0s), 009/200 VUs, 376 complete and 0 interrupted iterations
stress_test   [  16% ] 009/200 VUs  1m00.0s/6m10.0s

running (1m01.0s), 010/200 VUs, 385 complete and 0 interrupted iterations
stress_test   [  16% ] 010/200 VUs  1m01.0s/6m10.0s

running (1m02.0s), 010/200 VUs, 395 complete and 0 interrupted iterations
stress_test   [  17% ] 010/200 VUs  1m02.0s/6m10.0s

running (1m03.0s), 010/200 VUs, 405 complete and 0 interrupted iterations
stress_test   [  17% ] 010/200 VUs  1m03.0s/6m10.0s

running (1m04.0s), 010/200 VUs, 415 complete and 0 interrupted iterations
stress_test   [  17% ] 010/200 VUs  1m04.0s/6m10.0s

running (1m05.0s), 010/200 VUs, 425 complete and 0 interrupted iterations
stress_test   [  18% ] 010/200 VUs  1m05.0s/6m10.0s

running (1m06.0s), 010/200 VUs, 435 complete and 0 interrupted iterations
stress_test   [  18% ] 010/200 VUs  1m06.0s/6m10.0s

running (1m07.0s), 010/200 VUs, 445 complete and 0 interrupted iterations
stress_test   [  18% ] 010/200 VUs  1m07.0s/6m10.0s

running (1m08.0s), 010/200 VUs, 455 complete and 0 interrupted iterations
stress_test   [  18% ] 010/200 VUs  1m08.0s/6m10.0s

running (1m09.0s), 010/200 VUs, 465 complete and 0 interrupted iterations
stress_test   [  19% ] 010/200 VUs  1m09.0s/6m10.0s

running (1m10.0s), 010/200 VUs, 466 complete and 0 interrupted iterations
stress_test   [  19% ] 010/200 VUs  1m10.0s/6m10.0s

running (1m11.0s), 010/200 VUs, 475 complete and 0 interrupted iterations
stress_test   [  19% ] 010/200 VUs  1m11.0s/6m10.0s

running (1m12.0s), 010/200 VUs, 485 complete and 0 interrupted iterations
stress_test   [  19% ] 010/200 VUs  1m12.0s/6m10.0s

running (1m13.0s), 010/200 VUs, 495 complete and 0 interrupted iterations
stress_test   [  20% ] 010/200 VUs  1m13.0s/6m10.0s

running (1m14.0s), 011/200 VUs, 505 complete and 0 interrupted iterations
stress_test   [  20% ] 011/200 VUs  1m14.0s/6m10.0s

running (1m15.0s), 011/200 VUs, 516 complete and 0 interrupted iterations
stress_test   [  20% ] 011/200 VUs  1m15.0s/6m10.0s

running (1m16.0s), 011/200 VUs, 527 complete and 0 interrupted iterations
stress_test   [  21% ] 011/200 VUs  1m16.0s/6m10.0s

running (1m17.0s), 012/200 VUs, 538 complete and 0 interrupted iterations
stress_test   [  21% ] 012/200 VUs  1m17.0s/6m10.0s

running (1m18.0s), 012/200 VUs, 550 complete and 0 interrupted iterations
stress_test   [  21% ] 012/200 VUs  1m18.0s/6m10.0s

running (1m19.0s), 012/200 VUs, 562 complete and 0 interrupted iterations
stress_test   [  21% ] 012/200 VUs  1m19.0s/6m10.0s

running (1m20.0s), 013/200 VUs, 574 complete and 0 interrupted iterations
stress_test   [  22% ] 013/200 VUs  1m20.0s/6m10.0s

running (1m21.0s), 013/200 VUs, 585 complete and 0 interrupted iterations
stress_test   [  22% ] 013/200 VUs  1m21.0s/6m10.0s

running (1m22.0s), 013/200 VUs, 590 complete and 0 interrupted iterations
stress_test   [  22% ] 013/200 VUs  1m22.0s/6m10.0s

running (1m23.0s), 014/200 VUs, 603 complete and 0 interrupted iterations
stress_test   [  22% ] 014/200 VUs  1m23.0s/6m10.0s

running (1m24.0s), 014/200 VUs, 616 complete and 0 interrupted iterations
stress_test   [  23% ] 014/200 VUs  1m24.0s/6m10.0s

running (1m25.0s), 014/200 VUs, 630 complete and 0 interrupted iterations
stress_test   [  23% ] 014/200 VUs  1m25.0s/6m10.0s

running (1m26.0s), 015/200 VUs, 644 complete and 0 interrupted iterations
stress_test   [  23% ] 015/200 VUs  1m26.0s/6m10.0s

running (1m27.0s), 015/200 VUs, 658 complete and 0 interrupted iterations
stress_test   [  24% ] 015/200 VUs  1m27.0s/6m10.0s

running (1m28.0s), 015/200 VUs, 673 complete and 0 interrupted iterations
stress_test   [  24% ] 015/200 VUs  1m28.0s/6m10.0s

running (1m29.0s), 016/200 VUs, 688 complete and 0 interrupted iterations
stress_test   [  24% ] 016/200 VUs  1m29.0s/6m10.0s

running (1m30.0s), 016/200 VUs, 704 complete and 0 interrupted iterations
stress_test   [  24% ] 016/200 VUs  1m30.0s/6m10.0s

running (1m31.0s), 016/200 VUs, 719 complete and 0 interrupted iterations
stress_test   [  25% ] 016/200 VUs  1m31.0s/6m10.0s

running (1m32.0s), 017/200 VUs, 735 complete and 0 interrupted iterations
stress_test   [  25% ] 017/200 VUs  1m32.0s/6m10.0s

running (1m33.0s), 017/200 VUs, 741 complete and 0 interrupted iterations
stress_test   [  25% ] 017/200 VUs  1m33.0s/6m10.0s

running (1m34.0s), 017/200 VUs, 758 complete and 0 interrupted iterations
stress_test   [  25% ] 017/200 VUs  1m34.0s/6m10.0s

running (1m35.0s), 018/200 VUs, 775 complete and 0 interrupted iterations
stress_test   [  26% ] 018/200 VUs  1m35.0s/6m10.0s

running (1m36.0s), 018/200 VUs, 793 complete and 0 interrupted iterations
stress_test   [  26% ] 018/200 VUs  1m36.0s/6m10.0s

running (1m37.0s), 018/200 VUs, 810 complete and 0 interrupted iterations
stress_test   [  26% ] 018/200 VUs  1m37.0s/6m10.0s

running (1m38.0s), 019/200 VUs, 827 complete and 0 interrupted iterations
stress_test   [  26% ] 019/200 VUs  1m38.0s/6m10.0s

running (1m39.0s), 019/200 VUs, 844 complete and 0 interrupted iterations
stress_test   [  27% ] 019/200 VUs  1m39.0s/6m10.0s

running (1m40.0s), 019/200 VUs, 863 complete and 0 interrupted iterations
stress_test   [  27% ] 019/200 VUs  1m40.0s/6m10.0s

running (1m41.0s), 020/200 VUs, 882 complete and 0 interrupted iterations
stress_test   [  27% ] 020/200 VUs  1m41.0s/6m10.0s

running (1m42.0s), 020/200 VUs, 902 complete and 0 interrupted iterations
stress_test   [  28% ] 020/200 VUs  1m42.0s/6m10.0s

running (1m43.0s), 020/200 VUs, 909 complete and 0 interrupted iterations
stress_test   [  28% ] 020/200 VUs  1m43.0s/6m10.0s

running (1m44.0s), 021/200 VUs, 929 complete and 0 interrupted iterations
stress_test   [  28% ] 021/200 VUs  1m44.0s/6m10.0s

running (1m45.0s), 021/200 VUs, 949 complete and 0 interrupted iterations
stress_test   [  28% ] 021/200 VUs  1m45.0s/6m10.0s

running (1m46.0s), 021/200 VUs, 970 complete and 0 interrupted iterations
stress_test   [  29% ] 021/200 VUs  1m46.0s/6m10.0s

running (1m47.0s), 022/200 VUs, 991 complete and 0 interrupted iterations
stress_test   [  29% ] 022/200 VUs  1m47.0s/6m10.0s

running (1m48.0s), 022/200 VUs, 1013 complete and 0 interrupted iterations
stress_test   [  29% ] 022/200 VUs  1m48.0s/6m10.0s

running (1m49.0s), 022/200 VUs, 1035 complete and 0 interrupted iterations
stress_test   [  29% ] 022/200 VUs  1m49.0s/6m10.0s

running (1m50.0s), 023/200 VUs, 1055 complete and 0 interrupted iterations
stress_test   [  30% ] 023/200 VUs  1m50.0s/6m10.0s

running (1m51.0s), 023/200 VUs, 1075 complete and 0 interrupted iterations
stress_test   [  30% ] 023/200 VUs  1m51.0s/6m10.0s

running (1m52.0s), 023/200 VUs, 1098 complete and 0 interrupted iterations
stress_test   [  30% ] 023/200 VUs  1m52.0s/6m10.0s

running (1m53.0s), 024/200 VUs, 1106 complete and 0 interrupted iterations
stress_test   [  31% ] 024/200 VUs  1m53.0s/6m10.0s

running (1m54.0s), 024/200 VUs, 1130 complete and 0 interrupted iterations
stress_test   [  31% ] 024/200 VUs  1m54.0s/6m10.0s

running (1m55.0s), 024/200 VUs, 1154 complete and 0 interrupted iterations
stress_test   [  31% ] 024/200 VUs  1m55.0s/6m10.0s

running (1m56.0s), 025/200 VUs, 1178 complete and 0 interrupted iterations
stress_test   [  31% ] 025/200 VUs  1m56.0s/6m10.0s

running (1m57.0s), 025/200 VUs, 1201 complete and 0 interrupted iterations
stress_test   [  32% ] 025/200 VUs  1m57.0s/6m10.0s

running (1m58.0s), 025/200 VUs, 1226 complete and 0 interrupted iterations
stress_test   [  32% ] 025/200 VUs  1m58.0s/6m10.0s

running (1m59.0s), 026/200 VUs, 1251 complete and 0 interrupted iterations
stress_test   [  32% ] 026/200 VUs  1m59.0s/6m10.0s

running (2m00.0s), 026/200 VUs, 1269 complete and 0 interrupted iterations
stress_test   [  32% ] 026/200 VUs  2m00.0s/6m10.0s

running (2m01.0s), 026/200 VUs, 1286 complete and 0 interrupted iterations
stress_test   [  33% ] 026/200 VUs  2m01.0s/6m10.0s

running (2m02.0s), 027/200 VUs, 1308 complete and 0 interrupted iterations
stress_test   [  33% ] 027/200 VUs  2m02.0s/6m10.0s

running (2m03.0s), 027/200 VUs, 1334 complete and 0 interrupted iterations
stress_test   [  33% ] 027/200 VUs  2m03.0s/6m10.0s

running (2m04.0s), 027/200 VUs, 1361 complete and 0 interrupted iterations
stress_test   [  34% ] 027/200 VUs  2m04.0s/6m10.0s

running (2m05.0s), 028/200 VUs, 1388 complete and 0 interrupted iterations
stress_test   [  34% ] 028/200 VUs  2m05.0s/6m10.0s

running (2m06.0s), 028/200 VUs, 1416 complete and 0 interrupted iterations
stress_test   [  34% ] 028/200 VUs  2m06.0s/6m10.0s

running (2m07.0s), 028/200 VUs, 1443 complete and 0 interrupted iterations
stress_test   [  34% ] 028/200 VUs  2m07.0s/6m10.0s

running (2m08.0s), 029/200 VUs, 1471 complete and 0 interrupted iterations
stress_test   [  35% ] 029/200 VUs  2m08.0s/6m10.0s

running (2m09.0s), 029/200 VUs, 1498 complete and 0 interrupted iterations
stress_test   [  35% ] 029/200 VUs  2m09.0s/6m10.0s

running (2m10.0s), 029/200 VUs, 1513 complete and 0 interrupted iterations
stress_test   [  35% ] 029/200 VUs  2m10.0s/6m10.0s

running (2m11.0s), 030/200 VUs, 1542 complete and 0 interrupted iterations
stress_test   [  35% ] 030/200 VUs  2m11.0s/6m10.0s

running (2m12.0s), 030/200 VUs, 1568 complete and 0 interrupted iterations
stress_test   [  36% ] 030/200 VUs  2m12.0s/6m10.0s

running (2m13.0s), 031/200 VUs, 1598 complete and 0 interrupted iterations
stress_test   [  36% ] 031/200 VUs  2m13.0s/6m10.0s

running (2m14.0s), 031/200 VUs, 1627 complete and 0 interrupted iterations
stress_test   [  36% ] 031/200 VUs  2m14.0s/6m10.0s

running (2m15.0s), 032/200 VUs, 1653 complete and 0 interrupted iterations
stress_test   [  36% ] 032/200 VUs  2m15.0s/6m10.0s

running (2m16.0s), 032/200 VUs, 1685 complete and 0 interrupted iterations
stress_test   [  37% ] 032/200 VUs  2m16.0s/6m10.0s

running (2m16.0s), 032/200 VUs, 1685 complete and 0 interrupted iterations
stress_test   [  37% ] 032/200 VUs  2m16.0s/6m10.0s

running (2m17.0s), 033/200 VUs, 1717 complete and 0 interrupted iterations
stress_test   [  37% ] 033/200 VUs  2m17.0s/6m10.0s

running (2m18.0s), 033/200 VUs, 1750 complete and 0 interrupted iterations
stress_test   [  37% ] 033/200 VUs  2m18.0s/6m10.0s

running (2m19.0s), 034/200 VUs, 1781 complete and 0 interrupted iterations
stress_test   [  38% ] 034/200 VUs  2m19.0s/6m10.0s

running (2m20.0s), 034/200 VUs, 1806 complete and 0 interrupted iterations
stress_test   [  38% ] 034/200 VUs  2m20.0s/6m10.0s

running (2m21.0s), 035/200 VUs, 1836 complete and 0 interrupted iterations
stress_test   [  38% ] 035/200 VUs  2m21.0s/6m10.0s

running (2m22.0s), 035/200 VUs, 1868 complete and 0 interrupted iterations
stress_test   [  38% ] 035/200 VUs  2m22.0s/6m10.0s

running (2m23.0s), 036/200 VUs, 1902 complete and 0 interrupted iterations
stress_test   [  39% ] 036/200 VUs  2m23.0s/6m10.0s

running (2m24.0s), 036/200 VUs, 1933 complete and 0 interrupted iterations
stress_test   [  39% ] 036/200 VUs  2m24.0s/6m10.0s

running (2m25.0s), 037/200 VUs, 1969 complete and 0 interrupted iterations
stress_test   [  39% ] 037/200 VUs  2m25.0s/6m10.0s

running (2m26.0s), 037/200 VUs, 2006 complete and 0 interrupted iterations
stress_test   [  39% ] 037/200 VUs  2m26.0s/6m10.0s

running (2m27.0s), 038/200 VUs, 2036 complete and 0 interrupted iterations
stress_test   [  40% ] 038/200 VUs  2m27.0s/6m10.0s

running (2m28.0s), 038/200 VUs, 2072 complete and 0 interrupted iterations
stress_test   [  40% ] 038/200 VUs  2m28.0s/6m10.0s

running (2m29.0s), 039/200 VUs, 2110 complete and 0 interrupted iterations
stress_test   [  40% ] 039/200 VUs  2m29.0s/6m10.0s

running (2m30.0s), 039/200 VUs, 2149 complete and 0 interrupted iterations
stress_test   [  41% ] 039/200 VUs  2m30.0s/6m10.0s

running (2m31.0s), 040/200 VUs, 2184 complete and 0 interrupted iterations
stress_test   [  41% ] 040/200 VUs  2m31.0s/6m10.0s

running (2m32.0s), 040/200 VUs, 2217 complete and 0 interrupted iterations
stress_test   [  41% ] 040/200 VUs  2m32.0s/6m10.0s

running (2m33.0s), 041/200 VUs, 2253 complete and 0 interrupted iterations
stress_test   [  41% ] 041/200 VUs  2m33.0s/6m10.0s

running (2m34.0s), 041/200 VUs, 2291 complete and 0 interrupted iterations
stress_test   [  42% ] 041/200 VUs  2m34.0s/6m10.0s

running (2m35.0s), 042/200 VUs, 2328 complete and 0 interrupted iterations
stress_test   [  42% ] 042/200 VUs  2m35.0s/6m10.0s

running (2m36.0s), 042/200 VUs, 2364 complete and 0 interrupted iterations
stress_test   [  42% ] 042/200 VUs  2m36.0s/6m10.0s

running (2m37.0s), 043/200 VUs, 2406 complete and 0 interrupted iterations
stress_test   [  42% ] 043/200 VUs  2m37.0s/6m10.0s

running (2m38.0s), 043/200 VUs, 2449 complete and 0 interrupted iterations
stress_test   [  43% ] 043/200 VUs  2m38.0s/6m10.0s

running (2m39.0s), 044/200 VUs, 2490 complete and 0 interrupted iterations
stress_test   [  43% ] 044/200 VUs  2m39.0s/6m10.0s

running (2m40.0s), 044/200 VUs, 2527 complete and 0 interrupted iterations
stress_test   [  43% ] 044/200 VUs  2m40.0s/6m10.0s

running (2m41.0s), 045/200 VUs, 2569 complete and 0 interrupted iterations
stress_test   [  44% ] 045/200 VUs  2m41.0s/6m10.0s

running (2m42.0s), 045/200 VUs, 2614 complete and 0 interrupted iterations
stress_test   [  44% ] 045/200 VUs  2m42.0s/6m10.0s

running (2m43.0s), 046/200 VUs, 2654 complete and 0 interrupted iterations
stress_test   [  44% ] 046/200 VUs  2m43.0s/6m10.0s

running (2m44.0s), 046/200 VUs, 2693 complete and 0 interrupted iterations
stress_test   [  44% ] 046/200 VUs  2m44.0s/6m10.0s

running (2m45.0s), 047/200 VUs, 2737 complete and 0 interrupted iterations
stress_test   [  45% ] 047/200 VUs  2m45.0s/6m10.0s

running (2m46.0s), 047/200 VUs, 2766 complete and 0 interrupted iterations
stress_test   [  45% ] 047/200 VUs  2m46.0s/6m10.0s

running (2m47.0s), 048/200 VUs, 2813 complete and 0 interrupted iterations
stress_test   [  45% ] 048/200 VUs  2m47.0s/6m10.0s

running (2m48.0s), 048/200 VUs, 2861 complete and 0 interrupted iterations
stress_test   [  45% ] 048/200 VUs  2m48.0s/6m10.0s

running (2m49.0s), 049/200 VUs, 2909 complete and 0 interrupted iterations
stress_test   [  46% ] 049/200 VUs  2m49.0s/6m10.0s

running (2m50.0s), 049/200 VUs, 2958 complete and 0 interrupted iterations
stress_test   [  46% ] 049/200 VUs  2m50.0s/6m10.0s

running (2m51.0s), 050/200 VUs, 3006 complete and 0 interrupted iterations
stress_test   [  46% ] 050/200 VUs  2m51.0s/6m10.0s

running (2m52.0s), 050/200 VUs, 3030 complete and 0 interrupted iterations
stress_test   [  46% ] 050/200 VUs  2m52.0s/6m10.0s

running (2m53.0s), 051/200 VUs, 3072 complete and 0 interrupted iterations
stress_test   [  47% ] 051/200 VUs  2m53.0s/6m10.0s

running (2m54.0s), 052/200 VUs, 3123 complete and 0 interrupted iterations
stress_test   [  47% ] 052/200 VUs  2m54.0s/6m10.0s

running (2m55.0s), 052/200 VUs, 3161 complete and 0 interrupted iterations
stress_test   [  47% ] 052/200 VUs  2m55.0s/6m10.0s

running (2m56.0s), 052/200 VUs, 3213 complete and 0 interrupted iterations
stress_test   [  48% ] 052/200 VUs  2m56.0s/6m10.0s

running (2m57.0s), 053/200 VUs, 3265 complete and 0 interrupted iterations
stress_test   [  48% ] 053/200 VUs  2m57.0s/6m10.0s

running (2m58.0s), 053/200 VUs, 3318 complete and 0 interrupted iterations
stress_test   [  48% ] 053/200 VUs  2m58.0s/6m10.0s

running (2m59.0s), 054/200 VUs, 3371 complete and 0 interrupted iterations
stress_test   [  48% ] 054/200 VUs  2m59.0s/6m10.0s

running (3m00.0s), 054/200 VUs, 3411 complete and 0 interrupted iterations
stress_test   [  49% ] 054/200 VUs  3m00.0s/6m10.0s

running (3m01.0s), 055/200 VUs, 3460 complete and 0 interrupted iterations
stress_test   [  49% ] 055/200 VUs  3m01.0s/6m10.0s

running (3m02.0s), 055/200 VUs, 3511 complete and 0 interrupted iterations
stress_test   [  49% ] 055/200 VUs  3m02.0s/6m10.0s

running (3m03.0s), 056/200 VUs, 3561 complete and 0 interrupted iterations
stress_test   [  49% ] 056/200 VUs  3m03.0s/6m10.0s

running (3m04.0s), 056/200 VUs, 3609 complete and 0 interrupted iterations
stress_test   [  50% ] 056/200 VUs  3m04.0s/6m10.0s

running (3m05.0s), 057/200 VUs, 3655 complete and 0 interrupted iterations
stress_test   [  50% ] 057/200 VUs  3m05.0s/6m10.0s

running (3m06.0s), 057/200 VUs, 3706 complete and 0 interrupted iterations
stress_test   [  50% ] 057/200 VUs  3m06.0s/6m10.0s

running (3m07.0s), 058/200 VUs, 3762 complete and 0 interrupted iterations
stress_test   [  51% ] 058/200 VUs  3m07.0s/6m10.0s

running (3m08.0s), 058/200 VUs, 3820 complete and 0 interrupted iterations
stress_test   [  51% ] 058/200 VUs  3m08.0s/6m10.0s

running (3m09.0s), 059/200 VUs, 3878 complete and 0 interrupted iterations
stress_test   [  51% ] 059/200 VUs  3m09.0s/6m10.0s

running (3m10.0s), 059/200 VUs, 3937 complete and 0 interrupted iterations
stress_test   [  51% ] 059/200 VUs  3m10.0s/6m10.0s

running (3m11.0s), 060/200 VUs, 3993 complete and 0 interrupted iterations
stress_test   [  52% ] 060/200 VUs  3m11.0s/6m10.0s

running (3m12.0s), 061/200 VUs, 4045 complete and 0 interrupted iterations
stress_test   [  52% ] 061/200 VUs  3m12.0s/6m10.0s

running (3m13.0s), 061/200 VUs, 4099 complete and 0 interrupted iterations
stress_test   [  52% ] 061/200 VUs  3m13.0s/6m10.0s

running (3m14.0s), 062/200 VUs, 4150 complete and 0 interrupted iterations
stress_test   [  52% ] 062/200 VUs  3m14.0s/6m10.0s

running (3m15.0s), 063/200 VUs, 4204 complete and 0 interrupted iterations
stress_test   [  53% ] 063/200 VUs  3m15.0s/6m10.0s

running (3m16.0s), 063/200 VUs, 4263 complete and 0 interrupted iterations
stress_test   [  53% ] 063/200 VUs  3m16.0s/6m10.0s

running (3m17.0s), 064/200 VUs, 4320 complete and 0 interrupted iterations
stress_test   [  53% ] 064/200 VUs  3m17.0s/6m10.0s

running (3m18.0s), 065/200 VUs, 4378 complete and 0 interrupted iterations
stress_test   [  54% ] 065/200 VUs  3m18.0s/6m10.0s

running (3m19.0s), 065/200 VUs, 4436 complete and 0 interrupted iterations
stress_test   [  54% ] 065/200 VUs  3m19.0s/6m10.0s

running (3m20.0s), 066/200 VUs, 4499 complete and 0 interrupted iterations
stress_test   [  54% ] 066/200 VUs  3m20.0s/6m10.0s

running (3m21.0s), 067/200 VUs, 4565 complete and 0 interrupted iterations
stress_test   [  54% ] 067/200 VUs  3m21.0s/6m10.0s

running (3m22.0s), 067/200 VUs, 4632 complete and 0 interrupted iterations
stress_test   [  55% ] 067/200 VUs  3m22.0s/6m10.0s

running (3m23.0s), 068/200 VUs, 4697 complete and 0 interrupted iterations
stress_test   [  55% ] 068/200 VUs  3m23.0s/6m10.0s

running (3m24.0s), 069/200 VUs, 4756 complete and 0 interrupted iterations
stress_test   [  55% ] 069/200 VUs  3m24.0s/6m10.0s

running (3m25.0s), 069/200 VUs, 4817 complete and 0 interrupted iterations
stress_test   [  55% ] 069/200 VUs  3m25.0s/6m10.0s

running (3m26.0s), 070/200 VUs, 4877 complete and 0 interrupted iterations
stress_test   [  56% ] 070/200 VUs  3m26.0s/6m10.0s

running (3m27.0s), 071/200 VUs, 4939 complete and 0 interrupted iterations
stress_test   [  56% ] 071/200 VUs  3m27.0s/6m10.0s

running (3m28.0s), 071/200 VUs, 5006 complete and 0 interrupted iterations
stress_test   [  56% ] 071/200 VUs  3m28.0s/6m10.0s

running (3m29.0s), 072/200 VUs, 5068 complete and 0 interrupted iterations
stress_test   [  56% ] 072/200 VUs  3m29.0s/6m10.0s

running (3m30.0s), 073/200 VUs, 5132 complete and 0 interrupted iterations
stress_test   [  57% ] 073/200 VUs  3m30.0s/6m10.0s

running (3m31.0s), 073/200 VUs, 5199 complete and 0 interrupted iterations
stress_test   [  57% ] 073/200 VUs  3m31.0s/6m10.0s

running (3m32.0s), 074/200 VUs, 5269 complete and 0 interrupted iterations
stress_test   [  57% ] 074/200 VUs  3m32.0s/6m10.0s

running (3m33.0s), 075/200 VUs, 5340 complete and 0 interrupted iterations
stress_test   [  58% ] 075/200 VUs  3m33.0s/6m10.0s

running (3m34.0s), 075/200 VUs, 5415 complete and 0 interrupted iterations
stress_test   [  58% ] 075/200 VUs  3m34.0s/6m10.0s

running (3m35.0s), 076/200 VUs, 5489 complete and 0 interrupted iterations
stress_test   [  58% ] 076/200 VUs  3m35.0s/6m10.0s

running (3m36.0s), 077/200 VUs, 5555 complete and 0 interrupted iterations
stress_test   [  58% ] 077/200 VUs  3m36.0s/6m10.0s

running (3m37.0s), 077/200 VUs, 5624 complete and 0 interrupted iterations
stress_test   [  59% ] 077/200 VUs  3m37.0s/6m10.0s

running (3m38.0s), 078/200 VUs, 5694 complete and 0 interrupted iterations
stress_test   [  59% ] 078/200 VUs  3m38.0s/6m10.0s

running (3m39.0s), 079/200 VUs, 5764 complete and 0 interrupted iterations
stress_test   [  59% ] 079/200 VUs  3m39.0s/6m10.0s

running (3m40.0s), 079/200 VUs, 5836 complete and 0 interrupted iterations
stress_test   [  59% ] 079/200 VUs  3m40.0s/6m10.0s

running (3m41.0s), 080/200 VUs, 5907 complete and 0 interrupted iterations
stress_test   [  60% ] 080/200 VUs  3m41.0s/6m10.0s

running (3m42.0s), 081/200 VUs, 5980 complete and 0 interrupted iterations
stress_test   [  60% ] 081/200 VUs  3m42.0s/6m10.0s

running (3m43.0s), 081/200 VUs, 6053 complete and 0 interrupted iterations
stress_test   [  60% ] 081/200 VUs  3m43.0s/6m10.0s

running (3m44.0s), 082/200 VUs, 6128 complete and 0 interrupted iterations
stress_test   [  61% ] 082/200 VUs  3m44.0s/6m10.0s

running (3m45.0s), 083/200 VUs, 6203 complete and 0 interrupted iterations
stress_test   [  61% ] 083/200 VUs  3m45.0s/6m10.0s

running (3m46.0s), 083/200 VUs, 6286 complete and 0 interrupted iterations
stress_test   [  61% ] 083/200 VUs  3m46.0s/6m10.0s

running (3m47.0s), 084/200 VUs, 6365 complete and 0 interrupted iterations
stress_test   [  61% ] 084/200 VUs  3m47.0s/6m10.0s

running (3m48.0s), 085/200 VUs, 6440 complete and 0 interrupted iterations
stress_test   [  62% ] 085/200 VUs  3m48.0s/6m10.0s

running (3m49.0s), 085/200 VUs, 6518 complete and 0 interrupted iterations
stress_test   [  62% ] 085/200 VUs  3m49.0s/6m10.0s

running (3m50.0s), 086/200 VUs, 6595 complete and 0 interrupted iterations
stress_test   [  62% ] 086/200 VUs  3m50.0s/6m10.0s

running (3m51.0s), 087/200 VUs, 6677 complete and 0 interrupted iterations
stress_test   [  62% ] 087/200 VUs  3m51.0s/6m10.0s

running (3m52.0s), 087/200 VUs, 6755 complete and 0 interrupted iterations
stress_test   [  63% ] 087/200 VUs  3m52.0s/6m10.0s

running (3m53.0s), 088/200 VUs, 6836 complete and 0 interrupted iterations
stress_test   [  63% ] 088/200 VUs  3m53.0s/6m10.0s

running (3m54.0s), 089/200 VUs, 6916 complete and 0 interrupted iterations
stress_test   [  63% ] 089/200 VUs  3m54.0s/6m10.0s

running (3m55.0s), 089/200 VUs, 6997 complete and 0 interrupted iterations
stress_test   [  64% ] 089/200 VUs  3m55.0s/6m10.0s

running (3m56.0s), 090/200 VUs, 7075 complete and 0 interrupted iterations
stress_test   [  64% ] 090/200 VUs  3m56.0s/6m10.0s

running (3m57.0s), 091/200 VUs, 7157 complete and 0 interrupted iterations
stress_test   [  64% ] 091/200 VUs  3m57.0s/6m10.0s

running (3m58.0s), 091/200 VUs, 7245 complete and 0 interrupted iterations
stress_test   [  64% ] 091/200 VUs  3m58.0s/6m10.0s

running (3m59.0s), 092/200 VUs, 7334 complete and 0 interrupted iterations
stress_test   [  65% ] 092/200 VUs  3m59.0s/6m10.0s

running (4m00.0s), 093/200 VUs, 7416 complete and 0 interrupted iterations
stress_test   [  65% ] 093/200 VUs  4m00.0s/6m10.0s

running (4m01.0s), 093/200 VUs, 7503 complete and 0 interrupted iterations
stress_test   [  65% ] 093/200 VUs  4m01.0s/6m10.0s

running (4m02.0s), 094/200 VUs, 7588 complete and 0 interrupted iterations
stress_test   [  65% ] 094/200 VUs  4m02.0s/6m10.0s

running (4m03.0s), 095/200 VUs, 7675 complete and 0 interrupted iterations
stress_test   [  66% ] 095/200 VUs  4m03.0s/6m10.0s

running (4m04.0s), 095/200 VUs, 7759 complete and 0 interrupted iterations
stress_test   [  66% ] 095/200 VUs  4m04.0s/6m10.0s

running (4m05.0s), 096/200 VUs, 7846 complete and 0 interrupted iterations
stress_test   [  66% ] 096/200 VUs  4m05.0s/6m10.0s

running (4m06.0s), 097/200 VUs, 7932 complete and 0 interrupted iterations
stress_test   [  66% ] 097/200 VUs  4m06.0s/6m10.0s

running (4m07.0s), 097/200 VUs, 8023 complete and 0 interrupted iterations
stress_test   [  67% ] 097/200 VUs  4m07.0s/6m10.0s

running (4m08.0s), 098/200 VUs, 8114 complete and 0 interrupted iterations
stress_test   [  67% ] 098/200 VUs  4m08.0s/6m10.0s

running (4m09.0s), 099/200 VUs, 8204 complete and 0 interrupted iterations
stress_test   [  67% ] 099/200 VUs  4m09.0s/6m10.0s

running (4m10.0s), 099/200 VUs, 8272 complete and 0 interrupted iterations
stress_test   [  68% ] 099/200 VUs  4m10.0s/6m10.0s

running (4m11.0s), 100/200 VUs, 8367 complete and 0 interrupted iterations
stress_test   [  68% ] 100/200 VUs  4m11.0s/6m10.0s

running (4m12.0s), 101/200 VUs, 8463 complete and 0 interrupted iterations
stress_test   [  68% ] 101/200 VUs  4m12.0s/6m10.0s

running (4m13.0s), 102/200 VUs, 8533 complete and 0 interrupted iterations
stress_test   [  68% ] 102/200 VUs  4m13.0s/6m10.0s

running (4m14.0s), 103/200 VUs, 8610 complete and 0 interrupted iterations
stress_test   [  69% ] 103/200 VUs  4m14.0s/6m10.0s

running (4m15.0s), 104/200 VUs, 8708 complete and 0 interrupted iterations
stress_test   [  69% ] 104/200 VUs  4m15.0s/6m10.0s

running (4m16.0s), 104/200 VUs, 8791 complete and 0 interrupted iterations
stress_test   [  69% ] 104/200 VUs  4m16.0s/6m10.0s

running (4m17.0s), 105/200 VUs, 8860 complete and 0 interrupted iterations
stress_test   [  69% ] 105/200 VUs  4m17.0s/6m10.0s

running (4m18.0s), 106/200 VUs, 8965 complete and 0 interrupted iterations
stress_test   [  70% ] 106/200 VUs  4m18.0s/6m10.0s

running (4m19.0s), 107/200 VUs, 9030 complete and 0 interrupted iterations
stress_test   [  70% ] 107/200 VUs  4m19.0s/6m10.0s

running (4m20.0s), 108/200 VUs, 9118 complete and 0 interrupted iterations
stress_test   [  70% ] 108/200 VUs  4m20.0s/6m10.0s

running (4m21.0s), 109/200 VUs, 9225 complete and 0 interrupted iterations
stress_test   [  71% ] 109/200 VUs  4m21.0s/6m10.0s

running (4m22.0s), 109/200 VUs, 9306 complete and 0 interrupted iterations
stress_test   [  71% ] 109/200 VUs  4m22.0s/6m10.0s

running (4m23.0s), 110/200 VUs, 9370 complete and 0 interrupted iterations
stress_test   [  71% ] 110/200 VUs  4m23.0s/6m10.0s

running (4m24.0s), 111/200 VUs, 9478 complete and 0 interrupted iterations
stress_test   [  71% ] 111/200 VUs  4m24.0s/6m10.0s

running (4m25.0s), 112/200 VUs, 9505 complete and 0 interrupted iterations
stress_test   [  72% ] 112/200 VUs  4m25.0s/6m10.0s

running (4m26.0s), 113/200 VUs, 9617 complete and 0 interrupted iterations
stress_test   [  72% ] 113/200 VUs  4m26.0s/6m10.0s

running (4m27.0s), 114/200 VUs, 9686 complete and 0 interrupted iterations
stress_test   [  72% ] 114/200 VUs  4m27.0s/6m10.0s

running (4m28.0s), 114/200 VUs, 9763 complete and 0 interrupted iterations
stress_test   [  72% ] 114/200 VUs  4m28.0s/6m10.0s

running (4m29.0s), 115/200 VUs, 9870 complete and 0 interrupted iterations
stress_test   [  73% ] 115/200 VUs  4m29.0s/6m10.0s

running (4m30.0s), 116/200 VUs, 9911 complete and 0 interrupted iterations
stress_test   [  73% ] 116/200 VUs  4m30.0s/6m10.0s

running (4m31.0s), 117/200 VUs, 10022 complete and 0 interrupted iterations
stress_test   [  73% ] 117/200 VUs  4m31.0s/6m10.0s

running (4m32.0s), 118/200 VUs, 10047 complete and 0 interrupted iterations
stress_test   [  74% ] 118/200 VUs  4m32.0s/6m10.0s

running (4m33.0s), 119/200 VUs, 10161 complete and 0 interrupted iterations
stress_test   [  74% ] 119/200 VUs  4m33.0s/6m10.0s

running (4m34.0s), 119/200 VUs, 10276 complete and 0 interrupted iterations
stress_test   [  74% ] 119/200 VUs  4m34.0s/6m10.0s

running (4m35.0s), 120/200 VUs, 10317 complete and 0 interrupted iterations
stress_test   [  74% ] 120/200 VUs  4m35.0s/6m10.0s

running (4m36.0s), 121/200 VUs, 10436 complete and 0 interrupted iterations
stress_test   [  75% ] 121/200 VUs  4m36.0s/6m10.0s

running (4m37.0s), 122/200 VUs, 10455 complete and 0 interrupted iterations
stress_test   [  75% ] 122/200 VUs  4m37.0s/6m10.0s

running (4m38.0s), 123/200 VUs, 10571 complete and 0 interrupted iterations
stress_test   [  75% ] 123/200 VUs  4m38.0s/6m10.0s

running (4m39.0s), 124/200 VUs, 10640 complete and 0 interrupted iterations
stress_test   [  75% ] 124/200 VUs  4m39.0s/6m10.0s

running (4m40.0s), 124/200 VUs, 10743 complete and 0 interrupted iterations
stress_test   [  76% ] 124/200 VUs  4m40.0s/6m10.0s

running (4m41.0s), 125/200 VUs, 10863 complete and 0 interrupted iterations
stress_test   [  76% ] 125/200 VUs  4m41.0s/6m10.0s

running (4m42.0s), 126/200 VUs, 10879 complete and 0 interrupted iterations
stress_test   [  76% ] 126/200 VUs  4m42.0s/6m10.0s

running (4m43.0s), 127/200 VUs, 11005 complete and 0 interrupted iterations
stress_test   [  76% ] 127/200 VUs  4m43.0s/6m10.0s

running (4m44.0s), 128/200 VUs, 11021 complete and 0 interrupted iterations
stress_test   [  77% ] 128/200 VUs  4m44.0s/6m10.0s

running (4m45.0s), 129/200 VUs, 11149 complete and 0 interrupted iterations
stress_test   [  77% ] 129/200 VUs  4m45.0s/6m10.0s

running (4m46.0s), 129/200 VUs, 11178 complete and 0 interrupted iterations
stress_test   [  77% ] 129/200 VUs  4m46.0s/6m10.0s

running (4m47.0s), 130/200 VUs, 11301 complete and 0 interrupted iterations
stress_test   [  78% ] 130/200 VUs  4m47.0s/6m10.0s

running (4m48.0s), 131/200 VUs, 11328 complete and 0 interrupted iterations
stress_test   [  78% ] 131/200 VUs  4m48.0s/6m10.0s

running (4m49.0s), 132/200 VUs, 11459 complete and 0 interrupted iterations
stress_test   [  78% ] 132/200 VUs  4m49.0s/6m10.0s

running (4m50.0s), 133/200 VUs, 11483 complete and 0 interrupted iterations
stress_test   [  78% ] 133/200 VUs  4m50.0s/6m10.0s

running (4m51.0s), 134/200 VUs, 11611 complete and 0 interrupted iterations
stress_test   [  79% ] 134/200 VUs  4m51.0s/6m10.0s

running (4m52.0s), 134/200 VUs, 11652 complete and 0 interrupted iterations
stress_test   [  79% ] 134/200 VUs  4m52.0s/6m10.0s

running (4m53.0s), 135/200 VUs, 11781 complete and 0 interrupted iterations
stress_test   [  79% ] 135/200 VUs  4m53.0s/6m10.0s

running (4m54.0s), 136/200 VUs, 11881 complete and 0 interrupted iterations
stress_test   [  79% ] 136/200 VUs  4m54.0s/6m10.0s

running (4m55.0s), 137/200 VUs, 11926 complete and 0 interrupted iterations
stress_test   [  80% ] 137/200 VUs  4m55.0s/6m10.0s

running (4m56.0s), 138/200 VUs, 11980 complete and 0 interrupted iterations
stress_test   [  80% ] 138/200 VUs  4m56.0s/6m10.0s

running (4m57.0s), 139/200 VUs, 12085 complete and 0 interrupted iterations
stress_test   [  80% ] 139/200 VUs  4m57.0s/6m10.0s

running (4m58.0s), 139/200 VUs, 12211 complete and 0 interrupted iterations
stress_test   [  81% ] 139/200 VUs  4m58.0s/6m10.0s

running (4m59.0s), 140/200 VUs, 12233 complete and 0 interrupted iterations
stress_test   [  81% ] 140/200 VUs  4m59.0s/6m10.0s

running (5m00.0s), 141/200 VUs, 12371 complete and 0 interrupted iterations
stress_test   [  81% ] 141/200 VUs  5m00.0s/6m10.0s

running (5m01.0s), 142/200 VUs, 12404 complete and 0 interrupted iterations
stress_test   [  81% ] 142/200 VUs  5m01.0s/6m10.0s

running (5m02.0s), 143/200 VUs, 12545 complete and 0 interrupted iterations
stress_test   [  82% ] 143/200 VUs  5m02.0s/6m10.0s

running (5m03.0s), 144/200 VUs, 12600 complete and 0 interrupted iterations
stress_test   [  82% ] 144/200 VUs  5m03.0s/6m10.0s

running (5m04.0s), 144/200 VUs, 12736 complete and 0 interrupted iterations
stress_test   [  82% ] 144/200 VUs  5m04.0s/6m10.0s

running (5m05.0s), 145/200 VUs, 12813 complete and 0 interrupted iterations
stress_test   [  82% ] 145/200 VUs  5m05.0s/6m10.0s

running (5m06.0s), 146/200 VUs, 12916 complete and 0 interrupted iterations
stress_test   [  83% ] 146/200 VUs  5m06.0s/6m10.0s

running (5m07.0s), 147/200 VUs, 13017 complete and 0 interrupted iterations
stress_test   [  83% ] 147/200 VUs  5m07.0s/6m10.0s

running (5m08.0s), 148/200 VUs, 13097 complete and 0 interrupted iterations
stress_test   [  83% ] 148/200 VUs  5m08.0s/6m10.0s

running (5m09.0s), 149/200 VUs, 13159 complete and 0 interrupted iterations
stress_test   [  84% ] 149/200 VUs  5m09.0s/6m10.0s

running (5m10.0s), 149/200 VUs, 13270 complete and 0 interrupted iterations
stress_test   [  84% ] 149/200 VUs  5m10.0s/6m10.0s

running (5m11.0s), 150/200 VUs, 13406 complete and 0 interrupted iterations
stress_test   [  84% ] 150/200 VUs  5m11.0s/6m10.0s

running (5m12.0s), 151/200 VUs, 13468 complete and 0 interrupted iterations
stress_test   [  84% ] 151/200 VUs  5m12.0s/6m10.0s

running (5m13.0s), 152/200 VUs, 13585 complete and 0 interrupted iterations
stress_test   [  85% ] 152/200 VUs  5m13.0s/6m10.0s

running (5m14.0s), 153/200 VUs, 13652 complete and 0 interrupted iterations
stress_test   [  85% ] 153/200 VUs  5m14.0s/6m10.0s

running (5m15.0s), 154/200 VUs, 13763 complete and 0 interrupted iterations
stress_test   [  85% ] 154/200 VUs  5m15.0s/6m10.0s

running (5m16.0s), 154/200 VUs, 13849 complete and 0 interrupted iterations
stress_test   [  85% ] 154/200 VUs  5m16.0s/6m10.0s

running (5m17.0s), 155/200 VUs, 13939 complete and 0 interrupted iterations
stress_test   [  86% ] 155/200 VUs  5m17.0s/6m10.0s

running (5m18.0s), 156/200 VUs, 14052 complete and 0 interrupted iterations
stress_test   [  86% ] 156/200 VUs  5m18.0s/6m10.0s

running (5m19.0s), 157/200 VUs, 14166 complete and 0 interrupted iterations
stress_test   [  86% ] 157/200 VUs  5m19.0s/6m10.0s

running (5m20.0s), 158/200 VUs, 14244 complete and 0 interrupted iterations
stress_test   [  86% ] 158/200 VUs  5m20.0s/6m10.0s

running (5m21.0s), 159/200 VUs, 14334 complete and 0 interrupted iterations
stress_test   [  87% ] 159/200 VUs  5m21.0s/6m10.0s

running (5m22.0s), 159/200 VUs, 14443 complete and 0 interrupted iterations
stress_test   [  87% ] 159/200 VUs  5m22.0s/6m10.0s

running (5m23.0s), 160/200 VUs, 14524 complete and 0 interrupted iterations
stress_test   [  87% ] 160/200 VUs  5m23.0s/6m10.0s

running (5m24.0s), 161/200 VUs, 14635 complete and 0 interrupted iterations
stress_test   [  88% ] 161/200 VUs  5m24.0s/6m10.0s

running (5m25.0s), 162/200 VUs, 14769 complete and 0 interrupted iterations
stress_test   [  88% ] 162/200 VUs  5m25.0s/6m10.0s

running (5m26.0s), 163/200 VUs, 14834 complete and 0 interrupted iterations
stress_test   [  88% ] 163/200 VUs  5m26.0s/6m10.0s

running (5m27.0s), 164/200 VUs, 14989 complete and 0 interrupted iterations
stress_test   [  88% ] 164/200 VUs  5m27.0s/6m10.0s

running (5m28.0s), 164/200 VUs, 15055 complete and 0 interrupted iterations
stress_test   [  89% ] 164/200 VUs  5m28.0s/6m10.0s

running (5m29.0s), 165/200 VUs, 15187 complete and 0 interrupted iterations
stress_test   [  89% ] 165/200 VUs  5m29.0s/6m10.0s

running (5m30.0s), 166/200 VUs, 15265 complete and 0 interrupted iterations
stress_test   [  89% ] 166/200 VUs  5m30.0s/6m10.0s

running (5m31.0s), 167/200 VUs, 15411 complete and 0 interrupted iterations
stress_test   [  89% ] 167/200 VUs  5m31.0s/6m10.0s

running (5m32.0s), 168/200 VUs, 15461 complete and 0 interrupted iterations
stress_test   [  90% ] 168/200 VUs  5m32.0s/6m10.0s

running (5m33.0s), 169/200 VUs, 15608 complete and 0 interrupted iterations
stress_test   [  90% ] 169/200 VUs  5m33.0s/6m10.0s

running (5m34.0s), 169/200 VUs, 15656 complete and 0 interrupted iterations
stress_test   [  90% ] 169/200 VUs  5m34.0s/6m10.0s

running (5m35.0s), 170/200 VUs, 15782 complete and 0 interrupted iterations
stress_test   [  91% ] 170/200 VUs  5m35.0s/6m10.0s

running (5m36.0s), 171/200 VUs, 15871 complete and 0 interrupted iterations
stress_test   [  91% ] 171/200 VUs  5m36.0s/6m10.0s

running (5m37.0s), 172/200 VUs, 15884 complete and 0 interrupted iterations
stress_test   [  91% ] 172/200 VUs  5m37.0s/6m10.0s

running (5m38.0s), 173/200 VUs, 16056 complete and 0 interrupted iterations
stress_test   [  91% ] 173/200 VUs  5m38.0s/6m10.0s

running (5m39.0s), 174/200 VUs, 16096 complete and 0 interrupted iterations
stress_test   [  92% ] 174/200 VUs  5m39.0s/6m10.0s

running (5m40.0s), 174/200 VUs, 16263 complete and 0 interrupted iterations
stress_test   [  92% ] 174/200 VUs  5m40.0s/6m10.0s

running (5m41.0s), 175/200 VUs, 16290 complete and 0 interrupted iterations
stress_test   [  92% ] 175/200 VUs  5m41.0s/6m10.0s

running (5m42.0s), 176/200 VUs, 16465 complete and 0 interrupted iterations
stress_test   [  92% ] 176/200 VUs  5m42.0s/6m10.0s

running (5m43.0s), 177/200 VUs, 16497 complete and 0 interrupted iterations
stress_test   [  93% ] 177/200 VUs  5m43.0s/6m10.0s

running (5m44.0s), 178/200 VUs, 16504 complete and 0 interrupted iterations
stress_test   [  93% ] 178/200 VUs  5m44.0s/6m10.0s

running (5m45.0s), 179/200 VUs, 16682 complete and 0 interrupted iterations
stress_test   [  93% ] 179/200 VUs  5m45.0s/6m10.0s

running (5m46.0s), 179/200 VUs, 16702 complete and 0 interrupted iterations
stress_test   [  94% ] 179/200 VUs  5m46.0s/6m10.0s

running (5m47.0s), 180/200 VUs, 16878 complete and 0 interrupted iterations
stress_test   [  94% ] 180/200 VUs  5m47.0s/6m10.0s

running (5m48.0s), 181/200 VUs, 16884 complete and 0 interrupted iterations
stress_test   [  94% ] 181/200 VUs  5m48.0s/6m10.0s

running (5m49.0s), 182/200 VUs, 17064 complete and 0 interrupted iterations
stress_test   [  94% ] 182/200 VUs  5m49.0s/6m10.0s

running (5m50.0s), 183/200 VUs, 17086 complete and 0 interrupted iterations
stress_test   [  95% ] 183/200 VUs  5m50.0s/6m10.0s

running (5m51.0s), 184/200 VUs, 17148 complete and 0 interrupted iterations
stress_test   [  95% ] 184/200 VUs  5m51.0s/6m10.0s

running (5m52.0s), 184/200 VUs, 17317 complete and 0 interrupted iterations
stress_test   [  95% ] 184/200 VUs  5m52.0s/6m10.0s

running (5m53.0s), 185/200 VUs, 17340 complete and 0 interrupted iterations
stress_test   [  95% ] 185/200 VUs  5m53.0s/6m10.0s

running (5m54.0s), 186/200 VUs, 17525 complete and 0 interrupted iterations
stress_test   [  96% ] 186/200 VUs  5m54.0s/6m10.0s

running (5m55.0s), 187/200 VUs, 17562 complete and 0 interrupted iterations
stress_test   [  96% ] 187/200 VUs  5m55.0s/6m10.0s

running (5m56.0s), 188/200 VUs, 17718 complete and 0 interrupted iterations
stress_test   [  96% ] 188/200 VUs  5m56.0s/6m10.0s

running (5m57.0s), 189/200 VUs, 17787 complete and 0 interrupted iterations
stress_test   [  96% ] 189/200 VUs  5m57.0s/6m10.0s

running (5m58.0s), 189/200 VUs, 17833 complete and 0 interrupted iterations
stress_test   [  97% ] 189/200 VUs  5m58.0s/6m10.0s

running (5m59.0s), 190/200 VUs, 17986 complete and 0 interrupted iterations
stress_test   [  97% ] 190/200 VUs  5m59.0s/6m10.0s

running (6m00.0s), 191/200 VUs, 18008 complete and 0 interrupted iterations
stress_test   [  97% ] 191/200 VUs  6m00.0s/6m10.0s

running (6m01.0s), 192/200 VUs, 18197 complete and 0 interrupted iterations
stress_test   [  98% ] 192/200 VUs  6m01.0s/6m10.0s

running (6m02.0s), 193/200 VUs, 18214 complete and 0 interrupted iterations
stress_test   [  98% ] 193/200 VUs  6m02.0s/6m10.0s

running (6m03.0s), 194/200 VUs, 18403 complete and 0 interrupted iterations
stress_test   [  98% ] 194/200 VUs  6m03.0s/6m10.0s

running (6m04.0s), 194/200 VUs, 18435 complete and 0 interrupted iterations
stress_test   [  98% ] 194/200 VUs  6m04.0s/6m10.0s

running (6m05.0s), 195/200 VUs, 18464 complete and 0 interrupted iterations
stress_test   [  99% ] 195/200 VUs  6m05.0s/6m10.0s

running (6m06.0s), 196/200 VUs, 18649 complete and 0 interrupted iterations
stress_test   [  99% ] 196/200 VUs  6m06.0s/6m10.0s

running (6m07.0s), 197/200 VUs, 18685 complete and 0 interrupted iterations
stress_test   [  99% ] 197/200 VUs  6m07.0s/6m10.0s

running (6m08.0s), 198/200 VUs, 18817 complete and 0 interrupted iterations
stress_test   [  99% ] 198/200 VUs  6m08.0s/6m10.0s

running (6m09.0s), 199/200 VUs, 18890 complete and 0 interrupted iterations
stress_test   [ 100% ] 199/200 VUs  6m09.0s/6m10.0s

running (6m10.0s), 199/200 VUs, 18927 complete and 0 interrupted iterations
stress_test   [ 100% ] 199/200 VUs  6m10.0s/6m10.0s


  █ THRESHOLDS 

    failures
    ✓ 'rate<0.01' rate=0.00%

    http_req_duration
    ✓ 'p(95)<1500' p(95)=742.11ms

    http_req_failed
    ✓ 'rate<0.01' rate=0.00%


  █ TOTAL RESULTS 

    checks_total.......: 57378   154.683621/s
    checks_succeeded...: 100.00% 57378 out of 57378
    checks_failed......: 0.00%   0 out of 57378

    ✓ login page status 200
    ✓ login redirect success
    ✓ logout redirect success

    CUSTOM
    failures.......................: 0.00%  0 out of 0

    HTTP
    http_req_duration..............: avg=104ms min=123µs med=2.54ms max=1.6s  p(90)=335.42ms p(95)=742.11ms p(99)=1.21s
      { expected_response:true }...: avg=104ms min=123µs med=2.54ms max=1.6s  p(90)=335.42ms p(95)=742.11ms p(99)=1.21s
    http_req_failed................: 0.00%  0 out of 76504
    http_reqs......................: 76504  206.244828/s

    EXECUTION
    iteration_duration.............: avg=1.41s min=1.07s med=1.13s  max=2.69s p(90)=2.1s     p(95)=2.28s    p(99)=2.5s 
    iterations.....................: 19126  51.561207/s
    vus............................: 199    min=5          max=199
    vus_max........................: 200    min=200        max=200

    NETWORK
    data_received..................: 169 MB 456 kB/s
    data_sent......................: 16 MB  44 kB/s




running (6m10.9s), 000/200 VUs, 19126 complete and 0 interrupted iterations
stress_test ✓ [ 100% ] 000/200 VUs  6m10s
