
         /\      Grafana   /‾‾/  
    /\  /  \     |\  __   /  /   
   /  \/    \    | |/ /  /   ‾‾\ 
  /          \   |   (  |  (‾)  |
 / __________ \  |_|\_\  \_____/ 

     execution: local
        script: /scripts/stress/create-comment.stress.js
        output: -

     scenarios: (100.00%) 1 scenario, 1000 max VUs, 2m30s max duration (incl. graceful stop):
              * stress_test: Up to 500.00 iterations/s for 2m0s over 3 stages (maxVUs: 200-1000, gracefulStop: 30s)


running (0m01.0s), 0045/0200 VUs, 0 complete and 0 interrupted iterations
stress_test   [   1% ] 0045/0200 VUs  0m00.9s/2m0s  050.00 iters/s

running (0m02.0s), 0050/0200 VUs, 45 complete and 0 interrupted iterations
stress_test   [   2% ] 0050/0200 VUs  0m01.9s/2m0s  050.00 iters/s

running (0m03.0s), 0051/0200 VUs, 94 complete and 0 interrupted iterations
stress_test   [   2% ] 0051/0200 VUs  0m02.9s/2m0s  050.00 iters/s

running (0m04.0s), 0051/0200 VUs, 144 complete and 0 interrupted iterations
stress_test   [   3% ] 0051/0200 VUs  0m03.9s/2m0s  050.00 iters/s

running (0m05.0s), 0051/0200 VUs, 194 complete and 0 interrupted iterations
stress_test   [   4% ] 0051/0200 VUs  0m04.9s/2m0s  050.00 iters/s

running (0m06.0s), 0051/0200 VUs, 244 complete and 0 interrupted iterations
stress_test   [   5% ] 0051/0200 VUs  0m05.9s/2m0s  050.00 iters/s

running (0m07.0s), 0051/0200 VUs, 294 complete and 0 interrupted iterations
stress_test   [   6% ] 0051/0200 VUs  0m06.9s/2m0s  050.00 iters/s

running (0m08.0s), 0050/0200 VUs, 345 complete and 0 interrupted iterations
stress_test   [   7% ] 0050/0200 VUs  0m07.9s/2m0s  050.00 iters/s

running (0m09.0s), 0051/0200 VUs, 394 complete and 0 interrupted iterations
stress_test   [   7% ] 0051/0200 VUs  0m08.9s/2m0s  050.00 iters/s

running (0m10.0s), 0051/0200 VUs, 444 complete and 0 interrupted iterations
stress_test   [   8% ] 0051/0200 VUs  0m09.9s/2m0s  050.00 iters/s

running (0m11.0s), 0051/0200 VUs, 494 complete and 0 interrupted iterations
stress_test   [   9% ] 0051/0200 VUs  0m10.9s/2m0s  050.00 iters/s

running (0m12.0s), 0051/0200 VUs, 544 complete and 0 interrupted iterations
stress_test   [  10% ] 0051/0200 VUs  0m11.9s/2m0s  050.00 iters/s

running (0m13.0s), 0051/0200 VUs, 594 complete and 0 interrupted iterations
stress_test   [  11% ] 0051/0200 VUs  0m12.9s/2m0s  050.00 iters/s

running (0m14.0s), 0051/0200 VUs, 644 complete and 0 interrupted iterations
stress_test   [  12% ] 0051/0200 VUs  0m13.9s/2m0s  050.00 iters/s

running (0m15.0s), 0051/0200 VUs, 694 complete and 0 interrupted iterations
stress_test   [  12% ] 0051/0200 VUs  0m14.9s/2m0s  050.00 iters/s

running (0m16.0s), 0051/0200 VUs, 744 complete and 0 interrupted iterations
stress_test   [  13% ] 0051/0200 VUs  0m15.9s/2m0s  050.00 iters/s

running (0m17.0s), 0050/0200 VUs, 795 complete and 0 interrupted iterations
stress_test   [  14% ] 0050/0200 VUs  0m16.9s/2m0s  050.00 iters/s

running (0m18.0s), 0051/0200 VUs, 844 complete and 0 interrupted iterations
stress_test   [  15% ] 0051/0200 VUs  0m17.9s/2m0s  050.00 iters/s

running (0m19.0s), 0051/0200 VUs, 894 complete and 0 interrupted iterations
stress_test   [  16% ] 0051/0200 VUs  0m18.9s/2m0s  050.00 iters/s

running (0m20.0s), 0051/0200 VUs, 944 complete and 0 interrupted iterations
stress_test   [  17% ] 0051/0200 VUs  0m19.9s/2m0s  050.00 iters/s

running (0m21.0s), 0049/0200 VUs, 995 complete and 0 interrupted iterations
stress_test   [  17% ] 0049/0200 VUs  0m20.9s/2m0s  050.00 iters/s

running (0m22.0s), 0051/0200 VUs, 1044 complete and 0 interrupted iterations
stress_test   [  18% ] 0051/0200 VUs  0m21.9s/2m0s  050.00 iters/s

running (0m23.0s), 0051/0200 VUs, 1094 complete and 0 interrupted iterations
stress_test   [  19% ] 0051/0200 VUs  0m22.9s/2m0s  050.00 iters/s

running (0m24.0s), 0050/0200 VUs, 1145 complete and 0 interrupted iterations
stress_test   [  20% ] 0050/0200 VUs  0m23.9s/2m0s  050.00 iters/s

running (0m25.0s), 0051/0200 VUs, 1194 complete and 0 interrupted iterations
stress_test   [  21% ] 0051/0200 VUs  0m24.9s/2m0s  050.00 iters/s

running (0m26.0s), 0051/0200 VUs, 1244 complete and 0 interrupted iterations
stress_test   [  22% ] 0051/0200 VUs  0m25.9s/2m0s  050.00 iters/s

running (0m27.0s), 0050/0200 VUs, 1295 complete and 0 interrupted iterations
stress_test   [  22% ] 0050/0200 VUs  0m26.9s/2m0s  050.00 iters/s

running (0m28.0s), 0051/0200 VUs, 1344 complete and 0 interrupted iterations
stress_test   [  23% ] 0051/0200 VUs  0m27.9s/2m0s  050.00 iters/s

running (0m29.0s), 0051/0200 VUs, 1394 complete and 0 interrupted iterations
stress_test   [  24% ] 0051/0200 VUs  0m28.9s/2m0s  050.00 iters/s

running (0m30.0s), 0051/0200 VUs, 1444 complete and 0 interrupted iterations
stress_test   [  25% ] 0051/0200 VUs  0m29.9s/2m0s  050.00 iters/s

running (0m31.0s), 0053/0200 VUs, 1494 complete and 0 interrupted iterations
stress_test   [  26% ] 0053/0200 VUs  0m30.9s/2m0s  054.54 iters/s

running (0m32.0s), 0058/0200 VUs, 1546 complete and 0 interrupted iterations
stress_test   [  27% ] 0058/0200 VUs  0m31.9s/2m0s  059.54 iters/s

running (0m33.0s), 0063/0200 VUs, 1603 complete and 0 interrupted iterations
stress_test   [  27% ] 0063/0200 VUs  0m32.9s/2m0s  064.54 iters/s

running (0m34.0s), 0068/0200 VUs, 1665 complete and 0 interrupted iterations
stress_test   [  28% ] 0068/0200 VUs  0m33.9s/2m0s  069.53 iters/s

running (0m35.0s), 0072/0200 VUs, 1733 complete and 0 interrupted iterations
stress_test   [  29% ] 0072/0200 VUs  0m34.9s/2m0s  074.53 iters/s

running (0m36.0s), 0078/0200 VUs, 1804 complete and 0 interrupted iterations
stress_test   [  30% ] 0078/0200 VUs  0m35.9s/2m0s  079.53 iters/s

running (0m37.0s), 0082/0200 VUs, 1882 complete and 0 interrupted iterations
stress_test   [  31% ] 0082/0200 VUs  0m36.9s/2m0s  084.53 iters/s

running (0m38.0s), 0087/0200 VUs, 1964 complete and 0 interrupted iterations
stress_test   [  32% ] 0087/0200 VUs  0m37.9s/2m0s  089.53 iters/s

running (0m39.0s), 0093/0200 VUs, 2050 complete and 0 interrupted iterations
stress_test   [  32% ] 0093/0200 VUs  0m38.9s/2m0s  094.53 iters/s

running (0m40.0s), 0098/0200 VUs, 2142 complete and 0 interrupted iterations
stress_test   [  33% ] 0098/0200 VUs  0m39.9s/2m0s  099.52 iters/s

running (0m41.0s), 0102/0200 VUs, 2240 complete and 0 interrupted iterations
stress_test   [  34% ] 0102/0200 VUs  0m40.9s/2m0s  104.52 iters/s

running (0m42.0s), 0108/0200 VUs, 2341 complete and 0 interrupted iterations
stress_test   [  35% ] 0108/0200 VUs  0m41.9s/2m0s  109.52 iters/s

running (0m43.0s), 0112/0200 VUs, 2449 complete and 0 interrupted iterations
stress_test   [  36% ] 0112/0200 VUs  0m42.9s/2m0s  114.52 iters/s

running (0m44.0s), 0117/0200 VUs, 2561 complete and 0 interrupted iterations
stress_test   [  37% ] 0117/0200 VUs  0m43.9s/2m0s  119.52 iters/s

running (0m45.0s), 0123/0200 VUs, 2677 complete and 0 interrupted iterations
stress_test   [  37% ] 0123/0200 VUs  0m44.9s/2m0s  124.52 iters/s

running (0m46.0s), 0127/0200 VUs, 2800 complete and 0 interrupted iterations
stress_test   [  38% ] 0127/0200 VUs  0m45.9s/2m0s  129.52 iters/s

running (0m47.0s), 0132/0200 VUs, 2927 complete and 0 interrupted iterations
stress_test   [  39% ] 0132/0200 VUs  0m46.9s/2m0s  134.52 iters/s

running (0m48.0s), 0137/0200 VUs, 3059 complete and 0 interrupted iterations
stress_test   [  40% ] 0137/0200 VUs  0m47.9s/2m0s  139.52 iters/s

running (0m49.0s), 0142/0200 VUs, 3196 complete and 0 interrupted iterations
stress_test   [  41% ] 0142/0200 VUs  0m48.9s/2m0s  144.52 iters/s

running (0m50.0s), 0148/0200 VUs, 3337 complete and 0 interrupted iterations
stress_test   [  42% ] 0148/0200 VUs  0m49.9s/2m0s  149.52 iters/s

running (0m51.0s), 0152/0200 VUs, 3485 complete and 0 interrupted iterations
stress_test   [  42% ] 0152/0200 VUs  0m50.9s/2m0s  154.52 iters/s

running (0m52.0s), 0157/0200 VUs, 3637 complete and 0 interrupted iterations
stress_test   [  43% ] 0157/0200 VUs  0m51.9s/2m0s  159.51 iters/s

running (0m53.0s), 0162/0200 VUs, 3794 complete and 0 interrupted iterations
stress_test   [  44% ] 0162/0200 VUs  0m52.9s/2m0s  164.51 iters/s

running (0m54.0s), 0167/0200 VUs, 3956 complete and 0 interrupted iterations
stress_test   [  45% ] 0167/0200 VUs  0m53.9s/2m0s  169.51 iters/s

running (0m55.0s), 0173/0200 VUs, 4122 complete and 0 interrupted iterations
stress_test   [  46% ] 0173/0200 VUs  0m54.9s/2m0s  174.51 iters/s

running (0m56.0s), 0177/0200 VUs, 4295 complete and 0 interrupted iterations
stress_test   [  47% ] 0177/0200 VUs  0m55.9s/2m0s  179.51 iters/s

running (0m57.0s), 0182/0200 VUs, 4472 complete and 0 interrupted iterations
stress_test   [  47% ] 0182/0200 VUs  0m56.9s/2m0s  184.51 iters/s

running (0m58.0s), 0187/0200 VUs, 4654 complete and 0 interrupted iterations
stress_test   [  48% ] 0187/0200 VUs  0m57.9s/2m0s  189.51 iters/s

running (0m59.0s), 0192/0200 VUs, 4841 complete and 0 interrupted iterations
stress_test   [  49% ] 0192/0200 VUs  0m58.9s/2m0s  194.51 iters/s

running (1m00.0s), 0198/0200 VUs, 5033 complete and 0 interrupted iterations
stress_test   [  50% ] 0198/0200 VUs  0m59.9s/2m0s  199.54 iters/s

running (1m01.0s), 0200/0202 VUs, 5230 complete and 0 interrupted iterations
stress_test   [  51% ] 0200/0202 VUs  1m00.9s/2m0s  204.51 iters/s

running (1m02.0s), 0203/0206 VUs, 5430 complete and 0 interrupted iterations
stress_test   [  52% ] 0203/0206 VUs  1m01.9s/2m0s  209.51 iters/s

running (1m03.0s), 0210/0210 VUs, 5632 complete and 0 interrupted iterations
stress_test   [  52% ] 0210/0210 VUs  1m02.9s/2m0s  214.53 iters/s

running (1m04.0s), 0214/0214 VUs, 5840 complete and 0 interrupted iterations
stress_test   [  53% ] 0214/0214 VUs  1m03.9s/2m0s  219.51 iters/s

running (1m05.0s), 0218/0219 VUs, 6054 complete and 0 interrupted iterations
stress_test   [  54% ] 0218/0219 VUs  1m04.9s/2m0s  224.53 iters/s

running (1m06.0s), 0223/0224 VUs, 6271 complete and 0 interrupted iterations
stress_test   [  55% ] 0223/0224 VUs  1m05.9s/2m0s  229.53 iters/s

running (1m07.0s), 0228/0229 VUs, 6493 complete and 0 interrupted iterations
stress_test   [  56% ] 0228/0229 VUs  1m06.9s/2m0s  234.53 iters/s

running (1m08.0s), 0233/0234 VUs, 6720 complete and 0 interrupted iterations
stress_test   [  57% ] 0233/0234 VUs  1m07.9s/2m0s  239.53 iters/s

running (1m09.0s), 0238/0239 VUs, 6952 complete and 0 interrupted iterations
stress_test   [  57% ] 0238/0239 VUs  1m08.9s/2m0s  244.53 iters/s

running (1m10.0s), 0243/0244 VUs, 7189 complete and 0 interrupted iterations
stress_test   [  58% ] 0243/0244 VUs  1m09.9s/2m0s  249.53 iters/s

running (1m11.0s), 0249/0249 VUs, 7430 complete and 0 interrupted iterations
stress_test   [  59% ] 0248/0249 VUs  1m10.9s/2m0s  254.53 iters/s

running (1m12.0s), 0253/0254 VUs, 7678 complete and 0 interrupted iterations
stress_test   [  60% ] 0253/0254 VUs  1m11.9s/2m0s  259.53 iters/s

running (1m13.0s), 0258/0259 VUs, 7929 complete and 0 interrupted iterations
stress_test   [  61% ] 0258/0259 VUs  1m12.9s/2m0s  264.53 iters/s

running (1m14.0s), 0263/0264 VUs, 8187 complete and 0 interrupted iterations
stress_test   [  62% ] 0263/0264 VUs  1m13.9s/2m0s  269.53 iters/s

running (1m15.0s), 0268/0269 VUs, 8449 complete and 0 interrupted iterations
stress_test   [  62% ] 0268/0269 VUs  1m14.9s/2m0s  274.53 iters/s

running (1m16.0s), 0272/0274 VUs, 8716 complete and 0 interrupted iterations
stress_test   [  63% ] 0272/0274 VUs  1m15.9s/2m0s  279.51 iters/s

running (1m17.0s), 0279/0279 VUs, 8987 complete and 0 interrupted iterations
stress_test   [  64% ] 0279/0279 VUs  1m16.9s/2m0s  284.53 iters/s

running (1m18.0s), 0283/0284 VUs, 9265 complete and 0 interrupted iterations
stress_test   [  65% ] 0283/0284 VUs  1m17.9s/2m0s  289.53 iters/s

running (1m19.0s), 0287/0289 VUs, 9548 complete and 0 interrupted iterations
stress_test   [  66% ] 0287/0289 VUs  1m18.9s/2m0s  294.53 iters/s

running (1m20.0s), 0293/0294 VUs, 9834 complete and 0 interrupted iterations
stress_test   [  67% ] 0293/0294 VUs  1m19.9s/2m0s  299.52 iters/s

running (1m21.0s), 0298/0299 VUs, 10126 complete and 0 interrupted iterations
stress_test   [  67% ] 0298/0299 VUs  1m20.9s/2m0s  304.52 iters/s

running (1m22.0s), 0303/0304 VUs, 10423 complete and 0 interrupted iterations
stress_test   [  68% ] 0303/0304 VUs  1m21.9s/2m0s  309.52 iters/s

running (1m23.0s), 0308/0309 VUs, 10725 complete and 0 interrupted iterations
stress_test   [  69% ] 0308/0309 VUs  1m22.9s/2m0s  314.52 iters/s

running (1m24.0s), 0313/0314 VUs, 11032 complete and 0 interrupted iterations
stress_test   [  70% ] 0313/0314 VUs  1m23.9s/2m0s  319.52 iters/s

running (1m25.0s), 0318/0319 VUs, 11344 complete and 0 interrupted iterations
stress_test   [  71% ] 0318/0319 VUs  1m24.9s/2m0s  324.52 iters/s

running (1m26.0s), 0323/0324 VUs, 11661 complete and 0 interrupted iterations
stress_test   [  72% ] 0323/0324 VUs  1m25.9s/2m0s  329.52 iters/s

running (1m27.0s), 0328/0329 VUs, 11983 complete and 0 interrupted iterations
stress_test   [  72% ] 0328/0329 VUs  1m26.9s/2m0s  334.52 iters/s

running (1m28.0s), 0333/0334 VUs, 12310 complete and 0 interrupted iterations
stress_test   [  73% ] 0333/0334 VUs  1m27.9s/2m0s  339.52 iters/s

running (1m29.0s), 0338/0339 VUs, 12642 complete and 0 interrupted iterations
stress_test   [  74% ] 0338/0339 VUs  1m28.9s/2m0s  344.52 iters/s

running (1m30.0s), 0342/0344 VUs, 12980 complete and 0 interrupted iterations
stress_test   [  75% ] 0342/0344 VUs  1m29.9s/2m0s  349.52 iters/s

running (1m31.0s), 0348/0349 VUs, 13321 complete and 0 interrupted iterations
stress_test   [  76% ] 0348/0349 VUs  1m30.9s/2m0s  354.52 iters/s

running (1m32.0s), 0353/0354 VUs, 13668 complete and 0 interrupted iterations
stress_test   [  77% ] 0353/0354 VUs  1m31.9s/2m0s  359.52 iters/s

running (1m33.0s), 0357/0360 VUs, 14020 complete and 0 interrupted iterations
stress_test   [  77% ] 0357/0360 VUs  1m32.9s/2m0s  364.52 iters/s

running (1m34.0s), 0362/0365 VUs, 14376 complete and 0 interrupted iterations
stress_test   [  78% ] 0362/0365 VUs  1m33.9s/2m0s  369.51 iters/s

running (1m35.0s), 0368/0370 VUs, 14738 complete and 0 interrupted iterations
stress_test   [  79% ] 0368/0370 VUs  1m34.9s/2m0s  374.52 iters/s

running (1m36.0s), 0373/0375 VUs, 15104 complete and 0 interrupted iterations
stress_test   [  80% ] 0373/0375 VUs  1m35.9s/2m0s  379.51 iters/s

running (1m37.0s), 0378/0380 VUs, 15477 complete and 0 interrupted iterations
stress_test   [  81% ] 0378/0380 VUs  1m36.9s/2m0s  384.52 iters/s

running (1m38.0s), 0383/0385 VUs, 15854 complete and 0 interrupted iterations
stress_test   [  82% ] 0383/0385 VUs  1m37.9s/2m0s  389.52 iters/s

running (1m39.0s), 0387/0390 VUs, 16236 complete and 0 interrupted iterations
stress_test   [  82% ] 0388/0390 VUs  1m38.9s/2m0s  394.52 iters/s

running (1m40.0s), 0394/0394 VUs, 16623 complete and 0 interrupted iterations
stress_test   [  83% ] 0394/0394 VUs  1m39.9s/2m0s  399.52 iters/s

running (1m41.0s), 0398/0399 VUs, 17016 complete and 0 interrupted iterations
stress_test   [  84% ] 0398/0399 VUs  1m40.9s/2m0s  404.52 iters/s

running (1m42.0s), 0403/0404 VUs, 17413 complete and 0 interrupted iterations
stress_test   [  85% ] 0403/0404 VUs  1m41.9s/2m0s  409.52 iters/s

running (1m43.0s), 0407/0410 VUs, 17815 complete and 0 interrupted iterations
stress_test   [  86% ] 0407/0410 VUs  1m42.9s/2m0s  414.52 iters/s

running (1m44.0s), 0412/0415 VUs, 18222 complete and 0 interrupted iterations
stress_test   [  87% ] 0412/0415 VUs  1m43.9s/2m0s  419.52 iters/s

running (1m45.0s), 0418/0420 VUs, 18633 complete and 0 interrupted iterations
stress_test   [  87% ] 0418/0420 VUs  1m44.9s/2m0s  424.52 iters/s

running (1m46.0s), 0423/0425 VUs, 19050 complete and 0 interrupted iterations
stress_test   [  88% ] 0423/0425 VUs  1m45.9s/2m0s  429.52 iters/s

running (1m47.0s), 0428/0430 VUs, 19473 complete and 0 interrupted iterations
stress_test   [  89% ] 0428/0430 VUs  1m46.9s/2m0s  434.53 iters/s

running (1m48.0s), 0432/0435 VUs, 19900 complete and 0 interrupted iterations
stress_test   [  90% ] 0432/0435 VUs  1m47.9s/2m0s  439.52 iters/s

running (1m49.0s), 0437/0440 VUs, 20332 complete and 0 interrupted iterations
stress_test   [  91% ] 0437/0440 VUs  1m48.9s/2m0s  444.52 iters/s

running (1m50.0s), 0443/0445 VUs, 20769 complete and 0 interrupted iterations
stress_test   [  92% ] 0443/0445 VUs  1m49.9s/2m0s  449.53 iters/s

running (1m51.0s), 0448/0450 VUs, 21210 complete and 0 interrupted iterations
stress_test   [  92% ] 0448/0450 VUs  1m50.9s/2m0s  454.52 iters/s

running (1m52.0s), 0452/0454 VUs, 21658 complete and 0 interrupted iterations
stress_test   [  93% ] 0452/0454 VUs  1m51.9s/2m0s  459.52 iters/s

running (1m53.0s), 0456/0460 VUs, 22110 complete and 0 interrupted iterations
stress_test   [  94% ] 0456/0460 VUs  1m52.9s/2m0s  464.53 iters/s

running (1m54.0s), 0463/0465 VUs, 22565 complete and 0 interrupted iterations
stress_test   [  95% ] 0463/0465 VUs  1m53.9s/2m0s  469.53 iters/s

running (1m55.0s), 0468/0470 VUs, 23026 complete and 0 interrupted iterations
stress_test   [  96% ] 0468/0470 VUs  1m54.9s/2m0s  474.52 iters/s

running (1m56.0s), 0473/0475 VUs, 23493 complete and 0 interrupted iterations
stress_test   [  97% ] 0473/0475 VUs  1m55.9s/2m0s  479.52 iters/s

running (1m57.0s), 0477/0480 VUs, 23966 complete and 0 interrupted iterations
stress_test   [  97% ] 0478/0480 VUs  1m56.9s/2m0s  484.53 iters/s

running (1m58.0s), 0482/0486 VUs, 24442 complete and 0 interrupted iterations
stress_test   [  98% ] 0482/0486 VUs  1m57.9s/2m0s  489.52 iters/s

running (1m59.0s), 0490/0490 VUs, 24923 complete and 0 interrupted iterations
stress_test   [  99% ] 0490/0490 VUs  1m58.9s/2m0s  494.53 iters/s

running (2m00.0s), 0493/0495 VUs, 25412 complete and 0 interrupted iterations
stress_test   [ 100% ] 0493/0495 VUs  1m59.9s/2m0s  499.52 iters/s

running (2m01.0s), 0048/0496 VUs, 25903 complete and 0 interrupted iterations
stress_test ↓ [ 100% ] 0493/0496 VUs  2m0s  499.99 iters/s


  █ THRESHOLDS 

    failures
    ✓ 'rate<0.01' rate=0.00%

    http_req_duration
    ✓ 'p(95)<1500' p(95)=1.18ms

    http_req_failed
    ✓ 'rate<0.01' rate=0.00%


  █ TOTAL RESULTS 

    checks_total.......: 25951   214.324871/s
    checks_succeeded...: 100.00% 25951 out of 25951
    checks_failed......: 0.00%   0 out of 25951

    ✓ comment created 302

    CUSTOM
    failures.......................: 0.00%  0 out of 0

    HTTP
    http_req_duration..............: avg=450.92µs min=108.2µs med=353.87µs max=75.96ms p(90)=738.26µs p(95)=1.18ms p(99)=1.85ms
      { expected_response:true }...: avg=450.92µs min=108.2µs med=353.87µs max=75.96ms p(90)=738.26µs p(95)=1.18ms p(99)=1.85ms
    http_req_failed................: 0.00%  0 out of 77857
    http_reqs......................: 77857  643.007647/s

    EXECUTION
    dropped_iterations.............: 298    2.461131/s
    iteration_duration.............: avg=1s       min=1s      med=1s       max=1.01s   p(90)=1s       p(95)=1s     p(99)=1s    
    iterations.....................: 25951  214.324871/s
    vus............................: 48     min=45         max=492
    vus_max........................: 496    min=200        max=496

    NETWORK
    data_received..................: 115 MB 952 kB/s
    data_sent......................: 16 MB  129 kB/s




running (2m01.1s), 0000/0496 VUs, 25951 complete and 0 interrupted iterations
stress_test ✓ [ 100% ] 0000/0496 VUs  2m0s  499.99 iters/s
