
         /\      Grafana   /‾‾/  
    /\  /  \     |\  __   /  /   
   /  \/    \    | |/ /  /   ‾‾\ 
  /          \   |   (  |  (‾)  |
 / __________ \  |_|\_\  \_____/ 

     execution: local
        script: load-testing/k6/stress/create-comment.stress.js
        output: -

     scenarios: (100.00%) 1 scenario, 200 max VUs, 4m30s max duration (incl. graceful stop):
              * stress_test: Up to 200 looping VUs for 4m0s over 4 stages (gracefulRampDown: 30s, gracefulStop: 30s)


Run           [ 100% ] setup()
stress_test   [   0% ]

Run           [ 100% ] setup()
stress_test   [   0% ]

running (0m03.0s), 005/200 VUs, 0 complete and 0 interrupted iterations
stress_test   [   0% ] 005/200 VUs  0m00.0s/4m00.0s

running (0m04.0s), 005/200 VUs, 5 complete and 0 interrupted iterations
stress_test   [   0% ] 005/200 VUs  0m01.0s/4m00.0s

running (0m05.0s), 006/200 VUs, 5 complete and 0 interrupted iterations
stress_test   [   1% ] 006/200 VUs  0m02.0s/4m00.0s

running (0m06.0s), 007/200 VUs, 11 complete and 0 interrupted iterations
stress_test   [   1% ] 007/200 VUs  0m03.0s/4m00.0s

running (0m07.0s), 008/200 VUs, 18 complete and 0 interrupted iterations
stress_test   [   2% ] 008/200 VUs  0m04.0s/4m00.0s

running (0m08.0s), 008/200 VUs, 25 complete and 0 interrupted iterations
stress_test   [   2% ] 008/200 VUs  0m05.0s/4m00.0s

running (0m09.0s), 009/200 VUs, 33 complete and 0 interrupted iterations
stress_test   [   3% ] 009/200 VUs  0m06.0s/4m00.0s

running (0m10.0s), 010/200 VUs, 42 complete and 0 interrupted iterations
stress_test   [   3% ] 010/200 VUs  0m07.0s/4m00.0s

running (0m11.0s), 011/200 VUs, 52 complete and 0 interrupted iterations
stress_test   [   3% ] 011/200 VUs  0m08.0s/4m00.0s

running (0m12.0s), 011/200 VUs, 63 complete and 0 interrupted iterations
stress_test   [   4% ] 011/200 VUs  0m09.0s/4m00.0s

running (0m13.0s), 012/200 VUs, 73 complete and 0 interrupted iterations
stress_test   [   4% ] 012/200 VUs  0m10.0s/4m00.0s

running (0m14.0s), 013/200 VUs, 85 complete and 0 interrupted iterations
stress_test   [   5% ] 013/200 VUs  0m11.0s/4m00.0s

running (0m15.0s), 014/200 VUs, 98 complete and 0 interrupted iterations
stress_test   [   5% ] 014/200 VUs  0m12.0s/4m00.0s

running (0m16.0s), 014/200 VUs, 111 complete and 0 interrupted iterations
stress_test   [   5% ] 014/200 VUs  0m13.0s/4m00.0s

running (0m17.0s), 015/200 VUs, 125 complete and 0 interrupted iterations
stress_test   [   6% ] 015/200 VUs  0m14.0s/4m00.0s

running (0m18.0s), 016/200 VUs, 140 complete and 0 interrupted iterations
stress_test   [   6% ] 016/200 VUs  0m15.0s/4m00.0s

running (0m19.0s), 017/200 VUs, 156 complete and 0 interrupted iterations
stress_test   [   7% ] 017/200 VUs  0m16.0s/4m00.0s

running (0m20.0s), 017/200 VUs, 172 complete and 0 interrupted iterations
stress_test   [   7% ] 017/200 VUs  0m17.0s/4m00.0s

running (0m21.0s), 018/200 VUs, 189 complete and 0 interrupted iterations
stress_test   [   8% ] 018/200 VUs  0m18.0s/4m00.0s

running (0m22.0s), 019/200 VUs, 207 complete and 0 interrupted iterations
stress_test   [   8% ] 019/200 VUs  0m19.0s/4m00.0s

running (0m23.0s), 020/200 VUs, 226 complete and 0 interrupted iterations
stress_test   [   8% ] 020/200 VUs  0m20.0s/4m00.0s

running (0m24.0s), 020/200 VUs, 245 complete and 0 interrupted iterations
stress_test   [   9% ] 020/200 VUs  0m21.0s/4m00.0s

running (0m25.0s), 021/200 VUs, 265 complete and 0 interrupted iterations
stress_test   [   9% ] 021/200 VUs  0m22.0s/4m00.0s

running (0m26.0s), 022/200 VUs, 286 complete and 0 interrupted iterations
stress_test   [  10% ] 022/200 VUs  0m23.0s/4m00.0s

running (0m27.0s), 023/200 VUs, 308 complete and 0 interrupted iterations
stress_test   [  10% ] 023/200 VUs  0m24.0s/4m00.0s

running (0m28.0s), 023/200 VUs, 330 complete and 0 interrupted iterations
stress_test   [  10% ] 023/200 VUs  0m25.0s/4m00.0s

running (0m29.0s), 024/200 VUs, 353 complete and 0 interrupted iterations
stress_test   [  11% ] 024/200 VUs  0m26.0s/4m00.0s

running (0m30.0s), 025/200 VUs, 377 complete and 0 interrupted iterations
stress_test   [  11% ] 025/200 VUs  0m27.0s/4m00.0s

running (0m31.0s), 026/200 VUs, 402 complete and 0 interrupted iterations
stress_test   [  12% ] 026/200 VUs  0m28.0s/4m00.0s

running (0m32.0s), 026/200 VUs, 428 complete and 0 interrupted iterations
stress_test   [  12% ] 026/200 VUs  0m29.0s/4m00.0s

running (0m33.0s), 027/200 VUs, 453 complete and 0 interrupted iterations
stress_test   [  13% ] 027/200 VUs  0m30.0s/4m00.0s

running (0m34.0s), 028/200 VUs, 480 complete and 0 interrupted iterations
stress_test   [  13% ] 028/200 VUs  0m31.0s/4m00.0s

running (0m35.0s), 029/200 VUs, 508 complete and 0 interrupted iterations
stress_test   [  13% ] 029/200 VUs  0m32.0s/4m00.0s

running (0m36.0s), 029/200 VUs, 536 complete and 0 interrupted iterations
stress_test   [  14% ] 029/200 VUs  0m33.0s/4m00.0s

running (0m37.0s), 030/200 VUs, 565 complete and 0 interrupted iterations
stress_test   [  14% ] 030/200 VUs  0m34.0s/4m00.0s

running (0m38.0s), 031/200 VUs, 595 complete and 0 interrupted iterations
stress_test   [  15% ] 031/200 VUs  0m35.0s/4m00.0s

running (0m39.0s), 032/200 VUs, 626 complete and 0 interrupted iterations
stress_test   [  15% ] 032/200 VUs  0m36.0s/4m00.0s

running (0m40.0s), 032/200 VUs, 658 complete and 0 interrupted iterations
stress_test   [  15% ] 032/200 VUs  0m37.0s/4m00.0s

running (0m41.0s), 033/200 VUs, 689 complete and 0 interrupted iterations
stress_test   [  16% ] 033/200 VUs  0m38.0s/4m00.0s

running (0m42.0s), 034/200 VUs, 722 complete and 0 interrupted iterations
stress_test   [  16% ] 034/200 VUs  0m39.0s/4m00.0s

running (0m43.0s), 035/200 VUs, 756 complete and 0 interrupted iterations
stress_test   [  17% ] 035/200 VUs  0m40.0s/4m00.0s

running (0m44.0s), 035/200 VUs, 790 complete and 0 interrupted iterations
stress_test   [  17% ] 035/200 VUs  0m41.0s/4m00.0s

running (0m45.0s), 036/200 VUs, 825 complete and 0 interrupted iterations
stress_test   [  18% ] 036/200 VUs  0m42.0s/4m00.0s

running (0m46.0s), 037/200 VUs, 861 complete and 0 interrupted iterations
stress_test   [  18% ] 037/200 VUs  0m43.0s/4m00.0s

running (0m47.0s), 038/200 VUs, 898 complete and 0 interrupted iterations
stress_test   [  18% ] 038/200 VUs  0m44.0s/4m00.0s

running (0m48.0s), 038/200 VUs, 935 complete and 0 interrupted iterations
stress_test   [  19% ] 038/200 VUs  0m45.0s/4m00.0s

running (0m49.0s), 039/200 VUs, 973 complete and 0 interrupted iterations
stress_test   [  19% ] 039/200 VUs  0m46.0s/4m00.0s

running (0m50.0s), 040/200 VUs, 1012 complete and 0 interrupted iterations
stress_test   [  20% ] 040/200 VUs  0m47.0s/4m00.0s

running (0m51.0s), 041/200 VUs, 1052 complete and 0 interrupted iterations
stress_test   [  20% ] 041/200 VUs  0m48.0s/4m00.0s

running (0m52.0s), 041/200 VUs, 1093 complete and 0 interrupted iterations
stress_test   [  20% ] 041/200 VUs  0m49.0s/4m00.0s

running (0m53.0s), 042/200 VUs, 1133 complete and 0 interrupted iterations
stress_test   [  21% ] 042/200 VUs  0m50.0s/4m00.0s

running (0m54.0s), 043/200 VUs, 1175 complete and 0 interrupted iterations
stress_test   [  21% ] 043/200 VUs  0m51.0s/4m00.0s

running (0m55.0s), 044/200 VUs, 1218 complete and 0 interrupted iterations
stress_test   [  22% ] 044/200 VUs  0m52.0s/4m00.0s

running (0m56.0s), 044/200 VUs, 1262 complete and 0 interrupted iterations
stress_test   [  22% ] 044/200 VUs  0m53.0s/4m00.0s

running (0m57.0s), 045/200 VUs, 1305 complete and 0 interrupted iterations
stress_test   [  23% ] 045/200 VUs  0m54.0s/4m00.0s

running (0m58.0s), 046/200 VUs, 1350 complete and 0 interrupted iterations
stress_test   [  23% ] 046/200 VUs  0m55.0s/4m00.0s

running (0m59.0s), 047/200 VUs, 1396 complete and 0 interrupted iterations
stress_test   [  23% ] 047/200 VUs  0m56.0s/4m00.0s

running (1m00.0s), 047/200 VUs, 1440 complete and 0 interrupted iterations
stress_test   [  24% ] 047/200 VUs  0m57.0s/4m00.0s

running (1m01.0s), 048/200 VUs, 1486 complete and 0 interrupted iterations
stress_test   [  24% ] 048/200 VUs  0m58.0s/4m00.0s

running (1m02.0s), 049/200 VUs, 1534 complete and 0 interrupted iterations
stress_test   [  25% ] 049/200 VUs  0m59.0s/4m00.0s

running (1m03.0s), 050/200 VUs, 1583 complete and 0 interrupted iterations
stress_test   [  25% ] 050/200 VUs  1m00.0s/4m00.0s

running (1m04.0s), 050/200 VUs, 1633 complete and 0 interrupted iterations
stress_test   [  25% ] 050/200 VUs  1m01.0s/4m00.0s

running (1m05.0s), 051/200 VUs, 1682 complete and 0 interrupted iterations
stress_test   [  26% ] 051/200 VUs  1m02.0s/4m00.0s

running (1m06.0s), 052/200 VUs, 1733 complete and 0 interrupted iterations
stress_test   [  26% ] 052/200 VUs  1m03.0s/4m00.0s

running (1m07.0s), 053/200 VUs, 1785 complete and 0 interrupted iterations
stress_test   [  27% ] 053/200 VUs  1m04.0s/4m00.0s

running (1m08.0s), 054/200 VUs, 1838 complete and 0 interrupted iterations
stress_test   [  27% ] 054/200 VUs  1m05.0s/4m00.0s

running (1m09.0s), 055/200 VUs, 1892 complete and 0 interrupted iterations
stress_test   [  28% ] 055/200 VUs  1m06.0s/4m00.0s

running (1m10.0s), 055/200 VUs, 1946 complete and 0 interrupted iterations
stress_test   [  28% ] 055/200 VUs  1m07.0s/4m00.0s

running (1m11.0s), 056/200 VUs, 2001 complete and 0 interrupted iterations
stress_test   [  28% ] 056/200 VUs  1m08.0s/4m00.0s

running (1m12.0s), 057/200 VUs, 2057 complete and 0 interrupted iterations
stress_test   [  29% ] 057/200 VUs  1m09.0s/4m00.0s

running (1m13.0s), 058/200 VUs, 2114 complete and 0 interrupted iterations
stress_test   [  29% ] 058/200 VUs  1m10.0s/4m00.0s

running (1m14.0s), 059/200 VUs, 2172 complete and 0 interrupted iterations
stress_test   [  30% ] 059/200 VUs  1m11.0s/4m00.0s

running (1m15.0s), 060/200 VUs, 2229 complete and 0 interrupted iterations
stress_test   [  30% ] 060/200 VUs  1m12.0s/4m00.0s

running (1m16.0s), 060/200 VUs, 2288 complete and 0 interrupted iterations
stress_test   [  30% ] 060/200 VUs  1m13.0s/4m00.0s

running (1m17.0s), 061/200 VUs, 2348 complete and 0 interrupted iterations
stress_test   [  31% ] 061/200 VUs  1m14.0s/4m00.0s

running (1m18.0s), 062/200 VUs, 2409 complete and 0 interrupted iterations
stress_test   [  31% ] 062/200 VUs  1m15.0s/4m00.0s

running (1m19.0s), 063/200 VUs, 2471 complete and 0 interrupted iterations
stress_test   [  32% ] 063/200 VUs  1m16.0s/4m00.0s

running (1m20.0s), 064/200 VUs, 2534 complete and 0 interrupted iterations
stress_test   [  32% ] 064/200 VUs  1m17.0s/4m00.0s

running (1m21.0s), 065/200 VUs, 2598 complete and 0 interrupted iterations
stress_test   [  33% ] 065/200 VUs  1m18.0s/4m00.0s

running (1m22.0s), 065/200 VUs, 2663 complete and 0 interrupted iterations
stress_test   [  33% ] 065/200 VUs  1m19.0s/4m00.0s

running (1m23.0s), 066/200 VUs, 2728 complete and 0 interrupted iterations
stress_test   [  33% ] 066/200 VUs  1m20.0s/4m00.0s

running (1m24.0s), 067/200 VUs, 2790 complete and 0 interrupted iterations
stress_test   [  34% ] 067/200 VUs  1m21.0s/4m00.0s

running (1m25.0s), 068/200 VUs, 2857 complete and 0 interrupted iterations
stress_test   [  34% ] 068/200 VUs  1m22.0s/4m00.0s

running (1m26.0s), 069/200 VUs, 2925 complete and 0 interrupted iterations
stress_test   [  35% ] 069/200 VUs  1m23.0s/4m00.0s

running (1m27.0s), 070/200 VUs, 2994 complete and 0 interrupted iterations
stress_test   [  35% ] 070/200 VUs  1m24.0s/4m00.0s

running (1m28.0s), 070/200 VUs, 3063 complete and 0 interrupted iterations
stress_test   [  35% ] 070/200 VUs  1m25.0s/4m00.0s

running (1m29.0s), 071/200 VUs, 3133 complete and 0 interrupted iterations
stress_test   [  36% ] 071/200 VUs  1m26.0s/4m00.0s

running (1m30.0s), 072/200 VUs, 3204 complete and 0 interrupted iterations
stress_test   [  36% ] 072/200 VUs  1m27.0s/4m00.0s

running (1m31.0s), 073/200 VUs, 3276 complete and 0 interrupted iterations
stress_test   [  37% ] 073/200 VUs  1m28.0s/4m00.0s

running (1m32.0s), 074/200 VUs, 3349 complete and 0 interrupted iterations
stress_test   [  37% ] 074/200 VUs  1m29.0s/4m00.0s

running (1m33.0s), 075/200 VUs, 3423 complete and 0 interrupted iterations
stress_test   [  38% ] 075/200 VUs  1m30.0s/4m00.0s

running (1m34.0s), 075/200 VUs, 3498 complete and 0 interrupted iterations
stress_test   [  38% ] 075/200 VUs  1m31.0s/4m00.0s

running (1m35.0s), 076/200 VUs, 3573 complete and 0 interrupted iterations
stress_test   [  38% ] 076/200 VUs  1m32.0s/4m00.0s

running (1m36.0s), 077/200 VUs, 3648 complete and 0 interrupted iterations
stress_test   [  39% ] 077/200 VUs  1m33.0s/4m00.0s

running (1m37.0s), 078/200 VUs, 3722 complete and 0 interrupted iterations
stress_test   [  39% ] 078/200 VUs  1m34.0s/4m00.0s

running (1m38.0s), 079/200 VUs, 3800 complete and 0 interrupted iterations
stress_test   [  40% ] 079/200 VUs  1m35.0s/4m00.0s

running (1m39.0s), 080/200 VUs, 3879 complete and 0 interrupted iterations
stress_test   [  40% ] 080/200 VUs  1m36.0s/4m00.0s

running (1m40.0s), 080/200 VUs, 3958 complete and 0 interrupted iterations
stress_test   [  40% ] 080/200 VUs  1m37.0s/4m00.0s

running (1m41.0s), 081/200 VUs, 4038 complete and 0 interrupted iterations
stress_test   [  41% ] 081/200 VUs  1m38.0s/4m00.0s

running (1m42.0s), 082/200 VUs, 4119 complete and 0 interrupted iterations
stress_test   [  41% ] 082/200 VUs  1m39.0s/4m00.0s

running (1m43.0s), 083/200 VUs, 4201 complete and 0 interrupted iterations
stress_test   [  42% ] 083/200 VUs  1m40.0s/4m00.0s

running (1m44.0s), 084/200 VUs, 4284 complete and 0 interrupted iterations
stress_test   [  42% ] 084/200 VUs  1m41.0s/4m00.0s

running (1m45.0s), 085/200 VUs, 4368 complete and 0 interrupted iterations
stress_test   [  43% ] 085/200 VUs  1m42.0s/4m00.0s

running (1m46.0s), 085/200 VUs, 4453 complete and 0 interrupted iterations
stress_test   [  43% ] 085/200 VUs  1m43.0s/4m00.0s

running (1m47.0s), 086/200 VUs, 4537 complete and 0 interrupted iterations
stress_test   [  43% ] 086/200 VUs  1m44.0s/4m00.0s

running (1m48.0s), 087/200 VUs, 4623 complete and 0 interrupted iterations
stress_test   [  44% ] 087/200 VUs  1m45.0s/4m00.0s

running (1m49.0s), 088/200 VUs, 4710 complete and 0 interrupted iterations
stress_test   [  44% ] 088/200 VUs  1m46.0s/4m00.0s

running (1m50.0s), 089/200 VUs, 4798 complete and 0 interrupted iterations
stress_test   [  45% ] 089/200 VUs  1m47.0s/4m00.0s

running (1m51.0s), 090/200 VUs, 4887 complete and 0 interrupted iterations
stress_test   [  45% ] 090/200 VUs  1m48.0s/4m00.0s

running (1m52.0s), 090/200 VUs, 4976 complete and 0 interrupted iterations
stress_test   [  45% ] 090/200 VUs  1m49.0s/4m00.0s

running (1m53.0s), 091/200 VUs, 5066 complete and 0 interrupted iterations
stress_test   [  46% ] 091/200 VUs  1m50.0s/4m00.0s

running (1m54.0s), 092/200 VUs, 5148 complete and 0 interrupted iterations
stress_test   [  46% ] 092/200 VUs  1m51.0s/4m00.0s

running (1m55.0s), 093/200 VUs, 5239 complete and 0 interrupted iterations
stress_test   [  47% ] 093/200 VUs  1m52.0s/4m00.0s

running (1m56.0s), 094/200 VUs, 5332 complete and 0 interrupted iterations
stress_test   [  47% ] 094/200 VUs  1m53.0s/4m00.0s

running (1m57.0s), 095/200 VUs, 5426 complete and 0 interrupted iterations
stress_test   [  48% ] 095/200 VUs  1m54.0s/4m00.0s

running (1m58.0s), 095/200 VUs, 5521 complete and 0 interrupted iterations
stress_test   [  48% ] 095/200 VUs  1m55.0s/4m00.0s

running (1m59.0s), 096/200 VUs, 5615 complete and 0 interrupted iterations
stress_test   [  48% ] 096/200 VUs  1m56.0s/4m00.0s

running (2m00.0s), 097/200 VUs, 5710 complete and 0 interrupted iterations
stress_test   [  49% ] 097/200 VUs  1m57.0s/4m00.0s

running (2m01.0s), 098/200 VUs, 5807 complete and 0 interrupted iterations
stress_test   [  49% ] 098/200 VUs  1m58.0s/4m00.0s

running (2m02.0s), 099/200 VUs, 5905 complete and 0 interrupted iterations
stress_test   [  50% ] 099/200 VUs  1m59.0s/4m00.0s

running (2m03.0s), 100/200 VUs, 6004 complete and 0 interrupted iterations
stress_test   [  50% ] 100/200 VUs  2m00.0s/4m00.0s

running (2m04.0s), 100/200 VUs, 6104 complete and 0 interrupted iterations
stress_test   [  50% ] 100/200 VUs  2m01.0s/4m00.0s

running (2m05.0s), 101/200 VUs, 6204 complete and 0 interrupted iterations
stress_test   [  51% ] 101/200 VUs  2m02.0s/4m00.0s

running (2m06.0s), 102/200 VUs, 6304 complete and 0 interrupted iterations
stress_test   [  51% ] 102/200 VUs  2m03.0s/4m00.0s

running (2m07.0s), 103/200 VUs, 6406 complete and 0 interrupted iterations
stress_test   [  52% ] 103/200 VUs  2m04.0s/4m00.0s

running (2m08.0s), 104/200 VUs, 6509 complete and 0 interrupted iterations
stress_test   [  52% ] 104/200 VUs  2m05.0s/4m00.0s

running (2m09.0s), 105/200 VUs, 6613 complete and 0 interrupted iterations
stress_test   [  53% ] 105/200 VUs  2m06.0s/4m00.0s

running (2m10.0s), 105/200 VUs, 6706 complete and 0 interrupted iterations
stress_test   [  53% ] 105/200 VUs  2m07.0s/4m00.0s

running (2m11.0s), 106/200 VUs, 6811 complete and 0 interrupted iterations
stress_test   [  53% ] 106/200 VUs  2m08.0s/4m00.0s

running (2m12.0s), 107/200 VUs, 6917 complete and 0 interrupted iterations
stress_test   [  54% ] 107/200 VUs  2m09.0s/4m00.0s

running (2m13.0s), 108/200 VUs, 7024 complete and 0 interrupted iterations
stress_test   [  54% ] 108/200 VUs  2m10.0s/4m00.0s

running (2m14.0s), 109/200 VUs, 7132 complete and 0 interrupted iterations
stress_test   [  55% ] 109/200 VUs  2m11.0s/4m00.0s

running (2m15.0s), 110/200 VUs, 7241 complete and 0 interrupted iterations
stress_test   [  55% ] 110/200 VUs  2m12.0s/4m00.0s

running (2m16.0s), 110/200 VUs, 7351 complete and 0 interrupted iterations
stress_test   [  55% ] 110/200 VUs  2m13.0s/4m00.0s

running (2m17.0s), 111/200 VUs, 7461 complete and 0 interrupted iterations
stress_test   [  56% ] 111/200 VUs  2m14.0s/4m00.0s

running (2m18.0s), 112/200 VUs, 7554 complete and 0 interrupted iterations
stress_test   [  56% ] 112/200 VUs  2m15.0s/4m00.0s

running (2m19.0s), 113/200 VUs, 7660 complete and 0 interrupted iterations
stress_test   [  57% ] 113/200 VUs  2m16.0s/4m00.0s

running (2m20.0s), 114/200 VUs, 7773 complete and 0 interrupted iterations
stress_test   [  57% ] 114/200 VUs  2m17.0s/4m00.0s

running (2m21.0s), 115/200 VUs, 7887 complete and 0 interrupted iterations
stress_test   [  58% ] 115/200 VUs  2m18.0s/4m00.0s

running (2m22.0s), 115/200 VUs, 8001 complete and 0 interrupted iterations
stress_test   [  58% ] 115/200 VUs  2m19.0s/4m00.0s

running (2m23.0s), 116/200 VUs, 8116 complete and 0 interrupted iterations
stress_test   [  58% ] 116/200 VUs  2m20.0s/4m00.0s

running (2m24.0s), 117/200 VUs, 8232 complete and 0 interrupted iterations
stress_test   [  59% ] 117/200 VUs  2m21.0s/4m00.0s

running (2m25.0s), 118/200 VUs, 8349 complete and 0 interrupted iterations
stress_test   [  59% ] 118/200 VUs  2m22.0s/4m00.0s

running (2m26.0s), 119/200 VUs, 8467 complete and 0 interrupted iterations
stress_test   [  60% ] 119/200 VUs  2m23.0s/4m00.0s

running (2m27.0s), 120/200 VUs, 8586 complete and 0 interrupted iterations
stress_test   [  60% ] 120/200 VUs  2m24.0s/4m00.0s

running (2m28.0s), 120/200 VUs, 8706 complete and 0 interrupted iterations
stress_test   [  60% ] 120/200 VUs  2m25.0s/4m00.0s

running (2m29.0s), 121/200 VUs, 8825 complete and 0 interrupted iterations
stress_test   [  61% ] 121/200 VUs  2m26.0s/4m00.0s

running (2m30.0s), 122/200 VUs, 8946 complete and 0 interrupted iterations
stress_test   [  61% ] 122/200 VUs  2m27.0s/4m00.0s

running (2m31.0s), 123/200 VUs, 9068 complete and 0 interrupted iterations
stress_test   [  62% ] 123/200 VUs  2m28.0s/4m00.0s

running (2m32.0s), 124/200 VUs, 9191 complete and 0 interrupted iterations
stress_test   [  62% ] 124/200 VUs  2m29.0s/4m00.0s

running (2m33.0s), 125/200 VUs, 9314 complete and 0 interrupted iterations
stress_test   [  63% ] 125/200 VUs  2m30.0s/4m00.0s

running (2m34.0s), 125/200 VUs, 9438 complete and 0 interrupted iterations
stress_test   [  63% ] 125/200 VUs  2m31.0s/4m00.0s

running (2m35.0s), 126/200 VUs, 9563 complete and 0 interrupted iterations
stress_test   [  63% ] 126/200 VUs  2m32.0s/4m00.0s

running (2m36.0s), 127/200 VUs, 9689 complete and 0 interrupted iterations
stress_test   [  64% ] 127/200 VUs  2m33.0s/4m00.0s

running (2m37.0s), 128/200 VUs, 9816 complete and 0 interrupted iterations
stress_test   [  64% ] 128/200 VUs  2m34.0s/4m00.0s

running (2m38.0s), 129/200 VUs, 9944 complete and 0 interrupted iterations
stress_test   [  65% ] 129/200 VUs  2m35.0s/4m00.0s

running (2m39.0s), 130/200 VUs, 10073 complete and 0 interrupted iterations
stress_test   [  65% ] 130/200 VUs  2m36.0s/4m00.0s

running (2m40.0s), 130/200 VUs, 10203 complete and 0 interrupted iterations
stress_test   [  65% ] 130/200 VUs  2m37.0s/4m00.0s

running (2m41.0s), 131/200 VUs, 10332 complete and 0 interrupted iterations
stress_test   [  66% ] 131/200 VUs  2m38.0s/4m00.0s

running (2m42.0s), 132/200 VUs, 10463 complete and 0 interrupted iterations
stress_test   [  66% ] 132/200 VUs  2m39.0s/4m00.0s

running (2m43.0s), 133/200 VUs, 10595 complete and 0 interrupted iterations
stress_test   [  67% ] 133/200 VUs  2m40.0s/4m00.0s

running (2m44.0s), 134/200 VUs, 10725 complete and 0 interrupted iterations
stress_test   [  67% ] 134/200 VUs  2m41.0s/4m00.0s

running (2m45.0s), 135/200 VUs, 10859 complete and 0 interrupted iterations
stress_test   [  68% ] 135/200 VUs  2m42.0s/4m00.0s

running (2m46.0s), 135/200 VUs, 10994 complete and 0 interrupted iterations
stress_test   [  68% ] 135/200 VUs  2m43.0s/4m00.0s

running (2m47.0s), 136/200 VUs, 11129 complete and 0 interrupted iterations
stress_test   [  68% ] 136/200 VUs  2m44.0s/4m00.0s

running (2m48.0s), 137/200 VUs, 11264 complete and 0 interrupted iterations
stress_test   [  69% ] 137/200 VUs  2m45.0s/4m00.0s

running (2m49.0s), 138/200 VUs, 11401 complete and 0 interrupted iterations
stress_test   [  69% ] 138/200 VUs  2m46.0s/4m00.0s

running (2m50.0s), 139/200 VUs, 11539 complete and 0 interrupted iterations
stress_test   [  70% ] 139/200 VUs  2m47.0s/4m00.0s

running (2m51.0s), 140/200 VUs, 11678 complete and 0 interrupted iterations
stress_test   [  70% ] 140/200 VUs  2m48.0s/4m00.0s

running (2m52.0s), 140/200 VUs, 11817 complete and 0 interrupted iterations
stress_test   [  70% ] 140/200 VUs  2m49.0s/4m00.0s

running (2m53.0s), 141/200 VUs, 11952 complete and 0 interrupted iterations
stress_test   [  71% ] 141/200 VUs  2m50.0s/4m00.0s

running (2m54.0s), 142/200 VUs, 12093 complete and 0 interrupted iterations
stress_test   [  71% ] 142/200 VUs  2m51.0s/4m00.0s

running (2m55.0s), 143/200 VUs, 12235 complete and 0 interrupted iterations
stress_test   [  72% ] 143/200 VUs  2m52.0s/4m00.0s

running (2m56.0s), 144/200 VUs, 12378 complete and 0 interrupted iterations
stress_test   [  72% ] 144/200 VUs  2m53.0s/4m00.0s

running (2m57.0s), 145/200 VUs, 12522 complete and 0 interrupted iterations
stress_test   [  73% ] 145/200 VUs  2m54.0s/4m00.0s

running (2m58.0s), 145/200 VUs, 12667 complete and 0 interrupted iterations
stress_test   [  73% ] 145/200 VUs  2m55.0s/4m00.0s

running (2m59.0s), 146/200 VUs, 12811 complete and 0 interrupted iterations
stress_test   [  73% ] 146/200 VUs  2m56.0s/4m00.0s

running (3m00.0s), 147/200 VUs, 12957 complete and 0 interrupted iterations
stress_test   [  74% ] 147/200 VUs  2m57.0s/4m00.0s

running (3m01.0s), 148/200 VUs, 13104 complete and 0 interrupted iterations
stress_test   [  74% ] 148/200 VUs  2m58.0s/4m00.0s

running (3m02.0s), 149/200 VUs, 13252 complete and 0 interrupted iterations
stress_test   [  75% ] 149/200 VUs  2m59.0s/4m00.0s

running (3m03.0s), 150/200 VUs, 13401 complete and 0 interrupted iterations
stress_test   [  75% ] 150/200 VUs  3m00.0s/4m00.0s

running (3m04.0s), 150/200 VUs, 13551 complete and 0 interrupted iterations
stress_test   [  75% ] 150/200 VUs  3m01.0s/4m00.0s

running (3m05.0s), 151/200 VUs, 13700 complete and 0 interrupted iterations
stress_test   [  76% ] 151/200 VUs  3m02.0s/4m00.0s

running (3m06.0s), 152/200 VUs, 13851 complete and 0 interrupted iterations
stress_test   [  76% ] 152/200 VUs  3m03.0s/4m00.0s

running (3m07.0s), 153/200 VUs, 14003 complete and 0 interrupted iterations
stress_test   [  77% ] 153/200 VUs  3m04.0s/4m00.0s

running (3m08.0s), 154/200 VUs, 14156 complete and 0 interrupted iterations
stress_test   [  77% ] 154/200 VUs  3m05.0s/4m00.0s

running (3m09.0s), 155/200 VUs, 14310 complete and 0 interrupted iterations
stress_test   [  78% ] 155/200 VUs  3m06.0s/4m00.0s

running (3m10.0s), 155/200 VUs, 14433 complete and 0 interrupted iterations
stress_test   [  78% ] 155/200 VUs  3m07.0s/4m00.0s

running (3m11.0s), 156/200 VUs, 14588 complete and 0 interrupted iterations
stress_test   [  78% ] 156/200 VUs  3m08.0s/4m00.0s

running (3m12.0s), 157/200 VUs, 14744 complete and 0 interrupted iterations
stress_test   [  79% ] 157/200 VUs  3m09.0s/4m00.0s

running (3m13.0s), 158/200 VUs, 14901 complete and 0 interrupted iterations
stress_test   [  79% ] 158/200 VUs  3m10.0s/4m00.0s

running (3m14.0s), 159/200 VUs, 15059 complete and 0 interrupted iterations
stress_test   [  80% ] 159/200 VUs  3m11.0s/4m00.0s

running (3m15.0s), 160/200 VUs, 15218 complete and 0 interrupted iterations
stress_test   [  80% ] 160/200 VUs  3m12.0s/4m00.0s

running (3m16.0s), 160/200 VUs, 15377 complete and 0 interrupted iterations
stress_test   [  80% ] 160/200 VUs  3m13.0s/4m00.0s

running (3m17.0s), 161/200 VUs, 15537 complete and 0 interrupted iterations
stress_test   [  81% ] 161/200 VUs  3m14.0s/4m00.0s

running (3m18.0s), 162/200 VUs, 15698 complete and 0 interrupted iterations
stress_test   [  81% ] 162/200 VUs  3m15.0s/4m00.0s

running (3m19.0s), 163/200 VUs, 15860 complete and 0 interrupted iterations
stress_test   [  82% ] 163/200 VUs  3m16.0s/4m00.0s

running (3m20.0s), 164/200 VUs, 16023 complete and 0 interrupted iterations
stress_test   [  82% ] 164/200 VUs  3m17.0s/4m00.0s

running (3m21.0s), 165/200 VUs, 16187 complete and 0 interrupted iterations
stress_test   [  83% ] 165/200 VUs  3m18.0s/4m00.0s

running (3m22.0s), 165/200 VUs, 16352 complete and 0 interrupted iterations
stress_test   [  83% ] 165/200 VUs  3m19.0s/4m00.0s

running (3m23.0s), 166/200 VUs, 16516 complete and 0 interrupted iterations
stress_test   [  83% ] 166/200 VUs  3m20.0s/4m00.0s

running (3m24.0s), 167/200 VUs, 16682 complete and 0 interrupted iterations
stress_test   [  84% ] 167/200 VUs  3m21.0s/4m00.0s

running (3m25.0s), 168/200 VUs, 16821 complete and 0 interrupted iterations
stress_test   [  84% ] 168/200 VUs  3m22.0s/4m00.0s

running (3m26.0s), 169/200 VUs, 16989 complete and 0 interrupted iterations
stress_test   [  85% ] 169/200 VUs  3m23.0s/4m00.0s

running (3m27.0s), 170/200 VUs, 17158 complete and 0 interrupted iterations
stress_test   [  85% ] 170/200 VUs  3m24.0s/4m00.0s

running (3m28.0s), 170/200 VUs, 17328 complete and 0 interrupted iterations
stress_test   [  85% ] 170/200 VUs  3m25.0s/4m00.0s

running (3m29.0s), 171/200 VUs, 17497 complete and 0 interrupted iterations
stress_test   [  86% ] 171/200 VUs  3m26.0s/4m00.0s

running (3m30.0s), 172/200 VUs, 17668 complete and 0 interrupted iterations
stress_test   [  86% ] 172/200 VUs  3m27.0s/4m00.0s

running (3m31.0s), 173/200 VUs, 17840 complete and 0 interrupted iterations
stress_test   [  87% ] 173/200 VUs  3m28.0s/4m00.0s

running (3m32.0s), 174/200 VUs, 18013 complete and 0 interrupted iterations
stress_test   [  87% ] 174/200 VUs  3m29.0s/4m00.0s

running (3m33.0s), 175/200 VUs, 18187 complete and 0 interrupted iterations
stress_test   [  88% ] 175/200 VUs  3m30.0s/4m00.0s

running (3m34.0s), 175/200 VUs, 18361 complete and 0 interrupted iterations
stress_test   [  88% ] 175/200 VUs  3m31.0s/4m00.0s

running (3m35.0s), 176/200 VUs, 18536 complete and 0 interrupted iterations
stress_test   [  88% ] 176/200 VUs  3m32.0s/4m00.0s

running (3m36.0s), 177/200 VUs, 18712 complete and 0 interrupted iterations
stress_test   [  89% ] 177/200 VUs  3m33.0s/4m00.0s

running (3m37.0s), 178/200 VUs, 18889 complete and 0 interrupted iterations
stress_test   [  89% ] 178/200 VUs  3m34.0s/4m00.0s

running (3m38.0s), 179/200 VUs, 19067 complete and 0 interrupted iterations
stress_test   [  90% ] 179/200 VUs  3m35.0s/4m00.0s

running (3m39.0s), 180/200 VUs, 19246 complete and 0 interrupted iterations
stress_test   [  90% ] 180/200 VUs  3m36.0s/4m00.0s

running (3m40.0s), 180/200 VUs, 19426 complete and 0 interrupted iterations
stress_test   [  90% ] 180/200 VUs  3m37.0s/4m00.0s

running (3m41.0s), 181/200 VUs, 19606 complete and 0 interrupted iterations
stress_test   [  91% ] 181/200 VUs  3m38.0s/4m00.0s

running (3m42.0s), 182/200 VUs, 19786 complete and 0 interrupted iterations
stress_test   [  91% ] 182/200 VUs  3m39.0s/4m00.0s

running (3m43.0s), 183/200 VUs, 19968 complete and 0 interrupted iterations
stress_test   [  92% ] 183/200 VUs  3m40.0s/4m00.0s

running (3m44.0s), 184/200 VUs, 20151 complete and 0 interrupted iterations
stress_test   [  92% ] 184/200 VUs  3m41.0s/4m00.0s

running (3m45.0s), 185/200 VUs, 20335 complete and 0 interrupted iterations
stress_test   [  93% ] 185/200 VUs  3m42.0s/4m00.0s

running (3m46.0s), 185/200 VUs, 20519 complete and 0 interrupted iterations
stress_test   [  93% ] 185/200 VUs  3m43.0s/4m00.0s

running (3m47.0s), 186/200 VUs, 20702 complete and 0 interrupted iterations
stress_test   [  93% ] 186/200 VUs  3m44.0s/4m00.0s

running (3m48.0s), 187/200 VUs, 20888 complete and 0 interrupted iterations
stress_test   [  94% ] 187/200 VUs  3m45.0s/4m00.0s

running (3m49.0s), 188/200 VUs, 21075 complete and 0 interrupted iterations
stress_test   [  94% ] 188/200 VUs  3m46.0s/4m00.0s

running (3m50.0s), 189/200 VUs, 21263 complete and 0 interrupted iterations
stress_test   [  95% ] 189/200 VUs  3m47.0s/4m00.0s

running (3m51.0s), 190/200 VUs, 21452 complete and 0 interrupted iterations
stress_test   [  95% ] 190/200 VUs  3m48.0s/4m00.0s

running (3m52.0s), 190/200 VUs, 21641 complete and 0 interrupted iterations
stress_test   [  95% ] 190/200 VUs  3m49.0s/4m00.0s

running (3m53.0s), 191/200 VUs, 21831 complete and 0 interrupted iterations
stress_test   [  96% ] 191/200 VUs  3m50.0s/4m00.0s

running (3m54.0s), 192/200 VUs, 22022 complete and 0 interrupted iterations
stress_test   [  96% ] 192/200 VUs  3m51.0s/4m00.0s

running (3m55.0s), 193/200 VUs, 22214 complete and 0 interrupted iterations
stress_test   [  97% ] 193/200 VUs  3m52.0s/4m00.0s

running (3m56.0s), 194/200 VUs, 22407 complete and 0 interrupted iterations
stress_test   [  97% ] 194/200 VUs  3m53.0s/4m00.0s

running (3m57.0s), 195/200 VUs, 22601 complete and 0 interrupted iterations
stress_test   [  98% ] 195/200 VUs  3m54.0s/4m00.0s

running (3m58.0s), 195/200 VUs, 22795 complete and 0 interrupted iterations
stress_test   [  98% ] 195/200 VUs  3m55.0s/4m00.0s

running (3m59.0s), 196/200 VUs, 22990 complete and 0 interrupted iterations
stress_test   [  98% ] 196/200 VUs  3m56.0s/4m00.0s

running (4m00.0s), 197/200 VUs, 23186 complete and 0 interrupted iterations
stress_test   [  99% ] 197/200 VUs  3m57.0s/4m00.0s

running (4m01.0s), 198/200 VUs, 23383 complete and 0 interrupted iterations
stress_test   [  99% ] 198/200 VUs  3m58.0s/4m00.0s

running (4m02.0s), 199/200 VUs, 23581 complete and 0 interrupted iterations
stress_test   [ 100% ] 199/200 VUs  3m59.0s/4m00.0s

running (4m03.0s), 196/200 VUs, 23780 complete and 0 interrupted iterations
stress_test ↓ [ 100% ] 200/200 VUs  4m0s

running (4m04.0s), 000/200 VUs, 23976 complete and 0 interrupted iterations
stress_test ✓ [ 100% ] 000/200 VUs  4m0s


  █ THRESHOLDS 

    failures
    ✓ 'rate<0.01' rate=0.00%

    http_req_duration
    ✓ 'p(95)<1500' p(95)=6.66ms

    http_req_failed
    ✓ 'rate<0.01' rate=0.00%


  █ TOTAL RESULTS 

    checks_total.......: 23976   98.277388/s
    checks_succeeded...: 100.00% 23976 out of 23976
    checks_failed......: 0.00%   0 out of 23976

    ✓ comment created 302

    CUSTOM
    failures.......................: 0.00%  0 out of 0

    HTTP
    http_req_duration..............: avg=2.24ms min=135µs med=1.44ms max=2.64s p(90)=5.23ms p(95)=6.66ms p(99)=9.08ms
      { expected_response:true }...: avg=2.24ms min=135µs med=1.44ms max=2.64s p(90)=5.23ms p(95)=6.66ms p(99)=9.08ms
    http_req_failed................: 0.00%  0 out of 71931
    http_reqs......................: 71931  294.844461/s

    EXECUTION
    iteration_duration.............: avg=1s     min=1s    med=1s     max=1.03s p(90)=1.01s  p(95)=1.01s  p(99)=1.02s 
    iterations.....................: 23976  98.277388/s
    vus............................: 196    min=0          max=199
    vus_max........................: 200    min=200        max=200

    NETWORK
    data_received..................: 146 MB 599 kB/s
    data_sent......................: 15 MB  61 kB/s




running (4m04.0s), 000/200 VUs, 23976 complete and 0 interrupted iterations
stress_test ✓ [ 100% ] 000/200 VUs  4m0s
