
         /\      Grafana   /‾‾/  
    /\  /  \     |\  __   /  /   
   /  \/    \    | |/ /  /   ‾‾\ 
  /          \   |   (  |  (‾)  |
 / __________ \  |_|\_\  \_____/ 

     execution: local
        script: load-testing/k6/stress/create-post.stress.js
        output: -

     scenarios: (100.00%) 1 scenario, 1000 max VUs, 7m30s max duration (incl. graceful stop):
              * stress_test: Up to 200.00 iterations/s for 7m0s over 7 stages (maxVUs: 100-1000, gracefulStop: 30s)


running (0m01.0s), 0009/0100 VUs, 0 complete and 0 interrupted iterations
stress_test   [   0% ] 0009/0100 VUs  0m01.0s/7m0s  010.00 iters/s

running (0m02.0s), 0010/0100 VUs, 9 complete and 0 interrupted iterations
stress_test   [   0% ] 0010/0100 VUs  0m02.0s/7m0s  010.00 iters/s

running (0m03.0s), 0010/0100 VUs, 19 complete and 0 interrupted iterations
stress_test   [   1% ] 0010/0100 VUs  0m03.0s/7m0s  010.00 iters/s

running (0m04.0s), 0010/0100 VUs, 29 complete and 0 interrupted iterations
stress_test   [   1% ] 0010/0100 VUs  0m04.0s/7m0s  010.00 iters/s

running (0m05.0s), 0010/0100 VUs, 39 complete and 0 interrupted iterations
stress_test   [   1% ] 0010/0100 VUs  0m05.0s/7m0s  010.00 iters/s

running (0m06.0s), 0010/0100 VUs, 49 complete and 0 interrupted iterations
stress_test   [   1% ] 0010/0100 VUs  0m06.0s/7m0s  010.00 iters/s

running (0m07.0s), 0010/0100 VUs, 59 complete and 0 interrupted iterations
stress_test   [   2% ] 0010/0100 VUs  0m07.0s/7m0s  010.00 iters/s

running (0m08.0s), 0010/0100 VUs, 69 complete and 0 interrupted iterations
stress_test   [   2% ] 0010/0100 VUs  0m08.0s/7m0s  010.00 iters/s

running (0m09.0s), 0011/0100 VUs, 78 complete and 0 interrupted iterations
stress_test   [   2% ] 0011/0100 VUs  0m09.0s/7m0s  010.00 iters/s

running (0m10.0s), 0010/0100 VUs, 89 complete and 0 interrupted iterations
stress_test   [   2% ] 0010/0100 VUs  0m10.0s/7m0s  010.00 iters/s

running (0m11.0s), 0010/0100 VUs, 99 complete and 0 interrupted iterations
stress_test   [   3% ] 0010/0100 VUs  0m11.0s/7m0s  010.00 iters/s

running (0m12.0s), 0010/0100 VUs, 109 complete and 0 interrupted iterations
stress_test   [   3% ] 0010/0100 VUs  0m12.0s/7m0s  010.00 iters/s

running (0m13.0s), 0010/0100 VUs, 119 complete and 0 interrupted iterations
stress_test   [   3% ] 0010/0100 VUs  0m13.0s/7m0s  010.00 iters/s

running (0m14.0s), 0010/0100 VUs, 129 complete and 0 interrupted iterations
stress_test   [   3% ] 0010/0100 VUs  0m14.0s/7m0s  010.00 iters/s

running (0m15.0s), 0010/0100 VUs, 139 complete and 0 interrupted iterations
stress_test   [   4% ] 0010/0100 VUs  0m15.0s/7m0s  010.00 iters/s

running (0m16.0s), 0010/0100 VUs, 149 complete and 0 interrupted iterations
stress_test   [   4% ] 0010/0100 VUs  0m16.0s/7m0s  010.00 iters/s

running (0m17.0s), 0010/0100 VUs, 159 complete and 0 interrupted iterations
stress_test   [   4% ] 0010/0100 VUs  0m17.0s/7m0s  010.00 iters/s

running (0m18.0s), 0010/0100 VUs, 169 complete and 0 interrupted iterations
stress_test   [   4% ] 0010/0100 VUs  0m18.0s/7m0s  010.00 iters/s

running (0m19.0s), 0010/0100 VUs, 179 complete and 0 interrupted iterations
stress_test   [   5% ] 0010/0100 VUs  0m19.0s/7m0s  010.00 iters/s

running (0m20.0s), 0010/0100 VUs, 189 complete and 0 interrupted iterations
stress_test   [   5% ] 0010/0100 VUs  0m20.0s/7m0s  010.00 iters/s

running (0m21.0s), 0010/0100 VUs, 199 complete and 0 interrupted iterations
stress_test   [   5% ] 0010/0100 VUs  0m21.0s/7m0s  010.00 iters/s

running (0m22.0s), 0010/0100 VUs, 209 complete and 0 interrupted iterations
stress_test   [   5% ] 0010/0100 VUs  0m22.0s/7m0s  010.00 iters/s

running (0m23.0s), 0010/0100 VUs, 219 complete and 0 interrupted iterations
stress_test   [   5% ] 0010/0100 VUs  0m23.0s/7m0s  010.00 iters/s

running (0m24.0s), 0010/0100 VUs, 229 complete and 0 interrupted iterations
stress_test   [   6% ] 0010/0100 VUs  0m24.0s/7m0s  010.00 iters/s

running (0m25.0s), 0010/0100 VUs, 239 complete and 0 interrupted iterations
stress_test   [   6% ] 0010/0100 VUs  0m25.0s/7m0s  010.00 iters/s

running (0m26.0s), 0010/0100 VUs, 249 complete and 0 interrupted iterations
stress_test   [   6% ] 0010/0100 VUs  0m26.0s/7m0s  010.00 iters/s

running (0m27.0s), 0010/0100 VUs, 259 complete and 0 interrupted iterations
stress_test   [   6% ] 0010/0100 VUs  0m27.0s/7m0s  010.00 iters/s

running (0m28.0s), 0010/0100 VUs, 269 complete and 0 interrupted iterations
stress_test   [   7% ] 0010/0100 VUs  0m28.0s/7m0s  010.00 iters/s

running (0m29.0s), 0010/0100 VUs, 279 complete and 0 interrupted iterations
stress_test   [   7% ] 0010/0100 VUs  0m29.0s/7m0s  010.00 iters/s

running (0m30.0s), 0010/0100 VUs, 289 complete and 0 interrupted iterations
stress_test   [   7% ] 0010/0100 VUs  0m30.0s/7m0s  010.00 iters/s

running (0m31.0s), 0010/0100 VUs, 299 complete and 0 interrupted iterations
stress_test   [   7% ] 0010/0100 VUs  0m31.0s/7m0s  010.00 iters/s

running (0m32.0s), 0010/0100 VUs, 309 complete and 0 interrupted iterations
stress_test   [   8% ] 0010/0100 VUs  0m32.0s/7m0s  010.00 iters/s

running (0m33.0s), 0010/0100 VUs, 319 complete and 0 interrupted iterations
stress_test   [   8% ] 0010/0100 VUs  0m33.0s/7m0s  010.00 iters/s

running (0m34.0s), 0010/0100 VUs, 329 complete and 0 interrupted iterations
stress_test   [   8% ] 0010/0100 VUs  0m34.0s/7m0s  010.00 iters/s

running (0m35.0s), 0010/0100 VUs, 339 complete and 0 interrupted iterations
stress_test   [   8% ] 0010/0100 VUs  0m35.0s/7m0s  010.00 iters/s

running (0m36.0s), 0010/0100 VUs, 349 complete and 0 interrupted iterations
stress_test   [   9% ] 0010/0100 VUs  0m36.0s/7m0s  010.00 iters/s

running (0m37.0s), 0010/0100 VUs, 359 complete and 0 interrupted iterations
stress_test   [   9% ] 0010/0100 VUs  0m37.0s/7m0s  010.00 iters/s

running (0m38.0s), 0010/0100 VUs, 369 complete and 0 interrupted iterations
stress_test   [   9% ] 0010/0100 VUs  0m38.0s/7m0s  010.00 iters/s

running (0m39.0s), 0010/0100 VUs, 379 complete and 0 interrupted iterations
stress_test   [   9% ] 0010/0100 VUs  0m39.0s/7m0s  010.00 iters/s

running (0m40.0s), 0010/0100 VUs, 389 complete and 0 interrupted iterations
stress_test   [  10% ] 0010/0100 VUs  0m40.0s/7m0s  010.00 iters/s

running (0m41.0s), 0010/0100 VUs, 399 complete and 0 interrupted iterations
stress_test   [  10% ] 0010/0100 VUs  0m41.0s/7m0s  010.00 iters/s

running (0m42.0s), 0010/0100 VUs, 409 complete and 0 interrupted iterations
stress_test   [  10% ] 0010/0100 VUs  0m42.0s/7m0s  010.00 iters/s

running (0m43.0s), 0010/0100 VUs, 419 complete and 0 interrupted iterations
stress_test   [  10% ] 0010/0100 VUs  0m43.0s/7m0s  010.00 iters/s

running (0m44.0s), 0010/0100 VUs, 429 complete and 0 interrupted iterations
stress_test   [  10% ] 0010/0100 VUs  0m44.0s/7m0s  010.00 iters/s

running (0m45.0s), 0010/0100 VUs, 439 complete and 0 interrupted iterations
stress_test   [  11% ] 0010/0100 VUs  0m45.0s/7m0s  010.00 iters/s

running (0m46.0s), 0010/0100 VUs, 449 complete and 0 interrupted iterations
stress_test   [  11% ] 0010/0100 VUs  0m46.0s/7m0s  010.00 iters/s

running (0m47.0s), 0010/0100 VUs, 459 complete and 0 interrupted iterations
stress_test   [  11% ] 0010/0100 VUs  0m47.0s/7m0s  010.00 iters/s

running (0m48.0s), 0010/0100 VUs, 469 complete and 0 interrupted iterations
stress_test   [  11% ] 0010/0100 VUs  0m48.0s/7m0s  010.00 iters/s

running (0m49.0s), 0010/0100 VUs, 479 complete and 0 interrupted iterations
stress_test   [  12% ] 0010/0100 VUs  0m49.0s/7m0s  010.00 iters/s

running (0m50.0s), 0010/0100 VUs, 489 complete and 0 interrupted iterations
stress_test   [  12% ] 0010/0100 VUs  0m50.0s/7m0s  010.00 iters/s

running (0m51.0s), 0010/0100 VUs, 499 complete and 0 interrupted iterations
stress_test   [  12% ] 0010/0100 VUs  0m51.0s/7m0s  010.00 iters/s

running (0m52.0s), 0010/0100 VUs, 509 complete and 0 interrupted iterations
stress_test   [  12% ] 0010/0100 VUs  0m52.0s/7m0s  010.00 iters/s

running (0m53.0s), 0010/0100 VUs, 519 complete and 0 interrupted iterations
stress_test   [  13% ] 0010/0100 VUs  0m53.0s/7m0s  010.00 iters/s

running (0m54.0s), 0010/0100 VUs, 529 complete and 0 interrupted iterations
stress_test   [  13% ] 0010/0100 VUs  0m54.0s/7m0s  010.00 iters/s

running (0m55.0s), 0010/0100 VUs, 539 complete and 0 interrupted iterations
stress_test   [  13% ] 0010/0100 VUs  0m55.0s/7m0s  010.00 iters/s

running (0m56.0s), 0010/0100 VUs, 549 complete and 0 interrupted iterations
stress_test   [  13% ] 0010/0100 VUs  0m56.0s/7m0s  010.00 iters/s

running (0m57.0s), 0010/0100 VUs, 559 complete and 0 interrupted iterations
stress_test   [  14% ] 0010/0100 VUs  0m57.0s/7m0s  010.00 iters/s

running (0m58.0s), 0010/0100 VUs, 569 complete and 0 interrupted iterations
stress_test   [  14% ] 0010/0100 VUs  0m58.0s/7m0s  010.00 iters/s

running (0m59.0s), 0010/0100 VUs, 579 complete and 0 interrupted iterations
stress_test   [  14% ] 0010/0100 VUs  0m59.0s/7m0s  010.00 iters/s

running (1m00.0s), 0010/0100 VUs, 589 complete and 0 interrupted iterations
stress_test   [  14% ] 0010/0100 VUs  1m00.0s/7m0s  010.00 iters/s

running (1m01.0s), 0011/0100 VUs, 599 complete and 0 interrupted iterations
stress_test   [  15% ] 0011/0100 VUs  1m01.0s/7m0s  010.26 iters/s

running (1m02.0s), 0011/0100 VUs, 609 complete and 0 interrupted iterations
stress_test   [  15% ] 0011/0100 VUs  1m02.0s/7m0s  010.50 iters/s

running (1m03.0s), 0012/0100 VUs, 619 complete and 0 interrupted iterations
stress_test   [  15% ] 0012/0100 VUs  1m03.0s/7m0s  010.76 iters/s

running (1m04.0s), 0011/0100 VUs, 630 complete and 0 interrupted iterations
stress_test   [  15% ] 0011/0100 VUs  1m04.0s/7m0s  010.99 iters/s

running (1m05.0s), 0013/0100 VUs, 640 complete and 0 interrupted iterations
stress_test   [  15% ] 0013/0100 VUs  1m05.0s/7m0s  011.26 iters/s

running (1m06.0s), 0012/0100 VUs, 652 complete and 0 interrupted iterations
stress_test   [  16% ] 0012/0100 VUs  1m06.0s/7m0s  011.50 iters/s

running (1m07.0s), 0013/0100 VUs, 663 complete and 0 interrupted iterations
stress_test   [  16% ] 0013/0100 VUs  1m07.0s/7m0s  011.76 iters/s

running (1m08.0s), 0012/0100 VUs, 675 complete and 0 interrupted iterations
stress_test   [  16% ] 0012/0100 VUs  1m08.0s/7m0s  011.99 iters/s

running (1m09.0s), 0014/0100 VUs, 686 complete and 0 interrupted iterations
stress_test   [  16% ] 0014/0100 VUs  1m09.0s/7m0s  012.26 iters/s

running (1m10.0s), 0013/0100 VUs, 699 complete and 0 interrupted iterations
stress_test   [  17% ] 0013/0100 VUs  1m10.0s/7m0s  012.50 iters/s

running (1m11.0s), 0014/0100 VUs, 711 complete and 0 interrupted iterations
stress_test   [  17% ] 0014/0100 VUs  1m11.0s/7m0s  012.76 iters/s

running (1m12.0s), 0014/0100 VUs, 723 complete and 0 interrupted iterations
stress_test   [  17% ] 0014/0100 VUs  1m12.0s/7m0s  012.99 iters/s

running (1m13.0s), 0015/0100 VUs, 736 complete and 0 interrupted iterations
stress_test   [  17% ] 0015/0100 VUs  1m13.0s/7m0s  013.26 iters/s

running (1m14.0s), 0015/0100 VUs, 749 complete and 0 interrupted iterations
stress_test   [  18% ] 0015/0100 VUs  1m14.0s/7m0s  013.50 iters/s

running (1m15.0s), 0014/0100 VUs, 763 complete and 0 interrupted iterations
stress_test   [  18% ] 0014/0100 VUs  1m15.0s/7m0s  013.74 iters/s

running (1m16.0s), 0015/0100 VUs, 776 complete and 0 interrupted iterations
stress_test   [  18% ] 0015/0100 VUs  1m16.0s/7m0s  013.99 iters/s

running (1m17.0s), 0015/0100 VUs, 790 complete and 0 interrupted iterations
stress_test   [  18% ] 0015/0100 VUs  1m17.0s/7m0s  014.24 iters/s

running (1m18.0s), 0016/0100 VUs, 804 complete and 0 interrupted iterations
stress_test   [  19% ] 0016/0100 VUs  1m18.0s/7m0s  014.50 iters/s

running (1m19.0s), 0015/0100 VUs, 819 complete and 0 interrupted iterations
stress_test   [  19% ] 0015/0100 VUs  1m19.0s/7m0s  014.74 iters/s

running (1m20.0s), 0016/0100 VUs, 833 complete and 0 interrupted iterations
stress_test   [  19% ] 0016/0100 VUs  1m20.0s/7m0s  014.99 iters/s

running (1m21.0s), 0016/0100 VUs, 848 complete and 0 interrupted iterations
stress_test   [  19% ] 0016/0100 VUs  1m21.0s/7m0s  015.24 iters/s

running (1m22.0s), 0017/0100 VUs, 863 complete and 0 interrupted iterations
stress_test   [  20% ] 0017/0100 VUs  1m22.0s/7m0s  015.50 iters/s

running (1m23.0s), 0016/0100 VUs, 879 complete and 0 interrupted iterations
stress_test   [  20% ] 0016/0100 VUs  1m23.0s/7m0s  015.74 iters/s

running (1m24.0s), 0017/0100 VUs, 894 complete and 0 interrupted iterations
stress_test   [  20% ] 0017/0100 VUs  1m24.0s/7m0s  015.99 iters/s

running (1m25.0s), 0017/0100 VUs, 910 complete and 0 interrupted iterations
stress_test   [  20% ] 0017/0100 VUs  1m25.0s/7m0s  016.24 iters/s

running (1m26.0s), 0018/0100 VUs, 926 complete and 0 interrupted iterations
stress_test   [  20% ] 0018/0100 VUs  1m26.0s/7m0s  016.50 iters/s

running (1m27.0s), 0018/0100 VUs, 942 complete and 0 interrupted iterations
stress_test   [  21% ] 0018/0100 VUs  1m27.0s/7m0s  016.74 iters/s

running (1m28.0s), 0018/0100 VUs, 959 complete and 0 interrupted iterations
stress_test   [  21% ] 0018/0100 VUs  1m28.0s/7m0s  016.99 iters/s

running (1m29.0s), 0018/0100 VUs, 976 complete and 0 interrupted iterations
stress_test   [  21% ] 0018/0100 VUs  1m29.0s/7m0s  017.24 iters/s

running (1m30.0s), 0019/0100 VUs, 993 complete and 0 interrupted iterations
stress_test   [  21% ] 0019/0100 VUs  1m30.0s/7m0s  017.50 iters/s

running (1m31.0s), 0019/0100 VUs, 1010 complete and 0 interrupted iterations
stress_test   [  22% ] 0019/0100 VUs  1m31.0s/7m0s  017.74 iters/s

running (1m32.0s), 0019/0100 VUs, 1028 complete and 0 interrupted iterations
stress_test   [  22% ] 0019/0100 VUs  1m32.0s/7m0s  017.99 iters/s

running (1m33.0s), 0019/0100 VUs, 1046 complete and 0 interrupted iterations
stress_test   [  22% ] 0019/0100 VUs  1m33.0s/7m0s  018.24 iters/s

running (1m34.0s), 0020/0100 VUs, 1064 complete and 0 interrupted iterations
stress_test   [  22% ] 0020/0100 VUs  1m34.0s/7m0s  018.50 iters/s

running (1m35.0s), 0020/0100 VUs, 1082 complete and 0 interrupted iterations
stress_test   [  23% ] 0020/0100 VUs  1m35.0s/7m0s  018.74 iters/s

running (1m36.0s), 0020/0100 VUs, 1101 complete and 0 interrupted iterations
stress_test   [  23% ] 0020/0100 VUs  1m36.0s/7m0s  018.99 iters/s

running (1m37.0s), 0020/0100 VUs, 1120 complete and 0 interrupted iterations
stress_test   [  23% ] 0020/0100 VUs  1m37.0s/7m0s  019.24 iters/s

running (1m38.0s), 0021/0100 VUs, 1139 complete and 0 interrupted iterations
stress_test   [  23% ] 0021/0100 VUs  1m38.0s/7m0s  019.50 iters/s

running (1m39.0s), 0021/0100 VUs, 1158 complete and 0 interrupted iterations
stress_test   [  24% ] 0021/0100 VUs  1m39.0s/7m0s  019.74 iters/s

running (1m40.0s), 0021/0100 VUs, 1178 complete and 0 interrupted iterations
stress_test   [  24% ] 0021/0100 VUs  1m40.0s/7m0s  019.99 iters/s

running (1m41.0s), 0021/0100 VUs, 1198 complete and 0 interrupted iterations
stress_test   [  24% ] 0021/0100 VUs  1m41.0s/7m0s  020.24 iters/s

running (1m42.0s), 0022/0100 VUs, 1218 complete and 0 interrupted iterations
stress_test   [  24% ] 0022/0100 VUs  1m42.0s/7m0s  020.50 iters/s

running (1m43.0s), 0022/0100 VUs, 1238 complete and 0 interrupted iterations
stress_test   [  25% ] 0022/0100 VUs  1m43.0s/7m0s  020.74 iters/s

running (1m44.0s), 0022/0100 VUs, 1259 complete and 0 interrupted iterations
stress_test   [  25% ] 0022/0100 VUs  1m44.0s/7m0s  020.99 iters/s

running (1m45.0s), 0022/0100 VUs, 1280 complete and 0 interrupted iterations
stress_test   [  25% ] 0022/0100 VUs  1m45.0s/7m0s  021.24 iters/s

running (1m46.0s), 0023/0100 VUs, 1301 complete and 0 interrupted iterations
stress_test   [  25% ] 0023/0100 VUs  1m46.0s/7m0s  021.50 iters/s

running (1m47.0s), 0023/0100 VUs, 1322 complete and 0 interrupted iterations
stress_test   [  25% ] 0023/0100 VUs  1m47.0s/7m0s  021.74 iters/s

running (1m48.0s), 0023/0100 VUs, 1344 complete and 0 interrupted iterations
stress_test   [  26% ] 0023/0100 VUs  1m48.0s/7m0s  021.99 iters/s

running (1m49.0s), 0024/0100 VUs, 1365 complete and 0 interrupted iterations
stress_test   [  26% ] 0024/0100 VUs  1m49.0s/7m0s  022.24 iters/s

running (1m50.0s), 0024/0100 VUs, 1388 complete and 0 interrupted iterations
stress_test   [  26% ] 0024/0100 VUs  1m50.0s/7m0s  022.50 iters/s

running (1m51.0s), 0024/0100 VUs, 1410 complete and 0 interrupted iterations
stress_test   [  26% ] 0024/0100 VUs  1m51.0s/7m0s  022.74 iters/s

running (1m52.0s), 0024/0100 VUs, 1433 complete and 0 interrupted iterations
stress_test   [  27% ] 0024/0100 VUs  1m52.0s/7m0s  022.99 iters/s

running (1m53.0s), 0025/0100 VUs, 1455 complete and 0 interrupted iterations
stress_test   [  27% ] 0025/0100 VUs  1m53.0s/7m0s  023.24 iters/s

running (1m54.0s), 0026/0100 VUs, 1478 complete and 0 interrupted iterations
stress_test   [  27% ] 0026/0100 VUs  1m54.0s/7m0s  023.50 iters/s

running (1m55.0s), 0025/0100 VUs, 1502 complete and 0 interrupted iterations
stress_test   [  27% ] 0025/0100 VUs  1m55.0s/7m0s  023.74 iters/s

running (1m56.0s), 0026/0100 VUs, 1525 complete and 0 interrupted iterations
stress_test   [  28% ] 0026/0100 VUs  1m56.0s/7m0s  023.99 iters/s

running (1m57.0s), 0026/0100 VUs, 1549 complete and 0 interrupted iterations
stress_test   [  28% ] 0026/0100 VUs  1m57.0s/7m0s  024.24 iters/s

running (1m58.0s), 0027/0100 VUs, 1573 complete and 0 interrupted iterations
stress_test   [  28% ] 0027/0100 VUs  1m58.0s/7m0s  024.50 iters/s

running (1m59.0s), 0026/0100 VUs, 1598 complete and 0 interrupted iterations
stress_test   [  28% ] 0026/0100 VUs  1m59.0s/7m0s  024.74 iters/s

running (2m00.0s), 0027/0100 VUs, 1622 complete and 0 interrupted iterations
stress_test   [  29% ] 0027/0100 VUs  2m00.0s/7m0s  024.99 iters/s

running (2m01.0s), 0027/0100 VUs, 1647 complete and 0 interrupted iterations
stress_test   [  29% ] 0027/0100 VUs  2m01.0s/7m0s  025.41 iters/s

running (2m02.0s), 0028/0100 VUs, 1672 complete and 0 interrupted iterations
stress_test   [  29% ] 0028/0100 VUs  2m02.0s/7m0s  025.83 iters/s

running (2m03.0s), 0028/0100 VUs, 1698 complete and 0 interrupted iterations
stress_test   [  29% ] 0028/0100 VUs  2m03.0s/7m0s  026.24 iters/s

running (2m04.0s), 0029/0100 VUs, 1724 complete and 0 interrupted iterations
stress_test   [  30% ] 0029/0100 VUs  2m04.0s/7m0s  026.67 iters/s

running (2m05.0s), 0029/0100 VUs, 1750 complete and 0 interrupted iterations
stress_test   [  30% ] 0029/0100 VUs  2m05.0s/7m0s  027.07 iters/s

running (2m06.0s), 0030/0100 VUs, 1777 complete and 0 interrupted iterations
stress_test   [  30% ] 0030/0100 VUs  2m06.0s/7m0s  027.50 iters/s

running (2m07.0s), 0030/0100 VUs, 1804 complete and 0 interrupted iterations
stress_test   [  30% ] 0030/0100 VUs  2m07.0s/7m0s  027.91 iters/s

running (2m08.0s), 0031/0100 VUs, 1832 complete and 0 interrupted iterations
stress_test   [  30% ] 0031/0100 VUs  2m08.0s/7m0s  028.34 iters/s

running (2m09.0s), 0031/0100 VUs, 1860 complete and 0 interrupted iterations
stress_test   [  31% ] 0031/0100 VUs  2m09.0s/7m0s  028.74 iters/s

running (2m10.0s), 0031/0100 VUs, 1889 complete and 0 interrupted iterations
stress_test   [  31% ] 0031/0100 VUs  2m10.0s/7m0s  029.16 iters/s

running (2m11.0s), 0031/0100 VUs, 1918 complete and 0 interrupted iterations
stress_test   [  31% ] 0031/0100 VUs  2m11.0s/7m0s  029.57 iters/s

running (2m12.0s), 0032/0100 VUs, 1947 complete and 0 interrupted iterations
stress_test   [  31% ] 0032/0100 VUs  2m12.0s/7m0s  029.99 iters/s

running (2m13.0s), 0032/0100 VUs, 1977 complete and 0 interrupted iterations
stress_test   [  32% ] 0032/0100 VUs  2m13.0s/7m0s  030.41 iters/s

running (2m14.0s), 0033/0100 VUs, 2007 complete and 0 interrupted iterations
stress_test   [  32% ] 0033/0100 VUs  2m14.0s/7m0s  030.83 iters/s

running (2m15.0s), 0034/0100 VUs, 2037 complete and 0 interrupted iterations
stress_test   [  32% ] 0034/0100 VUs  2m15.0s/7m0s  031.24 iters/s

running (2m16.0s), 0035/0100 VUs, 2068 complete and 0 interrupted iterations
stress_test   [  32% ] 0035/0100 VUs  2m16.0s/7m0s  031.67 iters/s

running (2m17.0s), 0034/0100 VUs, 2100 complete and 0 interrupted iterations
stress_test   [  33% ] 0034/0100 VUs  2m17.0s/7m0s  032.07 iters/s

running (2m18.0s), 0035/0100 VUs, 2132 complete and 0 interrupted iterations
stress_test   [  33% ] 0035/0100 VUs  2m18.0s/7m0s  032.50 iters/s

running (2m19.0s), 0035/0100 VUs, 2164 complete and 0 interrupted iterations
stress_test   [  33% ] 0035/0100 VUs  2m19.0s/7m0s  032.91 iters/s

running (2m20.0s), 0036/0100 VUs, 2197 complete and 0 interrupted iterations
stress_test   [  33% ] 0036/0100 VUs  2m20.0s/7m0s  033.34 iters/s

running (2m21.0s), 0036/0100 VUs, 2230 complete and 0 interrupted iterations
stress_test   [  34% ] 0036/0100 VUs  2m21.0s/7m0s  033.75 iters/s

running (2m22.0s), 0037/0100 VUs, 2263 complete and 0 interrupted iterations
stress_test   [  34% ] 0037/0100 VUs  2m22.0s/7m0s  034.16 iters/s

running (2m23.0s), 0037/0100 VUs, 2297 complete and 0 interrupted iterations
stress_test   [  34% ] 0037/0100 VUs  2m23.0s/7m0s  034.57 iters/s

running (2m24.0s), 0038/0100 VUs, 2331 complete and 0 interrupted iterations
stress_test   [  34% ] 0038/0100 VUs  2m24.0s/7m0s  034.99 iters/s

running (2m25.0s), 0038/0100 VUs, 2366 complete and 0 interrupted iterations
stress_test   [  35% ] 0038/0100 VUs  2m25.0s/7m0s  035.41 iters/s

running (2m26.0s), 0039/0100 VUs, 2401 complete and 0 interrupted iterations
stress_test   [  35% ] 0039/0100 VUs  2m26.0s/7m0s  035.83 iters/s

running (2m27.0s), 0039/0100 VUs, 2437 complete and 0 interrupted iterations
stress_test   [  35% ] 0039/0100 VUs  2m27.0s/7m0s  036.25 iters/s

running (2m28.0s), 0039/0100 VUs, 2473 complete and 0 interrupted iterations
stress_test   [  35% ] 0039/0100 VUs  2m28.0s/7m0s  036.66 iters/s

running (2m29.0s), 0040/0100 VUs, 2509 complete and 0 interrupted iterations
stress_test   [  35% ] 0040/0100 VUs  2m29.0s/7m0s  037.08 iters/s

running (2m30.0s), 0041/0100 VUs, 2546 complete and 0 interrupted iterations
stress_test   [  36% ] 0041/0100 VUs  2m30.0s/7m0s  037.50 iters/s

running (2m31.0s), 0041/0100 VUs, 2583 complete and 0 interrupted iterations
stress_test   [  36% ] 0041/0100 VUs  2m31.0s/7m0s  037.91 iters/s

running (2m32.0s), 0041/0100 VUs, 2621 complete and 0 interrupted iterations
stress_test   [  36% ] 0041/0100 VUs  2m32.0s/7m0s  038.32 iters/s

running (2m33.0s), 0042/0100 VUs, 2659 complete and 0 interrupted iterations
stress_test   [  36% ] 0042/0100 VUs  2m33.0s/7m0s  038.75 iters/s

running (2m34.0s), 0042/0100 VUs, 2698 complete and 0 interrupted iterations
stress_test   [  37% ] 0042/0100 VUs  2m34.0s/7m0s  039.16 iters/s

running (2m35.0s), 0042/0100 VUs, 2737 complete and 0 interrupted iterations
stress_test   [  37% ] 0042/0100 VUs  2m35.0s/7m0s  039.58 iters/s

running (2m36.0s), 0043/0100 VUs, 2776 complete and 0 interrupted iterations
stress_test   [  37% ] 0043/0100 VUs  2m36.0s/7m0s  039.99 iters/s

running (2m37.0s), 0043/0100 VUs, 2816 complete and 0 interrupted iterations
stress_test   [  37% ] 0043/0100 VUs  2m37.0s/7m0s  040.41 iters/s

running (2m38.0s), 0044/0100 VUs, 2856 complete and 0 interrupted iterations
stress_test   [  38% ] 0044/0100 VUs  2m38.0s/7m0s  040.83 iters/s

running (2m39.0s), 0045/0100 VUs, 2896 complete and 0 interrupted iterations
stress_test   [  38% ] 0045/0100 VUs  2m39.0s/7m0s  041.25 iters/s

running (2m40.0s), 0045/0100 VUs, 2937 complete and 0 interrupted iterations
stress_test   [  38% ] 0045/0100 VUs  2m40.0s/7m0s  041.66 iters/s

running (2m41.0s), 0045/0100 VUs, 2979 complete and 0 interrupted iterations
stress_test   [  38% ] 0045/0100 VUs  2m41.0s/7m0s  042.08 iters/s

running (2m42.0s), 0046/0100 VUs, 3021 complete and 0 interrupted iterations
stress_test   [  39% ] 0046/0100 VUs  2m42.0s/7m0s  042.50 iters/s

running (2m43.0s), 0046/0100 VUs, 3063 complete and 0 interrupted iterations
stress_test   [  39% ] 0046/0100 VUs  2m43.0s/7m0s  042.91 iters/s

running (2m44.0s), 0046/0100 VUs, 3106 complete and 0 interrupted iterations
stress_test   [  39% ] 0046/0100 VUs  2m44.0s/7m0s  043.33 iters/s

running (2m45.0s), 0047/0100 VUs, 3149 complete and 0 interrupted iterations
stress_test   [  39% ] 0047/0100 VUs  2m45.0s/7m0s  043.75 iters/s

running (2m46.0s), 0048/0100 VUs, 3192 complete and 0 interrupted iterations
stress_test   [  40% ] 0048/0100 VUs  2m46.0s/7m0s  044.16 iters/s

running (2m47.0s), 0048/0100 VUs, 3236 complete and 0 interrupted iterations
stress_test   [  40% ] 0048/0100 VUs  2m47.0s/7m0s  044.58 iters/s

running (2m48.0s), 0049/0100 VUs, 3280 complete and 0 interrupted iterations
stress_test   [  40% ] 0048/0100 VUs  2m48.0s/7m0s  045.00 iters/s

running (2m49.0s), 0049/0100 VUs, 3325 complete and 0 interrupted iterations
stress_test   [  40% ] 0049/0100 VUs  2m49.0s/7m0s  045.41 iters/s

running (2m50.0s), 0050/0100 VUs, 3370 complete and 0 interrupted iterations
stress_test   [  40% ] 0050/0100 VUs  2m50.0s/7m0s  045.83 iters/s

running (2m51.0s), 0050/0100 VUs, 3416 complete and 0 interrupted iterations
stress_test   [  41% ] 0050/0100 VUs  2m51.0s/7m0s  046.25 iters/s

running (2m52.0s), 0050/0100 VUs, 3462 complete and 0 interrupted iterations
stress_test   [  41% ] 0050/0100 VUs  2m52.0s/7m0s  046.66 iters/s

running (2m53.0s), 0051/0100 VUs, 3508 complete and 0 interrupted iterations
stress_test   [  41% ] 0051/0100 VUs  2m53.0s/7m0s  047.08 iters/s

running (2m54.0s), 0052/0100 VUs, 3555 complete and 0 interrupted iterations
stress_test   [  41% ] 0052/0100 VUs  2m54.0s/7m0s  047.50 iters/s

running (2m55.0s), 0052/0100 VUs, 3602 complete and 0 interrupted iterations
stress_test   [  42% ] 0052/0100 VUs  2m55.0s/7m0s  047.91 iters/s

running (2m56.0s), 0052/0100 VUs, 3650 complete and 0 interrupted iterations
stress_test   [  42% ] 0052/0100 VUs  2m56.0s/7m0s  048.33 iters/s

running (2m57.0s), 0053/0100 VUs, 3698 complete and 0 interrupted iterations
stress_test   [  42% ] 0053/0100 VUs  2m57.0s/7m0s  048.75 iters/s

running (2m58.0s), 0053/0100 VUs, 3747 complete and 0 interrupted iterations
stress_test   [  42% ] 0053/0100 VUs  2m58.0s/7m0s  049.16 iters/s

running (2m59.0s), 0053/0100 VUs, 3796 complete and 0 interrupted iterations
stress_test   [  43% ] 0053/0100 VUs  2m59.0s/7m0s  049.58 iters/s

running (3m00.0s), 0054/0100 VUs, 3845 complete and 0 interrupted iterations
stress_test   [  43% ] 0054/0100 VUs  3m00.0s/7m0s  050.00 iters/s

running (3m01.0s), 0054/0100 VUs, 3895 complete and 0 interrupted iterations
stress_test   [  43% ] 0054/0100 VUs  3m01.0s/7m0s  050.41 iters/s

running (3m02.0s), 0055/0100 VUs, 3945 complete and 0 interrupted iterations
stress_test   [  43% ] 0055/0100 VUs  3m02.0s/7m0s  050.83 iters/s

running (3m03.0s), 0055/0100 VUs, 3996 complete and 0 interrupted iterations
stress_test   [  44% ] 0055/0100 VUs  3m03.0s/7m0s  051.25 iters/s

running (3m04.0s), 0056/0100 VUs, 4046 complete and 0 interrupted iterations
stress_test   [  44% ] 0056/0100 VUs  3m04.0s/7m0s  051.66 iters/s

running (3m05.0s), 0056/0100 VUs, 4098 complete and 0 interrupted iterations
stress_test   [  44% ] 0056/0100 VUs  3m05.0s/7m0s  052.08 iters/s

running (3m06.0s), 0057/0100 VUs, 4150 complete and 0 interrupted iterations
stress_test   [  44% ] 0057/0100 VUs  3m06.0s/7m0s  052.50 iters/s

running (3m07.0s), 0057/0100 VUs, 4202 complete and 0 interrupted iterations
stress_test   [  45% ] 0057/0100 VUs  3m07.0s/7m0s  052.91 iters/s

running (3m08.0s), 0057/0100 VUs, 4255 complete and 0 interrupted iterations
stress_test   [  45% ] 0057/0100 VUs  3m08.0s/7m0s  053.33 iters/s

running (3m09.0s), 0058/0100 VUs, 4308 complete and 0 interrupted iterations
stress_test   [  45% ] 0058/0100 VUs  3m09.0s/7m0s  053.75 iters/s

running (3m10.0s), 0059/0100 VUs, 4361 complete and 0 interrupted iterations
stress_test   [  45% ] 0059/0100 VUs  3m10.0s/7m0s  054.16 iters/s

running (3m11.0s), 0059/0100 VUs, 4415 complete and 0 interrupted iterations
stress_test   [  45% ] 0059/0100 VUs  3m11.0s/7m0s  054.58 iters/s

running (3m12.0s), 0059/0100 VUs, 4470 complete and 0 interrupted iterations
stress_test   [  46% ] 0059/0100 VUs  3m12.0s/7m0s  055.00 iters/s

running (3m13.0s), 0060/0100 VUs, 4524 complete and 0 interrupted iterations
stress_test   [  46% ] 0060/0100 VUs  3m13.0s/7m0s  055.41 iters/s

running (3m14.0s), 0060/0100 VUs, 4580 complete and 0 interrupted iterations
stress_test   [  46% ] 0060/0100 VUs  3m14.0s/7m0s  055.83 iters/s

running (3m15.0s), 0061/0100 VUs, 4635 complete and 0 interrupted iterations
stress_test   [  46% ] 0061/0100 VUs  3m15.0s/7m0s  056.25 iters/s

running (3m16.0s), 0061/0100 VUs, 4691 complete and 0 interrupted iterations
stress_test   [  47% ] 0061/0100 VUs  3m16.0s/7m0s  056.66 iters/s

running (3m17.0s), 0062/0100 VUs, 4747 complete and 0 interrupted iterations
stress_test   [  47% ] 0062/0100 VUs  3m17.0s/7m0s  057.08 iters/s

running (3m18.0s), 0062/0100 VUs, 4804 complete and 0 interrupted iterations
stress_test   [  47% ] 0062/0100 VUs  3m18.0s/7m0s  057.49 iters/s

running (3m19.0s), 0062/0100 VUs, 4862 complete and 0 interrupted iterations
stress_test   [  47% ] 0062/0100 VUs  3m19.0s/7m0s  057.91 iters/s

running (3m20.0s), 0063/0100 VUs, 4919 complete and 0 interrupted iterations
stress_test   [  48% ] 0063/0100 VUs  3m20.0s/7m0s  058.33 iters/s

running (3m21.0s), 0064/0100 VUs, 4977 complete and 0 interrupted iterations
stress_test   [  48% ] 0064/0100 VUs  3m21.0s/7m0s  058.75 iters/s

running (3m22.0s), 0064/0100 VUs, 5036 complete and 0 interrupted iterations
stress_test   [  48% ] 0064/0100 VUs  3m22.0s/7m0s  059.16 iters/s

running (3m23.0s), 0064/0100 VUs, 5095 complete and 0 interrupted iterations
stress_test   [  48% ] 0064/0100 VUs  3m23.0s/7m0s  059.58 iters/s

running (3m24.0s), 0065/0100 VUs, 5154 complete and 0 interrupted iterations
stress_test   [  49% ] 0065/0100 VUs  3m24.0s/7m0s  060.00 iters/s

running (3m25.0s), 0065/0100 VUs, 5214 complete and 0 interrupted iterations
stress_test   [  49% ] 0065/0100 VUs  3m25.0s/7m0s  060.41 iters/s

running (3m26.0s), 0066/0100 VUs, 5274 complete and 0 interrupted iterations
stress_test   [  49% ] 0066/0100 VUs  3m26.0s/7m0s  060.83 iters/s

running (3m27.0s), 0066/0100 VUs, 5335 complete and 0 interrupted iterations
stress_test   [  49% ] 0066/0100 VUs  3m27.0s/7m0s  061.25 iters/s

running (3m28.0s), 0066/0100 VUs, 5396 complete and 0 interrupted iterations
stress_test   [  50% ] 0066/0100 VUs  3m28.0s/7m0s  061.66 iters/s

running (3m29.0s), 0067/0100 VUs, 5457 complete and 0 interrupted iterations
stress_test   [  50% ] 0067/0100 VUs  3m29.0s/7m0s  062.08 iters/s

running (3m30.0s), 0067/0100 VUs, 5519 complete and 0 interrupted iterations
stress_test   [  50% ] 0067/0100 VUs  3m30.0s/7m0s  062.49 iters/s

running (3m31.0s), 0068/0100 VUs, 5581 complete and 0 interrupted iterations
stress_test   [  50% ] 0068/0100 VUs  3m31.0s/7m0s  062.91 iters/s

running (3m32.0s), 0068/0100 VUs, 5644 complete and 0 interrupted iterations
stress_test   [  50% ] 0068/0100 VUs  3m32.0s/7m0s  063.33 iters/s

running (3m33.0s), 0069/0100 VUs, 5707 complete and 0 interrupted iterations
stress_test   [  51% ] 0069/0100 VUs  3m33.0s/7m0s  063.75 iters/s

running (3m34.0s), 0070/0100 VUs, 5770 complete and 0 interrupted iterations
stress_test   [  51% ] 0070/0100 VUs  3m34.0s/7m0s  064.16 iters/s

running (3m35.0s), 0070/0100 VUs, 5834 complete and 0 interrupted iterations
stress_test   [  51% ] 0070/0100 VUs  3m35.0s/7m0s  064.58 iters/s

running (3m36.0s), 0071/0100 VUs, 5898 complete and 0 interrupted iterations
stress_test   [  51% ] 0071/0100 VUs  3m36.0s/7m0s  065.00 iters/s

running (3m37.0s), 0071/0100 VUs, 5963 complete and 0 interrupted iterations
stress_test   [  52% ] 0071/0100 VUs  3m37.0s/7m0s  065.41 iters/s

running (3m38.0s), 0072/0100 VUs, 6028 complete and 0 interrupted iterations
stress_test   [  52% ] 0072/0100 VUs  3m38.0s/7m0s  065.83 iters/s

running (3m39.0s), 0072/0100 VUs, 6094 complete and 0 interrupted iterations
stress_test   [  52% ] 0072/0100 VUs  3m39.0s/7m0s  066.25 iters/s

running (3m40.0s), 0072/0100 VUs, 6160 complete and 0 interrupted iterations
stress_test   [  52% ] 0072/0100 VUs  3m40.0s/7m0s  066.66 iters/s

running (3m41.0s), 0072/0100 VUs, 6227 complete and 0 interrupted iterations
stress_test   [  53% ] 0072/0100 VUs  3m41.0s/7m0s  067.08 iters/s

running (3m42.0s), 0073/0100 VUs, 6293 complete and 0 interrupted iterations
stress_test   [  53% ] 0073/0100 VUs  3m42.0s/7m0s  067.49 iters/s

running (3m43.0s), 0073/0100 VUs, 6361 complete and 0 interrupted iterations
stress_test   [  53% ] 0073/0100 VUs  3m43.0s/7m0s  067.91 iters/s

running (3m44.0s), 0074/0100 VUs, 6428 complete and 0 interrupted iterations
stress_test   [  53% ] 0074/0100 VUs  3m44.0s/7m0s  068.33 iters/s

running (3m45.0s), 0075/0100 VUs, 6496 complete and 0 interrupted iterations
stress_test   [  54% ] 0075/0100 VUs  3m45.0s/7m0s  068.75 iters/s

running (3m46.0s), 0075/0100 VUs, 6565 complete and 0 interrupted iterations
stress_test   [  54% ] 0075/0100 VUs  3m46.0s/7m0s  069.16 iters/s

running (3m47.0s), 0075/0100 VUs, 6634 complete and 0 interrupted iterations
stress_test   [  54% ] 0075/0100 VUs  3m47.0s/7m0s  069.58 iters/s

running (3m48.0s), 0076/0100 VUs, 6703 complete and 0 interrupted iterations
stress_test   [  54% ] 0076/0100 VUs  3m48.0s/7m0s  070.00 iters/s

running (3m49.0s), 0076/0100 VUs, 6773 complete and 0 interrupted iterations
stress_test   [  55% ] 0076/0100 VUs  3m49.0s/7m0s  070.41 iters/s

running (3m50.0s), 0077/0100 VUs, 6843 complete and 0 interrupted iterations
stress_test   [  55% ] 0077/0100 VUs  3m50.0s/7m0s  070.83 iters/s

running (3m51.0s), 0077/0100 VUs, 6914 complete and 0 interrupted iterations
stress_test   [  55% ] 0077/0100 VUs  3m51.0s/7m0s  071.25 iters/s

running (3m52.0s), 0077/0100 VUs, 6985 complete and 0 interrupted iterations
stress_test   [  55% ] 0077/0100 VUs  3m52.0s/7m0s  071.66 iters/s

running (3m53.0s), 0078/0100 VUs, 7056 complete and 0 interrupted iterations
stress_test   [  55% ] 0078/0100 VUs  3m53.0s/7m0s  072.08 iters/s

running (3m54.0s), 0078/0100 VUs, 7128 complete and 0 interrupted iterations
stress_test   [  56% ] 0078/0100 VUs  3m54.0s/7m0s  072.49 iters/s

running (3m55.0s), 0079/0100 VUs, 7200 complete and 0 interrupted iterations
stress_test   [  56% ] 0079/0100 VUs  3m55.0s/7m0s  072.91 iters/s

running (3m56.0s), 0079/0100 VUs, 7273 complete and 0 interrupted iterations
stress_test   [  56% ] 0079/0100 VUs  3m56.0s/7m0s  073.33 iters/s

running (3m57.0s), 0080/0100 VUs, 7346 complete and 0 interrupted iterations
stress_test   [  56% ] 0080/0100 VUs  3m57.0s/7m0s  073.75 iters/s

running (3m58.0s), 0081/0100 VUs, 7419 complete and 0 interrupted iterations
stress_test   [  57% ] 0081/0100 VUs  3m58.0s/7m0s  074.16 iters/s

running (3m59.0s), 0081/0100 VUs, 7493 complete and 0 interrupted iterations
stress_test   [  57% ] 0081/0100 VUs  3m59.0s/7m0s  074.58 iters/s

running (4m00.0s), 0081/0100 VUs, 7568 complete and 0 interrupted iterations
stress_test   [  57% ] 0081/0100 VUs  4m00.0s/7m0s  075.00 iters/s

running (4m01.0s), 0082/0100 VUs, 7642 complete and 0 interrupted iterations
stress_test   [  57% ] 0082/0100 VUs  4m01.0s/7m0s  075.41 iters/s

running (4m02.0s), 0082/0100 VUs, 7718 complete and 0 interrupted iterations
stress_test   [  58% ] 0082/0100 VUs  4m02.0s/7m0s  075.83 iters/s

running (4m03.0s), 0083/0100 VUs, 7793 complete and 0 interrupted iterations
stress_test   [  58% ] 0083/0100 VUs  4m03.0s/7m0s  076.25 iters/s

running (4m04.0s), 0083/0100 VUs, 7869 complete and 0 interrupted iterations
stress_test   [  58% ] 0083/0100 VUs  4m04.0s/7m0s  076.66 iters/s

running (4m05.0s), 0083/0100 VUs, 7946 complete and 0 interrupted iterations
stress_test   [  58% ] 0083/0100 VUs  4m05.0s/7m0s  077.08 iters/s

running (4m06.0s), 0084/0100 VUs, 8022 complete and 0 interrupted iterations
stress_test   [  59% ] 0084/0100 VUs  4m06.0s/7m0s  077.49 iters/s

running (4m07.0s), 0084/0100 VUs, 8100 complete and 0 interrupted iterations
stress_test   [  59% ] 0084/0100 VUs  4m07.0s/7m0s  077.91 iters/s

running (4m08.0s), 0085/0100 VUs, 8177 complete and 0 interrupted iterations
stress_test   [  59% ] 0085/0100 VUs  4m08.0s/7m0s  078.33 iters/s

running (4m09.0s), 0086/0100 VUs, 8255 complete and 0 interrupted iterations
stress_test   [  59% ] 0086/0100 VUs  4m09.0s/7m0s  078.75 iters/s

running (4m10.0s), 0086/0100 VUs, 8334 complete and 0 interrupted iterations
stress_test   [  60% ] 0086/0100 VUs  4m10.0s/7m0s  079.16 iters/s

running (4m11.0s), 0086/0100 VUs, 8413 complete and 0 interrupted iterations
stress_test   [  60% ] 0086/0100 VUs  4m11.0s/7m0s  079.58 iters/s

running (4m12.0s), 0088/0100 VUs, 8491 complete and 0 interrupted iterations
stress_test   [  60% ] 0088/0100 VUs  4m12.0s/7m0s  080.00 iters/s

running (4m13.0s), 0087/0100 VUs, 8572 complete and 0 interrupted iterations
stress_test   [  60% ] 0087/0100 VUs  4m13.0s/7m0s  080.41 iters/s

running (4m14.0s), 0088/0100 VUs, 8652 complete and 0 interrupted iterations
stress_test   [  60% ] 0088/0100 VUs  4m14.0s/7m0s  080.83 iters/s

running (4m15.0s), 0088/0100 VUs, 8733 complete and 0 interrupted iterations
stress_test   [  61% ] 0088/0100 VUs  4m15.0s/7m0s  081.25 iters/s

running (4m16.0s), 0088/0100 VUs, 8814 complete and 0 interrupted iterations
stress_test   [  61% ] 0088/0100 VUs  4m16.0s/7m0s  081.66 iters/s

running (4m17.0s), 0090/0100 VUs, 8894 complete and 0 interrupted iterations
stress_test   [  61% ] 0090/0100 VUs  4m17.0s/7m0s  082.08 iters/s

running (4m18.0s), 0089/0100 VUs, 8977 complete and 0 interrupted iterations
stress_test   [  61% ] 0089/0100 VUs  4m18.0s/7m0s  082.49 iters/s

running (4m19.0s), 0090/0100 VUs, 9059 complete and 0 interrupted iterations
stress_test   [  62% ] 0090/0100 VUs  4m19.0s/7m0s  082.91 iters/s

running (4m20.0s), 0090/0100 VUs, 9142 complete and 0 interrupted iterations
stress_test   [  62% ] 0090/0100 VUs  4m20.0s/7m0s  083.33 iters/s

running (4m21.0s), 0091/0100 VUs, 9225 complete and 0 interrupted iterations
stress_test   [  62% ] 0091/0100 VUs  4m21.0s/7m0s  083.75 iters/s

running (4m22.0s), 0092/0100 VUs, 9308 complete and 0 interrupted iterations
stress_test   [  62% ] 0092/0100 VUs  4m22.0s/7m0s  084.17 iters/s

running (4m23.0s), 0092/0100 VUs, 9392 complete and 0 interrupted iterations
stress_test   [  63% ] 0092/0100 VUs  4m23.0s/7m0s  084.58 iters/s

running (4m24.0s), 0092/0100 VUs, 9477 complete and 0 interrupted iterations
stress_test   [  63% ] 0092/0100 VUs  4m24.0s/7m0s  085.00 iters/s

running (4m25.0s), 0093/0100 VUs, 9561 complete and 0 interrupted iterations
stress_test   [  63% ] 0093/0100 VUs  4m25.0s/7m0s  085.41 iters/s

running (4m26.0s), 0093/0100 VUs, 9646 complete and 0 interrupted iterations
stress_test   [  63% ] 0093/0100 VUs  4m26.0s/7m0s  085.83 iters/s

running (4m27.0s), 0094/0100 VUs, 9732 complete and 0 interrupted iterations
stress_test   [  64% ] 0094/0100 VUs  4m27.0s/7m0s  086.25 iters/s

running (4m28.0s), 0094/0100 VUs, 9818 complete and 0 interrupted iterations
stress_test   [  64% ] 0094/0100 VUs  4m28.0s/7m0s  086.66 iters/s

running (4m29.0s), 0094/0100 VUs, 9905 complete and 0 interrupted iterations
stress_test   [  64% ] 0094/0100 VUs  4m29.0s/7m0s  087.08 iters/s

running (4m30.0s), 0094/0100 VUs, 9992 complete and 0 interrupted iterations
stress_test   [  64% ] 0094/0100 VUs  4m30.0s/7m0s  087.50 iters/s

running (4m31.0s), 0096/0100 VUs, 10078 complete and 0 interrupted iterations
stress_test   [  65% ] 0096/0100 VUs  4m31.0s/7m0s  087.91 iters/s

running (4m32.0s), 0098/0101 VUs, 10163 complete and 0 interrupted iterations
stress_test   [  65% ] 0098/0101 VUs  4m32.0s/7m0s  088.33 iters/s

running (4m33.0s), 0096/0101 VUs, 10253 complete and 0 interrupted iterations
stress_test   [  65% ] 0096/0101 VUs  4m33.0s/7m0s  088.74 iters/s

running (4m34.0s), 0096/0101 VUs, 10342 complete and 0 interrupted iterations
stress_test   [  65% ] 0096/0101 VUs  4m34.0s/7m0s  089.16 iters/s

running (4m35.0s), 0094/0104 VUs, 10431 complete and 0 interrupted iterations
stress_test   [  65% ] 0094/0104 VUs  4m35.0s/7m0s  089.58 iters/s

running (4m36.0s), 0098/0104 VUs, 10517 complete and 0 interrupted iterations
stress_test   [  66% ] 0098/0104 VUs  4m36.0s/7m0s  090.00 iters/s

running (4m37.0s), 0098/0104 VUs, 10607 complete and 0 interrupted iterations
stress_test   [  66% ] 0098/0104 VUs  4m37.0s/7m0s  090.41 iters/s

running (4m38.0s), 0099/0104 VUs, 10697 complete and 0 interrupted iterations
stress_test   [  66% ] 0099/0104 VUs  4m38.0s/7m0s  090.83 iters/s

running (4m39.0s), 0102/0104 VUs, 10785 complete and 0 interrupted iterations
stress_test   [  66% ] 0102/0104 VUs  4m39.0s/7m0s  091.25 iters/s

running (4m40.0s), 0097/0108 VUs, 10877 complete and 0 interrupted iterations
stress_test   [  67% ] 0097/0108 VUs  4m40.0s/7m0s  091.66 iters/s

running (4m41.0s), 0100/0108 VUs, 10966 complete and 0 interrupted iterations
stress_test   [  67% ] 0100/0108 VUs  4m41.0s/7m0s  092.08 iters/s

running (4m42.0s), 0100/0108 VUs, 11058 complete and 0 interrupted iterations
stress_test   [  67% ] 0100/0108 VUs  4m42.0s/7m0s  092.50 iters/s

running (4m43.0s), 0101/0108 VUs, 11150 complete and 0 interrupted iterations
stress_test   [  67% ] 0101/0108 VUs  4m43.0s/7m0s  092.91 iters/s

running (4m44.0s), 0102/0108 VUs, 11242 complete and 0 interrupted iterations
stress_test   [  68% ] 0102/0108 VUs  4m44.0s/7m0s  093.33 iters/s

running (4m45.0s), 0102/0108 VUs, 11335 complete and 0 interrupted iterations
stress_test   [  68% ] 0102/0108 VUs  4m45.0s/7m0s  093.74 iters/s

running (4m46.0s), 0105/0108 VUs, 11426 complete and 0 interrupted iterations
stress_test   [  68% ] 0105/0108 VUs  4m46.0s/7m0s  094.16 iters/s

running (4m47.0s), 0102/0110 VUs, 11522 complete and 0 interrupted iterations
stress_test   [  68% ] 0102/0110 VUs  4m47.0s/7m0s  094.58 iters/s

running (4m48.0s), 0103/0110 VUs, 11616 complete and 0 interrupted iterations
stress_test   [  69% ] 0103/0110 VUs  4m48.0s/7m0s  095.00 iters/s

running (4m49.0s), 0104/0110 VUs, 11710 complete and 0 interrupted iterations
stress_test   [  69% ] 0104/0110 VUs  4m49.0s/7m0s  095.41 iters/s

running (4m50.0s), 0106/0110 VUs, 11804 complete and 0 interrupted iterations
stress_test   [  69% ] 0106/0110 VUs  4m50.0s/7m0s  095.83 iters/s

running (4m51.0s), 0108/0113 VUs, 11894 complete and 0 interrupted iterations
stress_test   [  69% ] 0108/0113 VUs  4m51.0s/7m0s  096.24 iters/s

running (4m52.0s), 0107/0114 VUs, 11991 complete and 0 interrupted iterations
stress_test   [  70% ] 0107/0114 VUs  4m52.0s/7m0s  096.66 iters/s

running (4m53.0s), 0112/0119 VUs, 12079 complete and 0 interrupted iterations
stress_test   [  70% ] 0112/0119 VUs  4m53.0s/7m0s  097.08 iters/s

running (4m54.0s), 0109/0119 VUs, 12178 complete and 0 interrupted iterations
stress_test   [  70% ] 0109/0119 VUs  4m54.0s/7m0s  097.50 iters/s

running (4m55.0s), 0108/0119 VUs, 12277 complete and 0 interrupted iterations
stress_test   [  70% ] 0108/0119 VUs  4m55.0s/7m0s  097.91 iters/s

running (4m56.0s), 0108/0119 VUs, 12375 complete and 0 interrupted iterations
stress_test   [  70% ] 0108/0119 VUs  4m56.0s/7m0s  098.33 iters/s

running (4m57.0s), 0107/0119 VUs, 12474 complete and 0 interrupted iterations
stress_test   [  71% ] 0107/0119 VUs  4m57.0s/7m0s  098.74 iters/s

running (4m58.0s), 0108/0119 VUs, 12572 complete and 0 interrupted iterations
stress_test   [  71% ] 0108/0119 VUs  4m58.0s/7m0s  099.16 iters/s

running (4m59.0s), 0109/0119 VUs, 12671 complete and 0 interrupted iterations
stress_test   [  71% ] 0109/0119 VUs  4m59.0s/7m0s  099.58 iters/s

running (5m00.0s), 0110/0119 VUs, 12770 complete and 0 interrupted iterations
stress_test   [  71% ] 0110/0119 VUs  5m00.0s/7m0s  100.00 iters/s

running (5m01.0s), 0110/0119 VUs, 12870 complete and 0 interrupted iterations
stress_test   [  72% ] 0110/0119 VUs  5m01.0s/7m0s  100.83 iters/s

running (5m02.0s), 0111/0119 VUs, 12970 complete and 0 interrupted iterations
stress_test   [  72% ] 0111/0119 VUs  5m02.0s/7m0s  101.66 iters/s

running (5m03.0s), 0111/0119 VUs, 13072 complete and 0 interrupted iterations
stress_test   [  72% ] 0111/0119 VUs  5m03.0s/7m0s  102.49 iters/s

running (5m04.0s), 0112/0119 VUs, 13174 complete and 0 interrupted iterations
stress_test   [  72% ] 0112/0119 VUs  5m04.0s/7m0s  103.32 iters/s

running (5m05.0s), 0114/0119 VUs, 13276 complete and 0 interrupted iterations
stress_test   [  73% ] 0114/0119 VUs  5m05.0s/7m0s  104.16 iters/s

running (5m06.0s), 0114/0119 VUs, 13380 complete and 0 interrupted iterations
stress_test   [  73% ] 0114/0119 VUs  5m06.0s/7m0s  104.99 iters/s

running (5m07.0s), 0116/0119 VUs, 13484 complete and 0 interrupted iterations
stress_test   [  73% ] 0116/0119 VUs  5m07.0s/7m0s  105.83 iters/s

running (5m08.0s), 0114/0121 VUs, 13590 complete and 0 interrupted iterations
stress_test   [  73% ] 0114/0121 VUs  5m08.0s/7m0s  106.66 iters/s

running (5m09.0s), 0118/0121 VUs, 13693 complete and 0 interrupted iterations
stress_test   [  74% ] 0118/0121 VUs  5m09.0s/7m0s  107.49 iters/s

running (5m10.0s), 0118/0122 VUs, 13800 complete and 0 interrupted iterations
stress_test   [  74% ] 0118/0122 VUs  5m10.0s/7m0s  108.32 iters/s

running (5m11.0s), 0116/0125 VUs, 13908 complete and 0 interrupted iterations
stress_test   [  74% ] 0116/0125 VUs  5m11.0s/7m0s  109.16 iters/s

running (5m12.0s), 0120/0125 VUs, 14013 complete and 0 interrupted iterations
stress_test   [  74% ] 0120/0125 VUs  5m12.0s/7m0s  109.99 iters/s

running (5m13.0s), 0119/0127 VUs, 14123 complete and 0 interrupted iterations
stress_test   [  75% ] 0119/0127 VUs  5m13.0s/7m0s  110.83 iters/s

running (5m14.0s), 0122/0127 VUs, 14231 complete and 0 interrupted iterations
stress_test   [  75% ] 0122/0127 VUs  5m14.0s/7m0s  111.66 iters/s

running (5m15.0s), 0123/0127 VUs, 14342 complete and 0 interrupted iterations
stress_test   [  75% ] 0123/0127 VUs  5m15.0s/7m0s  112.49 iters/s

running (5m16.0s), 0122/0129 VUs, 14454 complete and 0 interrupted iterations
stress_test   [  75% ] 0122/0129 VUs  5m16.0s/7m0s  113.32 iters/s

running (5m17.0s), 0125/0130 VUs, 14564 complete and 0 interrupted iterations
stress_test   [  75% ] 0125/0130 VUs  5m17.0s/7m0s  114.16 iters/s

running (5m18.0s), 0128/0135 VUs, 14670 complete and 0 interrupted iterations
stress_test   [  76% ] 0127/0135 VUs  5m18.0s/7m0s  114.99 iters/s

running (5m19.0s), 0127/0135 VUs, 14787 complete and 0 interrupted iterations
stress_test   [  76% ] 0127/0135 VUs  5m19.0s/7m0s  115.83 iters/s

running (5m20.0s), 0135/0138 VUs, 14892 complete and 0 interrupted iterations
stress_test   [  76% ] 0135/0138 VUs  5m20.0s/7m0s  116.66 iters/s

running (5m21.0s), 0140/0144 VUs, 14998 complete and 0 interrupted iterations
stress_test   [  76% ] 0140/0144 VUs  5m21.0s/7m0s  117.49 iters/s

running (5m22.0s), 0137/0144 VUs, 15119 complete and 0 interrupted iterations
stress_test   [  77% ] 0137/0144 VUs  5m22.0s/7m0s  118.33 iters/s

running (5m23.0s), 0149/0149 VUs, 15221 complete and 0 interrupted iterations
stress_test   [  77% ] 0149/0149 VUs  5m23.0s/7m0s  119.16 iters/s

running (5m24.0s), 0150/0156 VUs, 15332 complete and 0 interrupted iterations
stress_test   [  77% ] 0150/0156 VUs  5m24.0s/7m0s  119.99 iters/s

running (5m25.0s), 0158/0159 VUs, 15442 complete and 0 interrupted iterations
stress_test   [  77% ] 0158/0159 VUs  5m25.0s/7m0s  120.83 iters/s

running (5m26.0s), 0164/0168 VUs, 15548 complete and 0 interrupted iterations
stress_test   [  78% ] 0164/0168 VUs  5m26.0s/7m0s  121.66 iters/s

running (5m27.0s), 0169/0169 VUs, 15664 complete and 0 interrupted iterations
stress_test   [  78% ] 0169/0169 VUs  5m27.0s/7m0s  122.49 iters/s

running (5m28.0s), 0178/0180 VUs, 15766 complete and 0 interrupted iterations
stress_test   [  78% ] 0178/0180 VUs  5m28.0s/7m0s  123.33 iters/s

running (5m29.0s), 0181/0186 VUs, 15881 complete and 0 interrupted iterations
stress_test   [  78% ] 0181/0186 VUs  5m29.0s/7m0s  124.16 iters/s

running (5m30.0s), 0185/0190 VUs, 15998 complete and 0 interrupted iterations
stress_test   [  79% ] 0185/0190 VUs  5m30.0s/7m0s  125.00 iters/s

running (5m31.0s), 0191/0199 VUs, 16108 complete and 0 interrupted iterations
stress_test   [  79% ] 0191/0199 VUs  5m31.0s/7m0s  125.83 iters/s

running (5m32.0s), 0201/0208 VUs, 16215 complete and 0 interrupted iterations
stress_test   [  79% ] 0201/0208 VUs  5m32.0s/7m0s  126.66 iters/s

running (5m33.0s), 0216/0219 VUs, 16316 complete and 0 interrupted iterations
stress_test   [  79% ] 0216/0219 VUs  5m33.0s/7m0s  127.49 iters/s

running (5m34.0s), 0219/0225 VUs, 16435 complete and 0 interrupted iterations
stress_test   [  80% ] 0219/0225 VUs  5m34.0s/7m0s  128.33 iters/s

running (5m35.0s), 0229/0233 VUs, 16546 complete and 0 interrupted iterations
stress_test   [  80% ] 0229/0233 VUs  5m35.0s/7m0s  129.16 iters/s

running (5m36.0s), 0212/0254 VUs, 16671 complete and 0 interrupted iterations
stress_test   [  80% ] 0212/0254 VUs  5m36.0s/7m0s  129.99 iters/s

running (5m37.0s), 0212/0255 VUs, 16801 complete and 0 interrupted iterations
stress_test   [  80% ] 0212/0255 VUs  5m37.0s/7m0s  130.83 iters/s

running (5m38.0s), 0237/0263 VUs, 16898 complete and 0 interrupted iterations
stress_test   [  80% ] 0237/0263 VUs  5m38.0s/7m0s  131.65 iters/s

running (5m39.0s), 0258/0278 VUs, 16995 complete and 0 interrupted iterations
stress_test   [  81% ] 0258/0278 VUs  5m39.0s/7m0s  132.49 iters/s

running (5m40.0s), 0282/0286 VUs, 17095 complete and 0 interrupted iterations
stress_test   [  81% ] 0282/0286 VUs  5m40.0s/7m0s  133.33 iters/s

running (5m41.0s), 0284/0291 VUs, 17222 complete and 0 interrupted iterations
stress_test   [  81% ] 0284/0291 VUs  5m41.0s/7m0s  134.16 iters/s

running (5m42.0s), 0299/0299 VUs, 17329 complete and 0 interrupted iterations
stress_test   [  81% ] 0299/0299 VUs  5m42.0s/7m0s  134.99 iters/s

running (5m43.0s), 0314/0318 VUs, 17428 complete and 0 interrupted iterations
stress_test   [  82% ] 0314/0318 VUs  5m43.0s/7m0s  135.83 iters/s

running (5m44.0s), 0302/0324 VUs, 17570 complete and 0 interrupted iterations
stress_test   [  82% ] 0302/0324 VUs  5m44.0s/7m0s  136.66 iters/s

running (5m45.0s), 0335/0335 VUs, 17663 complete and 0 interrupted iterations
stress_test   [  82% ] 0335/0335 VUs  5m45.0s/7m0s  137.49 iters/s

running (5m46.0s), 0338/0348 VUs, 17782 complete and 0 interrupted iterations
stress_test   [  82% ] 0338/0348 VUs  5m46.0s/7m0s  138.33 iters/s

running (5m47.0s), 0353/0367 VUs, 17881 complete and 0 interrupted iterations
stress_test   [  83% ] 0353/0367 VUs  5m47.0s/7m0s  139.16 iters/s

running (5m48.0s), 0339/0373 VUs, 18024 complete and 0 interrupted iterations
stress_test   [  83% ] 0339/0373 VUs  5m48.0s/7m0s  139.99 iters/s

running (5m49.0s), 0383/0387 VUs, 18104 complete and 0 interrupted iterations
stress_test   [  83% ] 0383/0387 VUs  5m49.0s/7m0s  140.84 iters/s

running (5m50.0s), 0394/0399 VUs, 18221 complete and 0 interrupted iterations
stress_test   [  83% ] 0394/0399 VUs  5m50.0s/7m0s  141.65 iters/s

running (5m51.0s), 0415/0419 VUs, 18316 complete and 0 interrupted iterations
stress_test   [  84% ] 0415/0419 VUs  5m51.0s/7m0s  142.49 iters/s

running (5m52.0s), 0414/0427 VUs, 18442 complete and 0 interrupted iterations
stress_test   [  84% ] 0414/0427 VUs  5m52.0s/7m0s  143.33 iters/s

running (5m53.0s), 0444/0450 VUs, 18528 complete and 0 interrupted iterations
stress_test   [  84% ] 0444/0450 VUs  5m53.0s/7m0s  144.16 iters/s

running (5m54.0s), 0446/0461 VUs, 18658 complete and 0 interrupted iterations
stress_test   [  84% ] 0446/0461 VUs  5m54.0s/7m0s  144.99 iters/s

running (5m55.0s), 0476/0476 VUs, 18761 complete and 0 interrupted iterations
stress_test   [  85% ] 0476/0476 VUs  5m55.0s/7m0s  145.86 iters/s

running (5m56.1s), 0492/0508 VUs, 18840 complete and 0 interrupted iterations
stress_test   [  85% ] 0492/0508 VUs  5m56.1s/7m0s  146.65 iters/s

running (5m57.0s), 0516/0519 VUs, 18949 complete and 0 interrupted iterations
stress_test   [  85% ] 0516/0519 VUs  5m57.0s/7m0s  147.48 iters/s

running (5m58.0s), 0518/0532 VUs, 19073 complete and 0 interrupted iterations
stress_test   [  85% ] 0518/0532 VUs  5m58.0s/7m0s  148.33 iters/s

running (5m59.2s), 0541/0548 VUs, 19175 complete and 0 interrupted iterations
stress_test   [  86% ] 0541/0548 VUs  5m59.2s/7m0s  149.16 iters/s

running (6m00.0s), 0571/0572 VUs, 19251 complete and 0 interrupted iterations
stress_test   [  86% ] 0571/0572 VUs  6m00.0s/7m0s  150.01 iters/s

running (6m01.0s), 0569/0580 VUs, 19376 complete and 0 interrupted iterations
stress_test   [  86% ] 0569/0580 VUs  6m01.0s/7m0s  150.83 iters/s

running (6m02.0s), 0586/0598 VUs, 19480 complete and 0 interrupted iterations
stress_test   [  86% ] 0586/0598 VUs  6m02.0s/7m0s  151.66 iters/s

running (6m03.0s), 0606/0611 VUs, 19598 complete and 0 interrupted iterations
stress_test   [  86% ] 0606/0611 VUs  6m03.0s/7m0s  152.49 iters/s

running (6m04.0s), 0620/0634 VUs, 19705 complete and 0 interrupted iterations
stress_test   [  87% ] 0620/0634 VUs  6m04.0s/7m0s  153.33 iters/s

running (6m05.0s), 0653/0653 VUs, 19797 complete and 0 interrupted iterations
stress_test   [  87% ] 0653/0653 VUs  6m05.0s/7m0s  154.16 iters/s

running (6m06.0s), 0674/0677 VUs, 19904 complete and 0 interrupted iterations
stress_test   [  87% ] 0674/0677 VUs  6m06.0s/7m0s  155.00 iters/s

running (6m07.0s), 0708/0711 VUs, 19985 complete and 0 interrupted iterations
stress_test   [  87% ] 0708/0711 VUs  6m07.0s/7m0s  155.82 iters/s

running (6m08.0s), 0729/0730 VUs, 20089 complete and 0 interrupted iterations
stress_test   [  88% ] 0729/0730 VUs  6m08.0s/7m0s  156.66 iters/s

running (6m09.0s), 0762/0762 VUs, 20169 complete and 0 interrupted iterations
stress_test   [  88% ] 0762/0762 VUs  6m09.0s/7m0s  157.49 iters/s

running (6m10.0s), 0697/0793 VUs, 20356 complete and 0 interrupted iterations
stress_test   [  88% ] 0697/0793 VUs  6m10.0s/7m0s  158.33 iters/s

running (6m11.1s), 0796/0802 VUs, 20402 complete and 0 interrupted iterations
stress_test   [  88% ] 0796/0802 VUs  6m11.1s/7m0s  159.28 iters/s

running (6m12.0s), 0773/0809 VUs, 20544 complete and 0 interrupted iterations
stress_test   [  89% ] 0773/0809 VUs  6m12.0s/7m0s  159.99 iters/s

running (6m13.0s), 0838/0840 VUs, 20605 complete and 0 interrupted iterations
stress_test   [  89% ] 0838/0840 VUs  6m13.0s/7m0s  160.82 iters/s

running (6m14.0s), 0830/0859 VUs, 20748 complete and 0 interrupted iterations
stress_test   [  89% ] 0830/0859 VUs  6m14.0s/7m0s  161.66 iters/s

running (6m15.0s), 0886/0890 VUs, 20798 complete and 0 interrupted iterations
stress_test   [  89% ] 0886/0890 VUs  6m15.0s/7m0s  162.52 iters/s

running (6m16.0s), 0881/0897 VUs, 20954 complete and 0 interrupted iterations
stress_test   [  90% ] 0881/0897 VUs  6m16.0s/7m0s  163.33 iters/s

running (6m17.0s), 0940/0941 VUs, 20996 complete and 0 interrupted iterations
stress_test   [  90% ] 0940/0941 VUs  6m17.0s/7m0s  164.16 iters/s

running (6m18.0s), 0933/0966 VUs, 21139 complete and 0 interrupted iterations
stress_test   [  90% ] 0933/0966 VUs  6m18.0s/7m0s  164.99 iters/s

running (6m19.0s), 1000/1000 VUs, 21179 complete and 0 interrupted iterations
stress_test   [  90% ] 1000/1000 VUs  6m19.0s/7m0s  165.85 iters/s

running (6m20.0s), 0955/1000 VUs, 21355 complete and 0 interrupted iterations
stress_test   [  90% ] 0955/1000 VUs  6m20.0s/7m0s  166.66 iters/s

running (6m21.0s), 1000/1000 VUs, 21426 complete and 0 interrupted iterations
stress_test   [  91% ] 1000/1000 VUs  6m21.0s/7m0s  167.49 iters/s

running (6m22.0s), 1000/1000 VUs, 21511 complete and 0 interrupted iterations
stress_test   [  91% ] 1000/1000 VUs  6m22.0s/7m0s  168.33 iters/s

running (6m23.0s), 0992/1000 VUs, 21662 complete and 0 interrupted iterations
stress_test   [  91% ] 0992/1000 VUs  6m23.0s/7m0s  169.16 iters/s

running (6m24.0s), 0998/1000 VUs, 21709 complete and 0 interrupted iterations
stress_test   [  91% ] 0998/1000 VUs  6m24.0s/7m0s  169.99 iters/s

running (6m25.0s), 0935/1000 VUs, 21897 complete and 0 interrupted iterations
stress_test   [  92% ] 0935/1000 VUs  6m25.0s/7m0s  170.82 iters/s

running (6m26.0s), 1000/1000 VUs, 21934 complete and 0 interrupted iterations
stress_test   [  92% ] 1000/1000 VUs  6m26.0s/7m0s  171.66 iters/s

running (6m27.0s), 0907/1000 VUs, 22176 complete and 0 interrupted iterations
stress_test   [  92% ] 0907/1000 VUs  6m27.0s/7m0s  172.49 iters/s

running (6m28.0s), 1000/1000 VUs, 22221 complete and 0 interrupted iterations
stress_test   [  92% ] 1000/1000 VUs  6m28.0s/7m0s  173.30 iters/s

running (6m29.0s), 0933/1000 VUs, 22421 complete and 0 interrupted iterations
stress_test   [  93% ] 0933/1000 VUs  6m29.0s/7m0s  174.16 iters/s

running (6m30.0s), 0999/1000 VUs, 22477 complete and 0 interrupted iterations
stress_test   [  93% ] 0999/1000 VUs  6m30.0s/7m0s  174.90 iters/s

running (6m31.0s), 0981/1000 VUs, 22539 complete and 0 interrupted iterations
stress_test   [  93% ] 0981/1000 VUs  6m31.0s/7m0s  175.87 iters/s

running (6m32.0s), 0995/1000 VUs, 22653 complete and 0 interrupted iterations
stress_test   [  93% ] 0995/1000 VUs  6m32.0s/7m0s  176.66 iters/s

running (6m33.0s), 1000/1000 VUs, 22699 complete and 0 interrupted iterations
stress_test   [  94% ] 1000/1000 VUs  6m33.0s/7m0s  177.49 iters/s

running (6m34.0s), 0930/1000 VUs, 22920 complete and 0 interrupted iterations
stress_test   [  94% ] 0930/1000 VUs  6m34.0s/7m0s  178.32 iters/s

running (6m35.0s), 0985/1000 VUs, 22980 complete and 0 interrupted iterations
stress_test   [  94% ] 0985/1000 VUs  6m35.0s/7m0s  179.16 iters/s

running (6m36.0s), 0915/1000 VUs, 23220 complete and 0 interrupted iterations
stress_test   [  94% ] 0915/1000 VUs  6m36.0s/7m0s  179.99 iters/s

running (6m37.0s), 0989/1000 VUs, 23327 complete and 0 interrupted iterations
stress_test   [  95% ] 0989/1000 VUs  6m37.0s/7m0s  180.83 iters/s

running (6m38.0s), 0958/1000 VUs, 23461 complete and 0 interrupted iterations
stress_test   [  95% ] 0958/1000 VUs  6m38.0s/7m0s  181.66 iters/s

running (6m39.0s), 1000/1000 VUs, 23511 complete and 0 interrupted iterations
stress_test   [  95% ] 1000/1000 VUs  6m39.0s/7m0s  182.50 iters/s

running (6m40.0s), 0994/1000 VUs, 23571 complete and 0 interrupted iterations
stress_test   [  95% ] 0994/1000 VUs  6m40.0s/7m0s  183.32 iters/s

running (6m41.0s), 0997/1000 VUs, 23694 complete and 0 interrupted iterations
stress_test   [  95% ] 0997/1000 VUs  6m41.0s/7m0s  184.16 iters/s

running (6m42.0s), 1000/1000 VUs, 23738 complete and 0 interrupted iterations
stress_test   [  96% ] 1000/1000 VUs  6m42.0s/7m0s  184.99 iters/s

running (6m43.0s), 0979/1000 VUs, 23933 complete and 0 interrupted iterations
stress_test   [  96% ] 0979/1000 VUs  6m43.0s/7m0s  185.82 iters/s

running (6m44.0s), 0996/1000 VUs, 24077 complete and 0 interrupted iterations
stress_test   [  96% ] 0996/1000 VUs  6m44.0s/7m0s  186.66 iters/s

running (6m45.0s), 0920/1000 VUs, 24330 complete and 0 interrupted iterations
stress_test   [  96% ] 0920/1000 VUs  6m45.0s/7m0s  187.49 iters/s

running (6m46.0s), 1000/1000 VUs, 24354 complete and 0 interrupted iterations
stress_test   [  97% ] 1000/1000 VUs  6m46.0s/7m0s  188.32 iters/s

running (6m47.0s), 0976/1000 VUs, 24497 complete and 0 interrupted iterations
stress_test   [  97% ] 0976/1000 VUs  6m47.0s/7m0s  189.16 iters/s

running (6m48.0s), 1000/1000 VUs, 24532 complete and 0 interrupted iterations
stress_test   [  97% ] 1000/1000 VUs  6m48.0s/7m0s  189.99 iters/s

running (6m49.0s), 1000/1000 VUs, 24571 complete and 0 interrupted iterations
stress_test   [  97% ] 1000/1000 VUs  6m49.0s/7m0s  190.82 iters/s

running (6m50.0s), 0962/1000 VUs, 24725 complete and 0 interrupted iterations
stress_test   [  98% ] 0962/1000 VUs  6m50.0s/7m0s  191.66 iters/s

running (6m51.0s), 0999/1000 VUs, 24763 complete and 0 interrupted iterations
stress_test   [  98% ] 0999/1000 VUs  6m51.0s/7m0s  192.49 iters/s

running (6m52.0s), 0872/1000 VUs, 25058 complete and 0 interrupted iterations
stress_test   [  98% ] 0872/1000 VUs  6m52.0s/7m0s  193.32 iters/s

running (6m53.0s), 0933/1000 VUs, 25190 complete and 0 interrupted iterations
stress_test   [  98% ] 0933/1000 VUs  6m53.0s/7m0s  194.15 iters/s

running (6m54.0s), 0912/1000 VUs, 25407 complete and 0 interrupted iterations
stress_test   [  99% ] 0912/1000 VUs  6m54.0s/7m0s  194.99 iters/s

running (6m55.0s), 1000/1000 VUs, 25453 complete and 0 interrupted iterations
stress_test   [  99% ] 1000/1000 VUs  6m55.0s/7m0s  195.83 iters/s

running (6m56.0s), 1000/1000 VUs, 25532 complete and 0 interrupted iterations
stress_test   [  99% ] 1000/1000 VUs  6m56.0s/7m0s  196.67 iters/s

running (6m57.0s), 1000/1000 VUs, 25577 complete and 0 interrupted iterations
stress_test   [  99% ] 1000/1000 VUs  6m57.0s/7m0s  197.49 iters/s

running (6m58.0s), 1000/1000 VUs, 25608 complete and 0 interrupted iterations
stress_test   [ 100% ] 1000/1000 VUs  6m58.0s/7m0s  198.32 iters/s

running (6m59.0s), 0999/1000 VUs, 25663 complete and 0 interrupted iterations
stress_test   [ 100% ] 0999/1000 VUs  6m59.0s/7m0s  199.15 iters/s

running (7m00.0s), 1000/1000 VUs, 25749 complete and 0 interrupted iterations
stress_test ↓ [ 100% ] 1000/1000 VUs  7m0s  199.99 iters/s

running (7m01.0s), 0775/1000 VUs, 25974 complete and 0 interrupted iterations
stress_test ↓ [ 100% ] 1000/1000 VUs  7m0s  199.99 iters/s

running (7m02.0s), 0212/1000 VUs, 26537 complete and 0 interrupted iterations
stress_test ↓ [ 100% ] 1000/1000 VUs  7m0s  199.99 iters/s


  █ THRESHOLDS 

    failures
    ✓ 'rate<0.01' rate=0.00%

    http_req_duration
    ✗ 'p(95)<1500' p(95)=1.83s

    http_req_failed
    ✓ 'rate<0.01' rate=0.00%


  █ TOTAL RESULTS 

    checks_total.......: 133745  316.491035/s
    checks_succeeded...: 100.00% 133745 out of 133745
    checks_failed......: 0.00%   0 out of 133745

    ✓ login page 200
    ✓ login success
    ✓ new post page 200
    ✓ post created 302
    ✓ logout success

    CUSTOM
    failures.......................: 0.00%  0 out of 0

    HTTP
    http_req_duration..............: avg=356.94ms min=116µs med=3.49ms max=4.1s   p(90)=1.31s p(95)=1.83s p(99)=2.81s
      { expected_response:true }...: avg=356.94ms min=116µs med=3.49ms max=4.1s   p(90)=1.31s p(95)=1.83s p(99)=2.81s
    http_req_failed................: 0.00%  0 out of 160494
    http_reqs......................: 160494 379.789242/s

    EXECUTION
    dropped_iterations.............: 4150   9.820463/s
    iteration_duration.............: avg=3.14s    min=1.08s med=1.1s   max=11.04s p(90)=8.46s p(95)=8.84s p(99)=9.43s
    iterations.....................: 26749  63.298207/s
    vus............................: 210    min=9           max=1000
    vus_max........................: 1000   min=100         max=1000

    NETWORK
    data_received..................: 356 MB 843 kB/s
    data_sent......................: 36 MB  84 kB/s




running (7m02.6s), 0000/1000 VUs, 26749 complete and 0 interrupted iterations
stress_test ✓ [ 100% ] 0000/1000 VUs  7m0s  199.99 iters/s
