
         /\      Grafana   /‾‾/  
    /\  /  \     |\  __   /  /   
   /  \/    \    | |/ /  /   ‾‾\ 
  /          \   |   (  |  (‾)  |
 / __________ \  |_|\_\  \_____/ 

     execution: local
        script: load-testing/k6/scenarios.js
        output: -

     scenarios: (100.00%) 2 scenarios, 100 max VUs, 6m30s max duration (incl. graceful stop):
              * read_traffic: Up to 7.00 iterations/s for 6m0s over 3 stages (maxVUs: 20-50, exec: readScenario, gracefulStop: 30s)
              * write_traffic: Up to 3.00 iterations/s for 6m0s over 3 stages (maxVUs: 20-50, exec: writeScenario, gracefulStop: 30s)


running (0m01.0s), 002/040 VUs, 0 complete and 0 interrupted iterations
read_traffic    [   0% ] 01/20 VUs  0m01.0s/6m0s  1.26 iters/s
write_traffic   [   0% ] 01/20 VUs  0m01.0s/6m0s  1.10 iters/s

running (0m02.0s), 004/040 VUs, 0 complete and 0 interrupted iterations
read_traffic    [   1% ] 02/20 VUs  0m02.0s/6m0s  1.41 iters/s
write_traffic   [   1% ] 02/20 VUs  0m02.0s/6m0s  1.15 iters/s

running (0m03.0s), 002/040 VUs, 4 complete and 0 interrupted iterations
read_traffic    [   1% ] 01/20 VUs  0m03.0s/6m0s  1.55 iters/s
write_traffic   [   1% ] 01/20 VUs  0m03.0s/6m0s  1.21 iters/s

running (0m04.0s), 003/040 VUs, 6 complete and 0 interrupted iterations
read_traffic    [   1% ] 02/20 VUs  0m04.0s/6m0s  1.79 iters/s
write_traffic   [   1% ] 01/20 VUs  0m04.0s/6m0s  1.26 iters/s

running (0m05.0s), 003/040 VUs, 9 complete and 0 interrupted iterations
read_traffic    [   1% ] 02/20 VUs  0m05.0s/6m0s  2.00 iters/s
write_traffic   [   1% ] 01/20 VUs  0m05.0s/6m0s  1.32 iters/s

running (0m06.0s), 004/040 VUs, 12 complete and 0 interrupted iterations
read_traffic    [   2% ] 02/20 VUs  0m06.0s/6m0s  2.19 iters/s
write_traffic   [   2% ] 02/20 VUs  0m06.0s/6m0s  1.41 iters/s

running (0m07.0s), 003/040 VUs, 16 complete and 0 interrupted iterations
read_traffic    [   2% ] 02/20 VUs  0m07.0s/6m0s  2.37 iters/s
write_traffic   [   2% ] 01/20 VUs  0m07.0s/6m0s  1.46 iters/s

running (0m08.0s), 005/040 VUs, 19 complete and 0 interrupted iterations
read_traffic    [   2% ] 03/20 VUs  0m08.0s/6m0s  2.61 iters/s
write_traffic   [   2% ] 02/20 VUs  0m08.0s/6m0s  1.55 iters/s

running (0m09.0s), 005/040 VUs, 23 complete and 0 interrupted iterations
read_traffic    [   2% ] 03/20 VUs  0m09.0s/6m0s  2.83 iters/s
write_traffic   [   2% ] 02/20 VUs  0m09.0s/6m0s  1.59 iters/s

running (0m10.0s), 005/040 VUs, 27 complete and 0 interrupted iterations
read_traffic    [   3% ] 03/20 VUs  0m10.0s/6m0s  2.97 iters/s
write_traffic   [   3% ] 02/20 VUs  0m10.0s/6m0s  1.67 iters/s

running (0m11.0s), 006/040 VUs, 32 complete and 0 interrupted iterations
read_traffic    [   3% ] 04/20 VUs  0m11.0s/6m0s  3.22 iters/s
write_traffic   [   3% ] 02/20 VUs  0m11.0s/6m0s  1.75 iters/s

running (0m12.0s), 006/040 VUs, 36 complete and 0 interrupted iterations
read_traffic    [   3% ] 04/20 VUs  0m12.0s/6m0s  3.41 iters/s
write_traffic   [   3% ] 02/20 VUs  0m12.0s/6m0s  1.79 iters/s

running (0m13.0s), 006/040 VUs, 41 complete and 0 interrupted iterations
read_traffic    [   4% ] 04/20 VUs  0m13.0s/6m0s  3.58 iters/s
write_traffic   [   4% ] 02/20 VUs  0m13.0s/6m0s  1.86 iters/s

running (0m14.0s), 006/040 VUs, 47 complete and 0 interrupted iterations
read_traffic    [   4% ] 04/20 VUs  0m14.0s/6m0s  3.79 iters/s
write_traffic   [   4% ] 02/20 VUs  0m14.0s/6m0s  1.93 iters/s

running (0m15.0s), 006/040 VUs, 53 complete and 0 interrupted iterations
read_traffic    [   4% ] 04/20 VUs  0m15.0s/6m0s  4.00 iters/s
write_traffic   [   4% ] 02/20 VUs  0m15.0s/6m0s  2.00 iters/s

running (0m16.0s), 006/040 VUs, 59 complete and 0 interrupted iterations
read_traffic    [   4% ] 04/20 VUs  0m16.0s/6m0s  4.20 iters/s
write_traffic   [   4% ] 02/20 VUs  0m16.0s/6m0s  2.07 iters/s

running (0m17.0s), 006/040 VUs, 65 complete and 0 interrupted iterations
read_traffic    [   5% ] 04/20 VUs  0m17.0s/6m0s  4.38 iters/s
write_traffic   [   5% ] 02/20 VUs  0m17.0s/6m0s  2.13 iters/s

running (0m18.0s), 007/040 VUs, 71 complete and 0 interrupted iterations
read_traffic    [   5% ] 05/20 VUs  0m18.0s/6m0s  4.60 iters/s
write_traffic   [   5% ] 02/20 VUs  0m18.0s/6m0s  2.19 iters/s

running (0m19.0s), 009/040 VUs, 77 complete and 0 interrupted iterations
read_traffic    [   5% ] 06/20 VUs  0m19.0s/6m0s  4.82 iters/s
write_traffic   [   5% ] 03/20 VUs  0m19.0s/6m0s  2.28 iters/s

running (0m20.0s), 008/040 VUs, 84 complete and 0 interrupted iterations
read_traffic    [   6% ] 05/20 VUs  0m20.0s/6m0s  4.98 iters/s
write_traffic   [   6% ] 03/20 VUs  0m20.0s/6m0s  2.34 iters/s

running (0m21.0s), 008/040 VUs, 92 complete and 0 interrupted iterations
read_traffic    [   6% ] 06/20 VUs  0m21.0s/6m0s  5.22 iters/s
write_traffic   [   6% ] 02/20 VUs  0m21.0s/6m0s  2.39 iters/s

running (0m22.0s), 009/040 VUs, 99 complete and 0 interrupted iterations
read_traffic    [   6% ] 06/20 VUs  0m22.0s/6m0s  5.40 iters/s
write_traffic   [   6% ] 03/20 VUs  0m22.0s/6m0s  2.48 iters/s

running (0m23.0s), 009/040 VUs, 106 complete and 0 interrupted iterations
read_traffic    [   6% ] 06/20 VUs  0m23.0s/6m0s  5.59 iters/s
write_traffic   [   6% ] 03/20 VUs  0m23.0s/6m0s  2.53 iters/s

running (0m24.0s), 009/040 VUs, 115 complete and 0 interrupted iterations
read_traffic    [   7% ] 06/20 VUs  0m24.0s/6m0s  5.80 iters/s
write_traffic   [   7% ] 03/20 VUs  0m24.0s/6m0s  2.61 iters/s

running (0m25.0s), 010/040 VUs, 122 complete and 0 interrupted iterations
read_traffic    [   7% ] 07/20 VUs  0m25.0s/6m0s  6.00 iters/s
write_traffic   [   7% ] 03/20 VUs  0m25.0s/6m0s  2.66 iters/s

running (0m26.0s), 010/040 VUs, 131 complete and 0 interrupted iterations
read_traffic    [   7% ] 07/20 VUs  0m26.0s/6m0s  6.20 iters/s
write_traffic   [   7% ] 03/20 VUs  0m26.0s/6m0s  2.73 iters/s

running (0m27.0s), 010/040 VUs, 140 complete and 0 interrupted iterations
read_traffic    [   7% ] 07/20 VUs  0m27.0s/6m0s  6.39 iters/s
write_traffic   [   7% ] 03/20 VUs  0m27.0s/6m0s  2.80 iters/s

running (0m28.0s), 011/040 VUs, 149 complete and 0 interrupted iterations
read_traffic    [   8% ] 07/20 VUs  0m28.0s/6m0s  6.60 iters/s
write_traffic   [   8% ] 04/20 VUs  0m28.0s/6m0s  2.88 iters/s

running (0m29.0s), 012/040 VUs, 158 complete and 0 interrupted iterations
read_traffic    [   8% ] 08/20 VUs  0m29.0s/6m0s  6.81 iters/s
write_traffic   [   8% ] 04/20 VUs  0m29.0s/6m0s  2.94 iters/s

running (0m30.0s), 010/040 VUs, 168 complete and 0 interrupted iterations
read_traffic    [   8% ] 07/20 VUs  0m30.0s/6m0s  6.99 iters/s
write_traffic   [   8% ] 03/20 VUs  0m30.0s/6m0s  2.99 iters/s

running (0m31.0s), 010/040 VUs, 178 complete and 0 interrupted iterations
read_traffic    [   9% ] 07/20 VUs  0m31.0s/6m0s  7.00 iters/s
write_traffic   [   9% ] 03/20 VUs  0m31.0s/6m0s  3.00 iters/s

running (0m32.0s), 010/040 VUs, 188 complete and 0 interrupted iterations
read_traffic    [   9% ] 07/20 VUs  0m32.0s/6m0s  7.00 iters/s
write_traffic   [   9% ] 03/20 VUs  0m32.0s/6m0s  3.00 iters/s

running (0m33.0s), 010/040 VUs, 198 complete and 0 interrupted iterations
read_traffic    [   9% ] 07/20 VUs  0m33.0s/6m0s  7.00 iters/s
write_traffic   [   9% ] 03/20 VUs  0m33.0s/6m0s  3.00 iters/s

running (0m34.0s), 010/040 VUs, 208 complete and 0 interrupted iterations
read_traffic    [   9% ] 07/20 VUs  0m34.0s/6m0s  7.00 iters/s
write_traffic   [   9% ] 03/20 VUs  0m34.0s/6m0s  3.00 iters/s

running (0m35.0s), 010/040 VUs, 218 complete and 0 interrupted iterations
read_traffic    [  10% ] 07/20 VUs  0m35.0s/6m0s  7.00 iters/s
write_traffic   [  10% ] 03/20 VUs  0m35.0s/6m0s  3.00 iters/s

running (0m36.0s), 010/040 VUs, 228 complete and 0 interrupted iterations
read_traffic    [  10% ] 07/20 VUs  0m36.0s/6m0s  7.00 iters/s
write_traffic   [  10% ] 03/20 VUs  0m36.0s/6m0s  3.00 iters/s

running (0m37.0s), 010/040 VUs, 238 complete and 0 interrupted iterations
read_traffic    [  10% ] 07/20 VUs  0m37.0s/6m0s  7.00 iters/s
write_traffic   [  10% ] 03/20 VUs  0m37.0s/6m0s  3.00 iters/s

running (0m38.0s), 010/040 VUs, 248 complete and 0 interrupted iterations
read_traffic    [  11% ] 07/20 VUs  0m38.0s/6m0s  7.00 iters/s
write_traffic   [  11% ] 03/20 VUs  0m38.0s/6m0s  3.00 iters/s

running (0m39.0s), 010/040 VUs, 258 complete and 0 interrupted iterations
read_traffic    [  11% ] 07/20 VUs  0m39.0s/6m0s  7.00 iters/s
write_traffic   [  11% ] 03/20 VUs  0m39.0s/6m0s  3.00 iters/s

running (0m40.0s), 010/040 VUs, 268 complete and 0 interrupted iterations
read_traffic    [  11% ] 07/20 VUs  0m40.0s/6m0s  7.00 iters/s
write_traffic   [  11% ] 03/20 VUs  0m40.0s/6m0s  3.00 iters/s

running (0m41.0s), 010/040 VUs, 278 complete and 0 interrupted iterations
read_traffic    [  11% ] 07/20 VUs  0m41.0s/6m0s  7.00 iters/s
write_traffic   [  11% ] 03/20 VUs  0m41.0s/6m0s  3.00 iters/s

running (0m42.0s), 010/040 VUs, 288 complete and 0 interrupted iterations
read_traffic    [  12% ] 07/20 VUs  0m42.0s/6m0s  7.00 iters/s
write_traffic   [  12% ] 03/20 VUs  0m42.0s/6m0s  3.00 iters/s

running (0m43.0s), 010/040 VUs, 298 complete and 0 interrupted iterations
read_traffic    [  12% ] 07/20 VUs  0m43.0s/6m0s  7.00 iters/s
write_traffic   [  12% ] 03/20 VUs  0m43.0s/6m0s  3.00 iters/s

running (0m44.0s), 010/040 VUs, 308 complete and 0 interrupted iterations
read_traffic    [  12% ] 07/20 VUs  0m44.0s/6m0s  7.00 iters/s
write_traffic   [  12% ] 03/20 VUs  0m44.0s/6m0s  3.00 iters/s

running (0m45.0s), 010/040 VUs, 318 complete and 0 interrupted iterations
read_traffic    [  12% ] 07/20 VUs  0m45.0s/6m0s  7.00 iters/s
write_traffic   [  12% ] 03/20 VUs  0m45.0s/6m0s  3.00 iters/s

running (0m46.0s), 010/040 VUs, 328 complete and 0 interrupted iterations
read_traffic    [  13% ] 07/20 VUs  0m46.0s/6m0s  7.00 iters/s
write_traffic   [  13% ] 03/20 VUs  0m46.0s/6m0s  3.00 iters/s

running (0m47.0s), 010/040 VUs, 338 complete and 0 interrupted iterations
read_traffic    [  13% ] 07/20 VUs  0m47.0s/6m0s  7.00 iters/s
write_traffic   [  13% ] 03/20 VUs  0m47.0s/6m0s  3.00 iters/s

running (0m48.0s), 010/040 VUs, 348 complete and 0 interrupted iterations
read_traffic    [  13% ] 07/20 VUs  0m48.0s/6m0s  7.00 iters/s
write_traffic   [  13% ] 03/20 VUs  0m48.0s/6m0s  3.00 iters/s

running (0m49.0s), 010/040 VUs, 358 complete and 0 interrupted iterations
read_traffic    [  14% ] 07/20 VUs  0m49.0s/6m0s  7.00 iters/s
write_traffic   [  14% ] 03/20 VUs  0m49.0s/6m0s  3.00 iters/s

running (0m50.0s), 010/040 VUs, 368 complete and 0 interrupted iterations
read_traffic    [  14% ] 07/20 VUs  0m50.0s/6m0s  7.00 iters/s
write_traffic   [  14% ] 03/20 VUs  0m50.0s/6m0s  3.00 iters/s

running (0m51.0s), 010/040 VUs, 378 complete and 0 interrupted iterations
read_traffic    [  14% ] 07/20 VUs  0m51.0s/6m0s  7.00 iters/s
write_traffic   [  14% ] 03/20 VUs  0m51.0s/6m0s  3.00 iters/s

running (0m52.0s), 010/040 VUs, 388 complete and 0 interrupted iterations
read_traffic    [  14% ] 07/20 VUs  0m52.0s/6m0s  7.00 iters/s
write_traffic   [  14% ] 03/20 VUs  0m52.0s/6m0s  3.00 iters/s

running (0m53.0s), 010/040 VUs, 398 complete and 0 interrupted iterations
read_traffic    [  15% ] 07/20 VUs  0m53.0s/6m0s  7.00 iters/s
write_traffic   [  15% ] 03/20 VUs  0m53.0s/6m0s  3.00 iters/s

running (0m54.0s), 010/040 VUs, 408 complete and 0 interrupted iterations
read_traffic    [  15% ] 07/20 VUs  0m54.0s/6m0s  7.00 iters/s
write_traffic   [  15% ] 03/20 VUs  0m54.0s/6m0s  3.00 iters/s

running (0m55.0s), 010/040 VUs, 418 complete and 0 interrupted iterations
read_traffic    [  15% ] 07/20 VUs  0m55.0s/6m0s  7.00 iters/s
write_traffic   [  15% ] 03/20 VUs  0m55.0s/6m0s  3.00 iters/s

running (0m56.0s), 010/040 VUs, 428 complete and 0 interrupted iterations
read_traffic    [  16% ] 07/20 VUs  0m56.0s/6m0s  7.00 iters/s
write_traffic   [  16% ] 03/20 VUs  0m56.0s/6m0s  3.00 iters/s

running (0m57.0s), 010/040 VUs, 438 complete and 0 interrupted iterations
read_traffic    [  16% ] 07/20 VUs  0m57.0s/6m0s  7.00 iters/s
write_traffic   [  16% ] 03/20 VUs  0m57.0s/6m0s  3.00 iters/s

running (0m58.0s), 010/040 VUs, 448 complete and 0 interrupted iterations
read_traffic    [  16% ] 07/20 VUs  0m58.0s/6m0s  7.00 iters/s
write_traffic   [  16% ] 03/20 VUs  0m58.0s/6m0s  3.00 iters/s

running (0m59.0s), 010/040 VUs, 458 complete and 0 interrupted iterations
read_traffic    [  16% ] 07/20 VUs  0m59.0s/6m0s  7.00 iters/s
write_traffic   [  16% ] 03/20 VUs  0m59.0s/6m0s  3.00 iters/s

running (1m00.0s), 010/040 VUs, 468 complete and 0 interrupted iterations
read_traffic    [  17% ] 07/20 VUs  1m00.0s/6m0s  7.00 iters/s
write_traffic   [  17% ] 03/20 VUs  1m00.0s/6m0s  3.00 iters/s

running (1m01.0s), 010/040 VUs, 478 complete and 0 interrupted iterations
read_traffic    [  17% ] 07/20 VUs  1m01.0s/6m0s  7.00 iters/s
write_traffic   [  17% ] 03/20 VUs  1m01.0s/6m0s  3.00 iters/s

running (1m02.0s), 010/040 VUs, 488 complete and 0 interrupted iterations
read_traffic    [  17% ] 07/20 VUs  1m02.0s/6m0s  7.00 iters/s
write_traffic   [  17% ] 03/20 VUs  1m02.0s/6m0s  3.00 iters/s

running (1m03.0s), 010/040 VUs, 498 complete and 0 interrupted iterations
read_traffic    [  17% ] 07/20 VUs  1m03.0s/6m0s  7.00 iters/s
write_traffic   [  17% ] 03/20 VUs  1m03.0s/6m0s  3.00 iters/s

running (1m04.0s), 010/040 VUs, 508 complete and 0 interrupted iterations
read_traffic    [  18% ] 07/20 VUs  1m04.0s/6m0s  7.00 iters/s
write_traffic   [  18% ] 03/20 VUs  1m04.0s/6m0s  3.00 iters/s

running (1m05.0s), 010/040 VUs, 518 complete and 0 interrupted iterations
read_traffic    [  18% ] 07/20 VUs  1m05.0s/6m0s  7.00 iters/s
write_traffic   [  18% ] 03/20 VUs  1m05.0s/6m0s  3.00 iters/s

running (1m06.0s), 010/040 VUs, 528 complete and 0 interrupted iterations
read_traffic    [  18% ] 07/20 VUs  1m06.0s/6m0s  7.00 iters/s
write_traffic   [  18% ] 03/20 VUs  1m06.0s/6m0s  3.00 iters/s

running (1m07.0s), 010/040 VUs, 538 complete and 0 interrupted iterations
read_traffic    [  19% ] 07/20 VUs  1m07.0s/6m0s  7.00 iters/s
write_traffic   [  19% ] 03/20 VUs  1m07.0s/6m0s  3.00 iters/s

running (1m08.0s), 010/040 VUs, 548 complete and 0 interrupted iterations
read_traffic    [  19% ] 07/20 VUs  1m08.0s/6m0s  7.00 iters/s
write_traffic   [  19% ] 03/20 VUs  1m08.0s/6m0s  3.00 iters/s

running (1m09.0s), 010/040 VUs, 558 complete and 0 interrupted iterations
read_traffic    [  19% ] 07/20 VUs  1m09.0s/6m0s  7.00 iters/s
write_traffic   [  19% ] 03/20 VUs  1m09.0s/6m0s  3.00 iters/s

running (1m10.0s), 010/040 VUs, 568 complete and 0 interrupted iterations
read_traffic    [  19% ] 07/20 VUs  1m10.0s/6m0s  7.00 iters/s
write_traffic   [  19% ] 03/20 VUs  1m10.0s/6m0s  3.00 iters/s

running (1m11.0s), 010/040 VUs, 578 complete and 0 interrupted iterations
read_traffic    [  20% ] 07/20 VUs  1m11.0s/6m0s  7.00 iters/s
write_traffic   [  20% ] 03/20 VUs  1m11.0s/6m0s  3.00 iters/s

running (1m12.0s), 010/040 VUs, 588 complete and 0 interrupted iterations
read_traffic    [  20% ] 07/20 VUs  1m12.0s/6m0s  7.00 iters/s
write_traffic   [  20% ] 03/20 VUs  1m12.0s/6m0s  3.00 iters/s

running (1m13.0s), 010/040 VUs, 598 complete and 0 interrupted iterations
read_traffic    [  20% ] 07/20 VUs  1m13.0s/6m0s  7.00 iters/s
write_traffic   [  20% ] 03/20 VUs  1m13.0s/6m0s  3.00 iters/s

running (1m14.0s), 010/040 VUs, 608 complete and 0 interrupted iterations
read_traffic    [  21% ] 07/20 VUs  1m14.0s/6m0s  7.00 iters/s
write_traffic   [  21% ] 03/20 VUs  1m14.0s/6m0s  3.00 iters/s

running (1m15.0s), 010/040 VUs, 618 complete and 0 interrupted iterations
read_traffic    [  21% ] 07/20 VUs  1m15.0s/6m0s  7.00 iters/s
write_traffic   [  21% ] 03/20 VUs  1m15.0s/6m0s  3.00 iters/s

running (1m16.0s), 010/040 VUs, 628 complete and 0 interrupted iterations
read_traffic    [  21% ] 07/20 VUs  1m16.0s/6m0s  7.00 iters/s
write_traffic   [  21% ] 03/20 VUs  1m16.0s/6m0s  3.00 iters/s

running (1m17.0s), 010/040 VUs, 638 complete and 0 interrupted iterations
read_traffic    [  21% ] 07/20 VUs  1m17.0s/6m0s  7.00 iters/s
write_traffic   [  21% ] 03/20 VUs  1m17.0s/6m0s  3.00 iters/s

running (1m18.0s), 010/040 VUs, 648 complete and 0 interrupted iterations
read_traffic    [  22% ] 07/20 VUs  1m18.0s/6m0s  7.00 iters/s
write_traffic   [  22% ] 03/20 VUs  1m18.0s/6m0s  3.00 iters/s

running (1m19.0s), 010/040 VUs, 658 complete and 0 interrupted iterations
read_traffic    [  22% ] 07/20 VUs  1m19.0s/6m0s  7.00 iters/s
write_traffic   [  22% ] 03/20 VUs  1m19.0s/6m0s  3.00 iters/s

running (1m20.0s), 010/040 VUs, 668 complete and 0 interrupted iterations
read_traffic    [  22% ] 07/20 VUs  1m20.0s/6m0s  7.00 iters/s
write_traffic   [  22% ] 03/20 VUs  1m20.0s/6m0s  3.00 iters/s

running (1m21.0s), 010/040 VUs, 678 complete and 0 interrupted iterations
read_traffic    [  22% ] 07/20 VUs  1m21.0s/6m0s  7.00 iters/s
write_traffic   [  22% ] 03/20 VUs  1m21.0s/6m0s  3.00 iters/s

running (1m22.0s), 010/040 VUs, 688 complete and 0 interrupted iterations
read_traffic    [  23% ] 07/20 VUs  1m22.0s/6m0s  7.00 iters/s
write_traffic   [  23% ] 03/20 VUs  1m22.0s/6m0s  3.00 iters/s

running (1m23.0s), 010/040 VUs, 698 complete and 0 interrupted iterations
read_traffic    [  23% ] 07/20 VUs  1m23.0s/6m0s  7.00 iters/s
write_traffic   [  23% ] 03/20 VUs  1m23.0s/6m0s  3.00 iters/s

running (1m24.0s), 010/040 VUs, 708 complete and 0 interrupted iterations
read_traffic    [  23% ] 07/20 VUs  1m24.0s/6m0s  7.00 iters/s
write_traffic   [  23% ] 03/20 VUs  1m24.0s/6m0s  3.00 iters/s

running (1m25.0s), 010/040 VUs, 718 complete and 0 interrupted iterations
read_traffic    [  24% ] 07/20 VUs  1m25.0s/6m0s  7.00 iters/s
write_traffic   [  24% ] 03/20 VUs  1m25.0s/6m0s  3.00 iters/s

running (1m26.0s), 010/040 VUs, 728 complete and 0 interrupted iterations
read_traffic    [  24% ] 07/20 VUs  1m26.0s/6m0s  7.00 iters/s
write_traffic   [  24% ] 03/20 VUs  1m26.0s/6m0s  3.00 iters/s

running (1m27.0s), 010/040 VUs, 738 complete and 0 interrupted iterations
read_traffic    [  24% ] 07/20 VUs  1m27.0s/6m0s  7.00 iters/s
write_traffic   [  24% ] 03/20 VUs  1m27.0s/6m0s  3.00 iters/s

running (1m28.0s), 010/040 VUs, 748 complete and 0 interrupted iterations
read_traffic    [  24% ] 07/20 VUs  1m28.0s/6m0s  7.00 iters/s
write_traffic   [  24% ] 03/20 VUs  1m28.0s/6m0s  3.00 iters/s

running (1m29.0s), 010/040 VUs, 758 complete and 0 interrupted iterations
read_traffic    [  25% ] 07/20 VUs  1m29.0s/6m0s  7.00 iters/s
write_traffic   [  25% ] 03/20 VUs  1m29.0s/6m0s  3.00 iters/s

running (1m30.0s), 010/040 VUs, 768 complete and 0 interrupted iterations
read_traffic    [  25% ] 07/20 VUs  1m30.0s/6m0s  7.00 iters/s
write_traffic   [  25% ] 03/20 VUs  1m30.0s/6m0s  3.00 iters/s

running (1m31.0s), 010/040 VUs, 778 complete and 0 interrupted iterations
read_traffic    [  25% ] 07/20 VUs  1m31.0s/6m0s  7.00 iters/s
write_traffic   [  25% ] 03/20 VUs  1m31.0s/6m0s  3.00 iters/s

running (1m32.0s), 010/040 VUs, 788 complete and 0 interrupted iterations
read_traffic    [  26% ] 07/20 VUs  1m32.0s/6m0s  7.00 iters/s
write_traffic   [  26% ] 03/20 VUs  1m32.0s/6m0s  3.00 iters/s

running (1m33.0s), 010/040 VUs, 798 complete and 0 interrupted iterations
read_traffic    [  26% ] 07/20 VUs  1m33.0s/6m0s  7.00 iters/s
write_traffic   [  26% ] 03/20 VUs  1m33.0s/6m0s  3.00 iters/s

running (1m34.0s), 010/040 VUs, 808 complete and 0 interrupted iterations
read_traffic    [  26% ] 07/20 VUs  1m34.0s/6m0s  7.00 iters/s
write_traffic   [  26% ] 03/20 VUs  1m34.0s/6m0s  3.00 iters/s

running (1m35.0s), 010/040 VUs, 818 complete and 0 interrupted iterations
read_traffic    [  26% ] 07/20 VUs  1m35.0s/6m0s  7.00 iters/s
write_traffic   [  26% ] 03/20 VUs  1m35.0s/6m0s  3.00 iters/s

running (1m36.0s), 010/040 VUs, 828 complete and 0 interrupted iterations
read_traffic    [  27% ] 07/20 VUs  1m36.0s/6m0s  7.00 iters/s
write_traffic   [  27% ] 03/20 VUs  1m36.0s/6m0s  3.00 iters/s

running (1m37.0s), 010/040 VUs, 838 complete and 0 interrupted iterations
read_traffic    [  27% ] 07/20 VUs  1m37.0s/6m0s  7.00 iters/s
write_traffic   [  27% ] 03/20 VUs  1m37.0s/6m0s  3.00 iters/s

running (1m38.0s), 010/040 VUs, 848 complete and 0 interrupted iterations
read_traffic    [  27% ] 07/20 VUs  1m38.0s/6m0s  7.00 iters/s
write_traffic   [  27% ] 03/20 VUs  1m38.0s/6m0s  3.00 iters/s

running (1m39.0s), 010/040 VUs, 858 complete and 0 interrupted iterations
read_traffic    [  27% ] 07/20 VUs  1m39.0s/6m0s  7.00 iters/s
write_traffic   [  27% ] 03/20 VUs  1m39.0s/6m0s  3.00 iters/s

running (1m40.0s), 010/040 VUs, 868 complete and 0 interrupted iterations
read_traffic    [  28% ] 07/20 VUs  1m40.0s/6m0s  7.00 iters/s
write_traffic   [  28% ] 03/20 VUs  1m40.0s/6m0s  3.00 iters/s

running (1m41.0s), 010/040 VUs, 878 complete and 0 interrupted iterations
read_traffic    [  28% ] 07/20 VUs  1m41.0s/6m0s  7.00 iters/s
write_traffic   [  28% ] 03/20 VUs  1m41.0s/6m0s  3.00 iters/s

running (1m42.0s), 010/040 VUs, 888 complete and 0 interrupted iterations
read_traffic    [  28% ] 07/20 VUs  1m42.0s/6m0s  7.00 iters/s
write_traffic   [  28% ] 03/20 VUs  1m42.0s/6m0s  3.00 iters/s

running (1m43.0s), 010/040 VUs, 898 complete and 0 interrupted iterations
read_traffic    [  29% ] 07/20 VUs  1m43.0s/6m0s  7.00 iters/s
write_traffic   [  29% ] 03/20 VUs  1m43.0s/6m0s  3.00 iters/s

running (1m44.0s), 010/040 VUs, 908 complete and 0 interrupted iterations
read_traffic    [  29% ] 07/20 VUs  1m44.0s/6m0s  7.00 iters/s
write_traffic   [  29% ] 03/20 VUs  1m44.0s/6m0s  3.00 iters/s

running (1m45.0s), 010/040 VUs, 918 complete and 0 interrupted iterations
read_traffic    [  29% ] 07/20 VUs  1m45.0s/6m0s  7.00 iters/s
write_traffic   [  29% ] 03/20 VUs  1m45.0s/6m0s  3.00 iters/s

running (1m46.0s), 010/040 VUs, 928 complete and 0 interrupted iterations
read_traffic    [  29% ] 07/20 VUs  1m46.0s/6m0s  7.00 iters/s
write_traffic   [  29% ] 03/20 VUs  1m46.0s/6m0s  3.00 iters/s

running (1m47.0s), 010/040 VUs, 938 complete and 0 interrupted iterations
read_traffic    [  30% ] 07/20 VUs  1m47.0s/6m0s  7.00 iters/s
write_traffic   [  30% ] 03/20 VUs  1m47.0s/6m0s  3.00 iters/s

running (1m48.0s), 010/040 VUs, 948 complete and 0 interrupted iterations
read_traffic    [  30% ] 07/20 VUs  1m48.0s/6m0s  7.00 iters/s
write_traffic   [  30% ] 03/20 VUs  1m48.0s/6m0s  3.00 iters/s

running (1m49.0s), 010/040 VUs, 958 complete and 0 interrupted iterations
read_traffic    [  30% ] 07/20 VUs  1m49.0s/6m0s  7.00 iters/s
write_traffic   [  30% ] 03/20 VUs  1m49.0s/6m0s  3.00 iters/s

running (1m50.0s), 010/040 VUs, 968 complete and 0 interrupted iterations
read_traffic    [  31% ] 07/20 VUs  1m50.0s/6m0s  7.00 iters/s
write_traffic   [  31% ] 03/20 VUs  1m50.0s/6m0s  3.00 iters/s

running (1m51.0s), 010/040 VUs, 978 complete and 0 interrupted iterations
read_traffic    [  31% ] 07/20 VUs  1m51.0s/6m0s  7.00 iters/s
write_traffic   [  31% ] 03/20 VUs  1m51.0s/6m0s  3.00 iters/s

running (1m52.0s), 010/040 VUs, 988 complete and 0 interrupted iterations
read_traffic    [  31% ] 07/20 VUs  1m52.0s/6m0s  7.00 iters/s
write_traffic   [  31% ] 03/20 VUs  1m52.0s/6m0s  3.00 iters/s

running (1m53.0s), 010/040 VUs, 998 complete and 0 interrupted iterations
read_traffic    [  31% ] 07/20 VUs  1m53.0s/6m0s  7.00 iters/s
write_traffic   [  31% ] 03/20 VUs  1m53.0s/6m0s  3.00 iters/s

running (1m54.0s), 010/040 VUs, 1008 complete and 0 interrupted iterations
read_traffic    [  32% ] 07/20 VUs  1m54.0s/6m0s  7.00 iters/s
write_traffic   [  32% ] 03/20 VUs  1m54.0s/6m0s  3.00 iters/s

running (1m55.0s), 010/040 VUs, 1018 complete and 0 interrupted iterations
read_traffic    [  32% ] 07/20 VUs  1m55.0s/6m0s  7.00 iters/s
write_traffic   [  32% ] 03/20 VUs  1m55.0s/6m0s  3.00 iters/s

running (1m56.0s), 010/040 VUs, 1028 complete and 0 interrupted iterations
read_traffic    [  32% ] 07/20 VUs  1m56.0s/6m0s  7.00 iters/s
write_traffic   [  32% ] 03/20 VUs  1m56.0s/6m0s  3.00 iters/s

running (1m57.0s), 010/040 VUs, 1038 complete and 0 interrupted iterations
read_traffic    [  32% ] 07/20 VUs  1m57.0s/6m0s  7.00 iters/s
write_traffic   [  32% ] 03/20 VUs  1m57.0s/6m0s  3.00 iters/s

running (1m58.0s), 010/040 VUs, 1048 complete and 0 interrupted iterations
read_traffic    [  33% ] 07/20 VUs  1m58.0s/6m0s  7.00 iters/s
write_traffic   [  33% ] 03/20 VUs  1m58.0s/6m0s  3.00 iters/s

running (1m59.0s), 010/040 VUs, 1058 complete and 0 interrupted iterations
read_traffic    [  33% ] 07/20 VUs  1m59.0s/6m0s  7.00 iters/s
write_traffic   [  33% ] 03/20 VUs  1m59.0s/6m0s  3.00 iters/s

running (2m00.0s), 010/040 VUs, 1068 complete and 0 interrupted iterations
read_traffic    [  33% ] 07/20 VUs  2m00.0s/6m0s  7.00 iters/s
write_traffic   [  33% ] 03/20 VUs  2m00.0s/6m0s  3.00 iters/s

running (2m01.0s), 010/040 VUs, 1078 complete and 0 interrupted iterations
read_traffic    [  34% ] 07/20 VUs  2m01.0s/6m0s  7.00 iters/s
write_traffic   [  34% ] 03/20 VUs  2m01.0s/6m0s  3.00 iters/s

running (2m02.0s), 010/040 VUs, 1088 complete and 0 interrupted iterations
read_traffic    [  34% ] 07/20 VUs  2m02.0s/6m0s  7.00 iters/s
write_traffic   [  34% ] 03/20 VUs  2m02.0s/6m0s  3.00 iters/s

running (2m03.0s), 010/040 VUs, 1098 complete and 0 interrupted iterations
read_traffic    [  34% ] 07/20 VUs  2m03.0s/6m0s  7.00 iters/s
write_traffic   [  34% ] 03/20 VUs  2m03.0s/6m0s  3.00 iters/s

running (2m04.0s), 010/040 VUs, 1108 complete and 0 interrupted iterations
read_traffic    [  34% ] 07/20 VUs  2m04.0s/6m0s  7.00 iters/s
write_traffic   [  34% ] 03/20 VUs  2m04.0s/6m0s  3.00 iters/s

running (2m05.0s), 010/040 VUs, 1118 complete and 0 interrupted iterations
read_traffic    [  35% ] 07/20 VUs  2m05.0s/6m0s  7.00 iters/s
write_traffic   [  35% ] 03/20 VUs  2m05.0s/6m0s  3.00 iters/s

running (2m06.0s), 010/040 VUs, 1128 complete and 0 interrupted iterations
read_traffic    [  35% ] 07/20 VUs  2m06.0s/6m0s  7.00 iters/s
write_traffic   [  35% ] 03/20 VUs  2m06.0s/6m0s  3.00 iters/s

running (2m07.0s), 010/040 VUs, 1138 complete and 0 interrupted iterations
read_traffic    [  35% ] 07/20 VUs  2m07.0s/6m0s  7.00 iters/s
write_traffic   [  35% ] 03/20 VUs  2m07.0s/6m0s  3.00 iters/s

running (2m08.0s), 010/040 VUs, 1148 complete and 0 interrupted iterations
read_traffic    [  36% ] 07/20 VUs  2m08.0s/6m0s  7.00 iters/s
write_traffic   [  36% ] 03/20 VUs  2m08.0s/6m0s  3.00 iters/s

running (2m09.0s), 010/040 VUs, 1158 complete and 0 interrupted iterations
read_traffic    [  36% ] 07/20 VUs  2m09.0s/6m0s  7.00 iters/s
write_traffic   [  36% ] 03/20 VUs  2m09.0s/6m0s  3.00 iters/s

running (2m10.0s), 010/040 VUs, 1168 complete and 0 interrupted iterations
read_traffic    [  36% ] 07/20 VUs  2m10.0s/6m0s  7.00 iters/s
write_traffic   [  36% ] 03/20 VUs  2m10.0s/6m0s  3.00 iters/s

running (2m11.0s), 010/040 VUs, 1178 complete and 0 interrupted iterations
read_traffic    [  36% ] 07/20 VUs  2m11.0s/6m0s  7.00 iters/s
write_traffic   [  36% ] 03/20 VUs  2m11.0s/6m0s  3.00 iters/s

running (2m12.0s), 010/040 VUs, 1188 complete and 0 interrupted iterations
read_traffic    [  37% ] 07/20 VUs  2m12.0s/6m0s  7.00 iters/s
write_traffic   [  37% ] 03/20 VUs  2m12.0s/6m0s  3.00 iters/s

running (2m13.0s), 010/040 VUs, 1198 complete and 0 interrupted iterations
read_traffic    [  37% ] 07/20 VUs  2m13.0s/6m0s  7.00 iters/s
write_traffic   [  37% ] 03/20 VUs  2m13.0s/6m0s  3.00 iters/s

running (2m14.0s), 010/040 VUs, 1208 complete and 0 interrupted iterations
read_traffic    [  37% ] 07/20 VUs  2m14.0s/6m0s  7.00 iters/s
write_traffic   [  37% ] 03/20 VUs  2m14.0s/6m0s  3.00 iters/s

running (2m15.0s), 010/040 VUs, 1218 complete and 0 interrupted iterations
read_traffic    [  37% ] 07/20 VUs  2m15.0s/6m0s  7.00 iters/s
write_traffic   [  37% ] 03/20 VUs  2m15.0s/6m0s  3.00 iters/s

running (2m16.0s), 010/040 VUs, 1228 complete and 0 interrupted iterations
read_traffic    [  38% ] 07/20 VUs  2m16.0s/6m0s  7.00 iters/s
write_traffic   [  38% ] 03/20 VUs  2m16.0s/6m0s  3.00 iters/s

running (2m17.0s), 010/040 VUs, 1238 complete and 0 interrupted iterations
read_traffic    [  38% ] 07/20 VUs  2m17.0s/6m0s  7.00 iters/s
write_traffic   [  38% ] 03/20 VUs  2m17.0s/6m0s  3.00 iters/s

running (2m18.0s), 010/040 VUs, 1248 complete and 0 interrupted iterations
read_traffic    [  38% ] 07/20 VUs  2m18.0s/6m0s  7.00 iters/s
write_traffic   [  38% ] 03/20 VUs  2m18.0s/6m0s  3.00 iters/s

running (2m19.0s), 010/040 VUs, 1258 complete and 0 interrupted iterations
read_traffic    [  39% ] 07/20 VUs  2m19.0s/6m0s  7.00 iters/s
write_traffic   [  39% ] 03/20 VUs  2m19.0s/6m0s  3.00 iters/s

running (2m20.0s), 010/040 VUs, 1268 complete and 0 interrupted iterations
read_traffic    [  39% ] 07/20 VUs  2m20.0s/6m0s  7.00 iters/s
write_traffic   [  39% ] 03/20 VUs  2m20.0s/6m0s  3.00 iters/s

running (2m21.0s), 010/040 VUs, 1278 complete and 0 interrupted iterations
read_traffic    [  39% ] 07/20 VUs  2m21.0s/6m0s  7.00 iters/s
write_traffic   [  39% ] 03/20 VUs  2m21.0s/6m0s  3.00 iters/s

running (2m22.0s), 010/040 VUs, 1288 complete and 0 interrupted iterations
read_traffic    [  39% ] 07/20 VUs  2m22.0s/6m0s  7.00 iters/s
write_traffic   [  39% ] 03/20 VUs  2m22.0s/6m0s  3.00 iters/s

running (2m23.0s), 010/040 VUs, 1298 complete and 0 interrupted iterations
read_traffic    [  40% ] 07/20 VUs  2m23.0s/6m0s  7.00 iters/s
write_traffic   [  40% ] 03/20 VUs  2m23.0s/6m0s  3.00 iters/s

running (2m24.0s), 010/040 VUs, 1308 complete and 0 interrupted iterations
read_traffic    [  40% ] 07/20 VUs  2m24.0s/6m0s  7.00 iters/s
write_traffic   [  40% ] 03/20 VUs  2m24.0s/6m0s  3.00 iters/s

running (2m25.0s), 010/040 VUs, 1318 complete and 0 interrupted iterations
read_traffic    [  40% ] 07/20 VUs  2m25.0s/6m0s  7.00 iters/s
write_traffic   [  40% ] 03/20 VUs  2m25.0s/6m0s  3.00 iters/s

running (2m26.0s), 010/040 VUs, 1328 complete and 0 interrupted iterations
read_traffic    [  41% ] 07/20 VUs  2m26.0s/6m0s  7.00 iters/s
write_traffic   [  41% ] 03/20 VUs  2m26.0s/6m0s  3.00 iters/s

running (2m27.0s), 010/040 VUs, 1338 complete and 0 interrupted iterations
read_traffic    [  41% ] 07/20 VUs  2m27.0s/6m0s  7.00 iters/s
write_traffic   [  41% ] 03/20 VUs  2m27.0s/6m0s  3.00 iters/s

running (2m28.0s), 010/040 VUs, 1348 complete and 0 interrupted iterations
read_traffic    [  41% ] 07/20 VUs  2m28.0s/6m0s  7.00 iters/s
write_traffic   [  41% ] 03/20 VUs  2m28.0s/6m0s  3.00 iters/s

running (2m29.0s), 010/040 VUs, 1358 complete and 0 interrupted iterations
read_traffic    [  41% ] 07/20 VUs  2m29.0s/6m0s  7.00 iters/s
write_traffic   [  41% ] 03/20 VUs  2m29.0s/6m0s  3.00 iters/s

running (2m30.0s), 010/040 VUs, 1368 complete and 0 interrupted iterations
read_traffic    [  42% ] 07/20 VUs  2m30.0s/6m0s  7.00 iters/s
write_traffic   [  42% ] 03/20 VUs  2m30.0s/6m0s  3.00 iters/s

running (2m31.0s), 010/040 VUs, 1378 complete and 0 interrupted iterations
read_traffic    [  42% ] 07/20 VUs  2m31.0s/6m0s  7.00 iters/s
write_traffic   [  42% ] 03/20 VUs  2m31.0s/6m0s  3.00 iters/s

running (2m32.0s), 010/040 VUs, 1388 complete and 0 interrupted iterations
read_traffic    [  42% ] 07/20 VUs  2m32.0s/6m0s  7.00 iters/s
write_traffic   [  42% ] 03/20 VUs  2m32.0s/6m0s  3.00 iters/s

running (2m33.0s), 010/040 VUs, 1398 complete and 0 interrupted iterations
read_traffic    [  42% ] 07/20 VUs  2m33.0s/6m0s  7.00 iters/s
write_traffic   [  42% ] 03/20 VUs  2m33.0s/6m0s  3.00 iters/s

running (2m34.0s), 010/040 VUs, 1408 complete and 0 interrupted iterations
read_traffic    [  43% ] 07/20 VUs  2m34.0s/6m0s  7.00 iters/s
write_traffic   [  43% ] 03/20 VUs  2m34.0s/6m0s  3.00 iters/s

running (2m35.0s), 010/040 VUs, 1418 complete and 0 interrupted iterations
read_traffic    [  43% ] 07/20 VUs  2m35.0s/6m0s  7.00 iters/s
write_traffic   [  43% ] 03/20 VUs  2m35.0s/6m0s  3.00 iters/s

running (2m36.0s), 010/040 VUs, 1428 complete and 0 interrupted iterations
read_traffic    [  43% ] 07/20 VUs  2m36.0s/6m0s  7.00 iters/s
write_traffic   [  43% ] 03/20 VUs  2m36.0s/6m0s  3.00 iters/s

running (2m37.0s), 010/040 VUs, 1438 complete and 0 interrupted iterations
read_traffic    [  44% ] 07/20 VUs  2m37.0s/6m0s  7.00 iters/s
write_traffic   [  44% ] 03/20 VUs  2m37.0s/6m0s  3.00 iters/s

running (2m38.0s), 010/040 VUs, 1448 complete and 0 interrupted iterations
read_traffic    [  44% ] 07/20 VUs  2m38.0s/6m0s  7.00 iters/s
write_traffic   [  44% ] 03/20 VUs  2m38.0s/6m0s  3.00 iters/s

running (2m39.0s), 010/040 VUs, 1458 complete and 0 interrupted iterations
read_traffic    [  44% ] 07/20 VUs  2m39.0s/6m0s  7.00 iters/s
write_traffic   [  44% ] 03/20 VUs  2m39.0s/6m0s  3.00 iters/s

running (2m40.0s), 010/040 VUs, 1468 complete and 0 interrupted iterations
read_traffic    [  44% ] 07/20 VUs  2m40.0s/6m0s  7.00 iters/s
write_traffic   [  44% ] 03/20 VUs  2m40.0s/6m0s  3.00 iters/s

running (2m41.0s), 010/040 VUs, 1478 complete and 0 interrupted iterations
read_traffic    [  45% ] 07/20 VUs  2m41.0s/6m0s  7.00 iters/s
write_traffic   [  45% ] 03/20 VUs  2m41.0s/6m0s  3.00 iters/s

running (2m42.0s), 010/040 VUs, 1488 complete and 0 interrupted iterations
read_traffic    [  45% ] 07/20 VUs  2m42.0s/6m0s  7.00 iters/s
write_traffic   [  45% ] 03/20 VUs  2m42.0s/6m0s  3.00 iters/s

running (2m43.0s), 010/040 VUs, 1498 complete and 0 interrupted iterations
read_traffic    [  45% ] 07/20 VUs  2m43.0s/6m0s  7.00 iters/s
write_traffic   [  45% ] 03/20 VUs  2m43.0s/6m0s  3.00 iters/s

running (2m44.0s), 010/040 VUs, 1508 complete and 0 interrupted iterations
read_traffic    [  46% ] 07/20 VUs  2m44.0s/6m0s  7.00 iters/s
write_traffic   [  46% ] 03/20 VUs  2m44.0s/6m0s  3.00 iters/s

running (2m45.0s), 010/040 VUs, 1518 complete and 0 interrupted iterations
read_traffic    [  46% ] 07/20 VUs  2m45.0s/6m0s  7.00 iters/s
write_traffic   [  46% ] 03/20 VUs  2m45.0s/6m0s  3.00 iters/s

running (2m46.0s), 010/040 VUs, 1528 complete and 0 interrupted iterations
read_traffic    [  46% ] 07/20 VUs  2m46.0s/6m0s  7.00 iters/s
write_traffic   [  46% ] 03/20 VUs  2m46.0s/6m0s  3.00 iters/s

running (2m47.0s), 010/040 VUs, 1538 complete and 0 interrupted iterations
read_traffic    [  46% ] 07/20 VUs  2m47.0s/6m0s  7.00 iters/s
write_traffic   [  46% ] 03/20 VUs  2m47.0s/6m0s  3.00 iters/s

running (2m48.0s), 010/040 VUs, 1548 complete and 0 interrupted iterations
read_traffic    [  47% ] 07/20 VUs  2m48.0s/6m0s  7.00 iters/s
write_traffic   [  47% ] 03/20 VUs  2m48.0s/6m0s  3.00 iters/s

running (2m49.0s), 010/040 VUs, 1558 complete and 0 interrupted iterations
read_traffic    [  47% ] 07/20 VUs  2m49.0s/6m0s  7.00 iters/s
write_traffic   [  47% ] 03/20 VUs  2m49.0s/6m0s  3.00 iters/s

running (2m50.0s), 010/040 VUs, 1568 complete and 0 interrupted iterations
read_traffic    [  47% ] 07/20 VUs  2m50.0s/6m0s  7.00 iters/s
write_traffic   [  47% ] 03/20 VUs  2m50.0s/6m0s  3.00 iters/s

running (2m51.0s), 010/040 VUs, 1578 complete and 0 interrupted iterations
read_traffic    [  47% ] 07/20 VUs  2m51.0s/6m0s  7.00 iters/s
write_traffic   [  47% ] 03/20 VUs  2m51.0s/6m0s  3.00 iters/s

running (2m52.0s), 010/040 VUs, 1588 complete and 0 interrupted iterations
read_traffic    [  48% ] 07/20 VUs  2m52.0s/6m0s  7.00 iters/s
write_traffic   [  48% ] 03/20 VUs  2m52.0s/6m0s  3.00 iters/s

running (2m53.0s), 010/040 VUs, 1598 complete and 0 interrupted iterations
read_traffic    [  48% ] 07/20 VUs  2m53.0s/6m0s  7.00 iters/s
write_traffic   [  48% ] 03/20 VUs  2m53.0s/6m0s  3.00 iters/s

running (2m54.0s), 010/040 VUs, 1608 complete and 0 interrupted iterations
read_traffic    [  48% ] 07/20 VUs  2m54.0s/6m0s  7.00 iters/s
write_traffic   [  48% ] 03/20 VUs  2m54.0s/6m0s  3.00 iters/s

running (2m55.0s), 010/040 VUs, 1618 complete and 0 interrupted iterations
read_traffic    [  49% ] 07/20 VUs  2m55.0s/6m0s  7.00 iters/s
write_traffic   [  49% ] 03/20 VUs  2m55.0s/6m0s  3.00 iters/s

running (2m56.0s), 010/040 VUs, 1628 complete and 0 interrupted iterations
read_traffic    [  49% ] 07/20 VUs  2m56.0s/6m0s  7.00 iters/s
write_traffic   [  49% ] 03/20 VUs  2m56.0s/6m0s  3.00 iters/s

running (2m57.0s), 010/040 VUs, 1638 complete and 0 interrupted iterations
read_traffic    [  49% ] 07/20 VUs  2m57.0s/6m0s  7.00 iters/s
write_traffic   [  49% ] 03/20 VUs  2m57.0s/6m0s  3.00 iters/s

running (2m58.0s), 010/040 VUs, 1648 complete and 0 interrupted iterations
read_traffic    [  49% ] 07/20 VUs  2m58.0s/6m0s  7.00 iters/s
write_traffic   [  49% ] 03/20 VUs  2m58.0s/6m0s  3.00 iters/s

running (2m59.0s), 010/040 VUs, 1658 complete and 0 interrupted iterations
read_traffic    [  50% ] 07/20 VUs  2m59.0s/6m0s  7.00 iters/s
write_traffic   [  50% ] 03/20 VUs  2m59.0s/6m0s  3.00 iters/s

running (3m00.0s), 010/040 VUs, 1668 complete and 0 interrupted iterations
read_traffic    [  50% ] 07/20 VUs  3m00.0s/6m0s  7.00 iters/s
write_traffic   [  50% ] 03/20 VUs  3m00.0s/6m0s  3.00 iters/s

running (3m01.0s), 010/040 VUs, 1678 complete and 0 interrupted iterations
read_traffic    [  50% ] 07/20 VUs  3m01.0s/6m0s  7.00 iters/s
write_traffic   [  50% ] 03/20 VUs  3m01.0s/6m0s  3.00 iters/s

running (3m02.0s), 010/040 VUs, 1688 complete and 0 interrupted iterations
read_traffic    [  51% ] 07/20 VUs  3m02.0s/6m0s  7.00 iters/s
write_traffic   [  51% ] 03/20 VUs  3m02.0s/6m0s  3.00 iters/s

running (3m03.0s), 010/040 VUs, 1698 complete and 0 interrupted iterations
read_traffic    [  51% ] 07/20 VUs  3m03.0s/6m0s  7.00 iters/s
write_traffic   [  51% ] 03/20 VUs  3m03.0s/6m0s  3.00 iters/s

running (3m04.0s), 010/040 VUs, 1708 complete and 0 interrupted iterations
read_traffic    [  51% ] 07/20 VUs  3m04.0s/6m0s  7.00 iters/s
write_traffic   [  51% ] 03/20 VUs  3m04.0s/6m0s  3.00 iters/s

running (3m05.0s), 010/040 VUs, 1718 complete and 0 interrupted iterations
read_traffic    [  51% ] 07/20 VUs  3m05.0s/6m0s  7.00 iters/s
write_traffic   [  51% ] 03/20 VUs  3m05.0s/6m0s  3.00 iters/s

running (3m06.0s), 010/040 VUs, 1728 complete and 0 interrupted iterations
read_traffic    [  52% ] 07/20 VUs  3m06.0s/6m0s  7.00 iters/s
write_traffic   [  52% ] 03/20 VUs  3m06.0s/6m0s  3.00 iters/s

running (3m07.0s), 010/040 VUs, 1738 complete and 0 interrupted iterations
read_traffic    [  52% ] 07/20 VUs  3m07.0s/6m0s  7.00 iters/s
write_traffic   [  52% ] 03/20 VUs  3m07.0s/6m0s  3.00 iters/s

running (3m08.0s), 010/040 VUs, 1748 complete and 0 interrupted iterations
read_traffic    [  52% ] 07/20 VUs  3m08.0s/6m0s  7.00 iters/s
write_traffic   [  52% ] 03/20 VUs  3m08.0s/6m0s  3.00 iters/s

running (3m09.0s), 010/040 VUs, 1758 complete and 0 interrupted iterations
read_traffic    [  52% ] 07/20 VUs  3m09.0s/6m0s  7.00 iters/s
write_traffic   [  52% ] 03/20 VUs  3m09.0s/6m0s  3.00 iters/s

running (3m10.0s), 010/040 VUs, 1768 complete and 0 interrupted iterations
read_traffic    [  53% ] 07/20 VUs  3m10.0s/6m0s  7.00 iters/s
write_traffic   [  53% ] 03/20 VUs  3m10.0s/6m0s  3.00 iters/s

running (3m11.0s), 010/040 VUs, 1778 complete and 0 interrupted iterations
read_traffic    [  53% ] 07/20 VUs  3m11.0s/6m0s  7.00 iters/s
write_traffic   [  53% ] 03/20 VUs  3m11.0s/6m0s  3.00 iters/s

running (3m12.0s), 010/040 VUs, 1788 complete and 0 interrupted iterations
read_traffic    [  53% ] 07/20 VUs  3m12.0s/6m0s  7.00 iters/s
write_traffic   [  53% ] 03/20 VUs  3m12.0s/6m0s  3.00 iters/s

running (3m13.0s), 010/040 VUs, 1798 complete and 0 interrupted iterations
read_traffic    [  54% ] 07/20 VUs  3m13.0s/6m0s  7.00 iters/s
write_traffic   [  54% ] 03/20 VUs  3m13.0s/6m0s  3.00 iters/s

running (3m14.0s), 010/040 VUs, 1808 complete and 0 interrupted iterations
read_traffic    [  54% ] 07/20 VUs  3m14.0s/6m0s  7.00 iters/s
write_traffic   [  54% ] 03/20 VUs  3m14.0s/6m0s  3.00 iters/s

running (3m15.0s), 010/040 VUs, 1818 complete and 0 interrupted iterations
read_traffic    [  54% ] 07/20 VUs  3m15.0s/6m0s  7.00 iters/s
write_traffic   [  54% ] 03/20 VUs  3m15.0s/6m0s  3.00 iters/s

running (3m16.0s), 010/040 VUs, 1828 complete and 0 interrupted iterations
read_traffic    [  54% ] 07/20 VUs  3m16.0s/6m0s  7.00 iters/s
write_traffic   [  54% ] 03/20 VUs  3m16.0s/6m0s  3.00 iters/s

running (3m17.0s), 010/040 VUs, 1838 complete and 0 interrupted iterations
read_traffic    [  55% ] 07/20 VUs  3m17.0s/6m0s  7.00 iters/s
write_traffic   [  55% ] 03/20 VUs  3m17.0s/6m0s  3.00 iters/s

running (3m18.0s), 010/040 VUs, 1848 complete and 0 interrupted iterations
read_traffic    [  55% ] 07/20 VUs  3m18.0s/6m0s  7.00 iters/s
write_traffic   [  55% ] 03/20 VUs  3m18.0s/6m0s  3.00 iters/s

running (3m19.0s), 010/040 VUs, 1858 complete and 0 interrupted iterations
read_traffic    [  55% ] 07/20 VUs  3m19.0s/6m0s  7.00 iters/s
write_traffic   [  55% ] 03/20 VUs  3m19.0s/6m0s  3.00 iters/s

running (3m20.0s), 010/040 VUs, 1868 complete and 0 interrupted iterations
read_traffic    [  56% ] 07/20 VUs  3m20.0s/6m0s  7.00 iters/s
write_traffic   [  56% ] 03/20 VUs  3m20.0s/6m0s  3.00 iters/s

running (3m21.0s), 010/040 VUs, 1878 complete and 0 interrupted iterations
read_traffic    [  56% ] 07/20 VUs  3m21.0s/6m0s  7.00 iters/s
write_traffic   [  56% ] 03/20 VUs  3m21.0s/6m0s  3.00 iters/s

running (3m22.0s), 010/040 VUs, 1888 complete and 0 interrupted iterations
read_traffic    [  56% ] 07/20 VUs  3m22.0s/6m0s  7.00 iters/s
write_traffic   [  56% ] 03/20 VUs  3m22.0s/6m0s  3.00 iters/s

running (3m23.0s), 010/040 VUs, 1898 complete and 0 interrupted iterations
read_traffic    [  56% ] 07/20 VUs  3m23.0s/6m0s  7.00 iters/s
write_traffic   [  56% ] 03/20 VUs  3m23.0s/6m0s  3.00 iters/s

running (3m24.0s), 010/040 VUs, 1908 complete and 0 interrupted iterations
read_traffic    [  57% ] 07/20 VUs  3m24.0s/6m0s  7.00 iters/s
write_traffic   [  57% ] 03/20 VUs  3m24.0s/6m0s  3.00 iters/s

running (3m25.0s), 010/040 VUs, 1918 complete and 0 interrupted iterations
read_traffic    [  57% ] 07/20 VUs  3m25.0s/6m0s  7.00 iters/s
write_traffic   [  57% ] 03/20 VUs  3m25.0s/6m0s  3.00 iters/s

running (3m26.0s), 010/040 VUs, 1928 complete and 0 interrupted iterations
read_traffic    [  57% ] 07/20 VUs  3m26.0s/6m0s  7.00 iters/s
write_traffic   [  57% ] 03/20 VUs  3m26.0s/6m0s  3.00 iters/s

running (3m27.0s), 010/040 VUs, 1938 complete and 0 interrupted iterations
read_traffic    [  57% ] 07/20 VUs  3m27.0s/6m0s  7.00 iters/s
write_traffic   [  57% ] 03/20 VUs  3m27.0s/6m0s  3.00 iters/s

running (3m28.0s), 010/040 VUs, 1948 complete and 0 interrupted iterations
read_traffic    [  58% ] 07/20 VUs  3m28.0s/6m0s  7.00 iters/s
write_traffic   [  58% ] 03/20 VUs  3m28.0s/6m0s  3.00 iters/s

running (3m29.0s), 010/040 VUs, 1958 complete and 0 interrupted iterations
read_traffic    [  58% ] 07/20 VUs  3m29.0s/6m0s  7.00 iters/s
write_traffic   [  58% ] 03/20 VUs  3m29.0s/6m0s  3.00 iters/s

running (3m30.0s), 010/040 VUs, 1968 complete and 0 interrupted iterations
read_traffic    [  58% ] 07/20 VUs  3m30.0s/6m0s  7.00 iters/s
write_traffic   [  58% ] 03/20 VUs  3m30.0s/6m0s  3.00 iters/s

running (3m31.0s), 010/040 VUs, 1978 complete and 0 interrupted iterations
read_traffic    [  59% ] 07/20 VUs  3m31.0s/6m0s  7.00 iters/s
write_traffic   [  59% ] 03/20 VUs  3m31.0s/6m0s  3.00 iters/s

running (3m32.0s), 010/040 VUs, 1988 complete and 0 interrupted iterations
read_traffic    [  59% ] 07/20 VUs  3m32.0s/6m0s  7.00 iters/s
write_traffic   [  59% ] 03/20 VUs  3m32.0s/6m0s  3.00 iters/s

running (3m33.0s), 010/040 VUs, 1998 complete and 0 interrupted iterations
read_traffic    [  59% ] 07/20 VUs  3m33.0s/6m0s  7.00 iters/s
write_traffic   [  59% ] 03/20 VUs  3m33.0s/6m0s  3.00 iters/s

running (3m34.0s), 010/040 VUs, 2008 complete and 0 interrupted iterations
read_traffic    [  59% ] 07/20 VUs  3m34.0s/6m0s  7.00 iters/s
write_traffic   [  59% ] 03/20 VUs  3m34.0s/6m0s  3.00 iters/s

running (3m35.0s), 010/040 VUs, 2018 complete and 0 interrupted iterations
read_traffic    [  60% ] 07/20 VUs  3m35.0s/6m0s  7.00 iters/s
write_traffic   [  60% ] 03/20 VUs  3m35.0s/6m0s  3.00 iters/s

running (3m36.0s), 010/040 VUs, 2028 complete and 0 interrupted iterations
read_traffic    [  60% ] 07/20 VUs  3m36.0s/6m0s  7.00 iters/s
write_traffic   [  60% ] 03/20 VUs  3m36.0s/6m0s  3.00 iters/s

running (3m37.0s), 010/040 VUs, 2038 complete and 0 interrupted iterations
read_traffic    [  60% ] 07/20 VUs  3m37.0s/6m0s  7.00 iters/s
write_traffic   [  60% ] 03/20 VUs  3m37.0s/6m0s  3.00 iters/s

running (3m38.0s), 010/040 VUs, 2048 complete and 0 interrupted iterations
read_traffic    [  61% ] 07/20 VUs  3m38.0s/6m0s  7.00 iters/s
write_traffic   [  61% ] 03/20 VUs  3m38.0s/6m0s  3.00 iters/s

running (3m39.0s), 010/040 VUs, 2058 complete and 0 interrupted iterations
read_traffic    [  61% ] 07/20 VUs  3m39.0s/6m0s  7.00 iters/s
write_traffic   [  61% ] 03/20 VUs  3m39.0s/6m0s  3.00 iters/s

running (3m40.0s), 010/040 VUs, 2068 complete and 0 interrupted iterations
read_traffic    [  61% ] 07/20 VUs  3m40.0s/6m0s  7.00 iters/s
write_traffic   [  61% ] 03/20 VUs  3m40.0s/6m0s  3.00 iters/s

running (3m41.0s), 010/040 VUs, 2078 complete and 0 interrupted iterations
read_traffic    [  61% ] 07/20 VUs  3m41.0s/6m0s  7.00 iters/s
write_traffic   [  61% ] 03/20 VUs  3m41.0s/6m0s  3.00 iters/s

running (3m42.0s), 010/040 VUs, 2088 complete and 0 interrupted iterations
read_traffic    [  62% ] 07/20 VUs  3m42.0s/6m0s  7.00 iters/s
write_traffic   [  62% ] 03/20 VUs  3m42.0s/6m0s  3.00 iters/s

running (3m43.0s), 010/040 VUs, 2098 complete and 0 interrupted iterations
read_traffic    [  62% ] 07/20 VUs  3m43.0s/6m0s  7.00 iters/s
write_traffic   [  62% ] 03/20 VUs  3m43.0s/6m0s  3.00 iters/s

running (3m44.0s), 010/040 VUs, 2108 complete and 0 interrupted iterations
read_traffic    [  62% ] 07/20 VUs  3m44.0s/6m0s  7.00 iters/s
write_traffic   [  62% ] 03/20 VUs  3m44.0s/6m0s  3.00 iters/s

running (3m45.0s), 010/040 VUs, 2118 complete and 0 interrupted iterations
read_traffic    [  62% ] 07/20 VUs  3m45.0s/6m0s  7.00 iters/s
write_traffic   [  62% ] 03/20 VUs  3m45.0s/6m0s  3.00 iters/s

running (3m46.0s), 010/040 VUs, 2128 complete and 0 interrupted iterations
read_traffic    [  63% ] 07/20 VUs  3m46.0s/6m0s  7.00 iters/s
write_traffic   [  63% ] 03/20 VUs  3m46.0s/6m0s  3.00 iters/s

running (3m47.0s), 010/040 VUs, 2138 complete and 0 interrupted iterations
read_traffic    [  63% ] 07/20 VUs  3m47.0s/6m0s  7.00 iters/s
write_traffic   [  63% ] 03/20 VUs  3m47.0s/6m0s  3.00 iters/s

running (3m48.0s), 010/040 VUs, 2148 complete and 0 interrupted iterations
read_traffic    [  63% ] 07/20 VUs  3m48.0s/6m0s  7.00 iters/s
write_traffic   [  63% ] 03/20 VUs  3m48.0s/6m0s  3.00 iters/s

running (3m49.0s), 010/040 VUs, 2158 complete and 0 interrupted iterations
read_traffic    [  64% ] 07/20 VUs  3m49.0s/6m0s  7.00 iters/s
write_traffic   [  64% ] 03/20 VUs  3m49.0s/6m0s  3.00 iters/s

running (3m50.0s), 010/040 VUs, 2168 complete and 0 interrupted iterations
read_traffic    [  64% ] 07/20 VUs  3m50.0s/6m0s  7.00 iters/s
write_traffic   [  64% ] 03/20 VUs  3m50.0s/6m0s  3.00 iters/s

running (3m51.0s), 010/040 VUs, 2178 complete and 0 interrupted iterations
read_traffic    [  64% ] 07/20 VUs  3m51.0s/6m0s  7.00 iters/s
write_traffic   [  64% ] 03/20 VUs  3m51.0s/6m0s  3.00 iters/s

running (3m52.0s), 010/040 VUs, 2188 complete and 0 interrupted iterations
read_traffic    [  64% ] 07/20 VUs  3m52.0s/6m0s  7.00 iters/s
write_traffic   [  64% ] 03/20 VUs  3m52.0s/6m0s  3.00 iters/s

running (3m53.0s), 010/040 VUs, 2198 complete and 0 interrupted iterations
read_traffic    [  65% ] 07/20 VUs  3m53.0s/6m0s  7.00 iters/s
write_traffic   [  65% ] 03/20 VUs  3m53.0s/6m0s  3.00 iters/s

running (3m54.0s), 010/040 VUs, 2208 complete and 0 interrupted iterations
read_traffic    [  65% ] 07/20 VUs  3m54.0s/6m0s  7.00 iters/s
write_traffic   [  65% ] 03/20 VUs  3m54.0s/6m0s  3.00 iters/s

running (3m55.0s), 010/040 VUs, 2218 complete and 0 interrupted iterations
read_traffic    [  65% ] 07/20 VUs  3m55.0s/6m0s  7.00 iters/s
write_traffic   [  65% ] 03/20 VUs  3m55.0s/6m0s  3.00 iters/s

running (3m56.0s), 010/040 VUs, 2228 complete and 0 interrupted iterations
read_traffic    [  66% ] 07/20 VUs  3m56.0s/6m0s  7.00 iters/s
write_traffic   [  66% ] 03/20 VUs  3m56.0s/6m0s  3.00 iters/s

running (3m57.0s), 010/040 VUs, 2238 complete and 0 interrupted iterations
read_traffic    [  66% ] 07/20 VUs  3m57.0s/6m0s  7.00 iters/s
write_traffic   [  66% ] 03/20 VUs  3m57.0s/6m0s  3.00 iters/s

running (3m58.0s), 010/040 VUs, 2248 complete and 0 interrupted iterations
read_traffic    [  66% ] 07/20 VUs  3m58.0s/6m0s  7.00 iters/s
write_traffic   [  66% ] 03/20 VUs  3m58.0s/6m0s  3.00 iters/s

running (3m59.0s), 010/040 VUs, 2258 complete and 0 interrupted iterations
read_traffic    [  66% ] 07/20 VUs  3m59.0s/6m0s  7.00 iters/s
write_traffic   [  66% ] 03/20 VUs  3m59.0s/6m0s  3.00 iters/s

running (4m00.0s), 010/040 VUs, 2268 complete and 0 interrupted iterations
read_traffic    [  67% ] 07/20 VUs  4m00.0s/6m0s  7.00 iters/s
write_traffic   [  67% ] 03/20 VUs  4m00.0s/6m0s  3.00 iters/s

running (4m01.0s), 010/040 VUs, 2278 complete and 0 interrupted iterations
read_traffic    [  67% ] 07/20 VUs  4m01.0s/6m0s  7.00 iters/s
write_traffic   [  67% ] 03/20 VUs  4m01.0s/6m0s  3.00 iters/s

running (4m02.0s), 010/040 VUs, 2288 complete and 0 interrupted iterations
read_traffic    [  67% ] 07/20 VUs  4m02.0s/6m0s  7.00 iters/s
write_traffic   [  67% ] 03/20 VUs  4m02.0s/6m0s  3.00 iters/s

running (4m03.0s), 010/040 VUs, 2298 complete and 0 interrupted iterations
read_traffic    [  67% ] 07/20 VUs  4m03.0s/6m0s  7.00 iters/s
write_traffic   [  67% ] 03/20 VUs  4m03.0s/6m0s  3.00 iters/s

running (4m04.0s), 010/040 VUs, 2308 complete and 0 interrupted iterations
read_traffic    [  68% ] 07/20 VUs  4m04.0s/6m0s  7.00 iters/s
write_traffic   [  68% ] 03/20 VUs  4m04.0s/6m0s  3.00 iters/s

running (4m05.0s), 010/040 VUs, 2318 complete and 0 interrupted iterations
read_traffic    [  68% ] 07/20 VUs  4m05.0s/6m0s  7.00 iters/s
write_traffic   [  68% ] 03/20 VUs  4m05.0s/6m0s  3.00 iters/s

running (4m06.0s), 010/040 VUs, 2328 complete and 0 interrupted iterations
read_traffic    [  68% ] 07/20 VUs  4m06.0s/6m0s  7.00 iters/s
write_traffic   [  68% ] 03/20 VUs  4m06.0s/6m0s  3.00 iters/s

running (4m07.0s), 010/040 VUs, 2338 complete and 0 interrupted iterations
read_traffic    [  69% ] 07/20 VUs  4m07.0s/6m0s  7.00 iters/s
write_traffic   [  69% ] 03/20 VUs  4m07.0s/6m0s  3.00 iters/s

running (4m08.0s), 010/040 VUs, 2348 complete and 0 interrupted iterations
read_traffic    [  69% ] 07/20 VUs  4m08.0s/6m0s  7.00 iters/s
write_traffic   [  69% ] 03/20 VUs  4m08.0s/6m0s  3.00 iters/s

running (4m09.0s), 010/040 VUs, 2358 complete and 0 interrupted iterations
read_traffic    [  69% ] 07/20 VUs  4m09.0s/6m0s  7.00 iters/s
write_traffic   [  69% ] 03/20 VUs  4m09.0s/6m0s  3.00 iters/s

running (4m10.0s), 010/040 VUs, 2368 complete and 0 interrupted iterations
read_traffic    [  69% ] 07/20 VUs  4m10.0s/6m0s  7.00 iters/s
write_traffic   [  69% ] 03/20 VUs  4m10.0s/6m0s  3.00 iters/s

running (4m11.0s), 010/040 VUs, 2378 complete and 0 interrupted iterations
read_traffic    [  70% ] 07/20 VUs  4m11.0s/6m0s  7.00 iters/s
write_traffic   [  70% ] 03/20 VUs  4m11.0s/6m0s  3.00 iters/s

running (4m12.0s), 010/040 VUs, 2388 complete and 0 interrupted iterations
read_traffic    [  70% ] 07/20 VUs  4m12.0s/6m0s  7.00 iters/s
write_traffic   [  70% ] 03/20 VUs  4m12.0s/6m0s  3.00 iters/s

running (4m13.0s), 010/040 VUs, 2398 complete and 0 interrupted iterations
read_traffic    [  70% ] 07/20 VUs  4m13.0s/6m0s  7.00 iters/s
write_traffic   [  70% ] 03/20 VUs  4m13.0s/6m0s  3.00 iters/s

running (4m14.0s), 010/040 VUs, 2408 complete and 0 interrupted iterations
read_traffic    [  71% ] 07/20 VUs  4m14.0s/6m0s  7.00 iters/s
write_traffic   [  71% ] 03/20 VUs  4m14.0s/6m0s  3.00 iters/s

running (4m15.0s), 010/040 VUs, 2418 complete and 0 interrupted iterations
read_traffic    [  71% ] 07/20 VUs  4m15.0s/6m0s  7.00 iters/s
write_traffic   [  71% ] 03/20 VUs  4m15.0s/6m0s  3.00 iters/s

running (4m16.0s), 010/040 VUs, 2428 complete and 0 interrupted iterations
read_traffic    [  71% ] 07/20 VUs  4m16.0s/6m0s  7.00 iters/s
write_traffic   [  71% ] 03/20 VUs  4m16.0s/6m0s  3.00 iters/s

running (4m17.0s), 010/040 VUs, 2438 complete and 0 interrupted iterations
read_traffic    [  71% ] 07/20 VUs  4m17.0s/6m0s  7.00 iters/s
write_traffic   [  71% ] 03/20 VUs  4m17.0s/6m0s  3.00 iters/s

running (4m18.0s), 010/040 VUs, 2448 complete and 0 interrupted iterations
read_traffic    [  72% ] 07/20 VUs  4m18.0s/6m0s  7.00 iters/s
write_traffic   [  72% ] 03/20 VUs  4m18.0s/6m0s  3.00 iters/s

running (4m19.0s), 010/040 VUs, 2458 complete and 0 interrupted iterations
read_traffic    [  72% ] 07/20 VUs  4m19.0s/6m0s  7.00 iters/s
write_traffic   [  72% ] 03/20 VUs  4m19.0s/6m0s  3.00 iters/s

running (4m20.0s), 010/040 VUs, 2468 complete and 0 interrupted iterations
read_traffic    [  72% ] 07/20 VUs  4m20.0s/6m0s  7.00 iters/s
write_traffic   [  72% ] 03/20 VUs  4m20.0s/6m0s  3.00 iters/s

running (4m21.0s), 010/040 VUs, 2478 complete and 0 interrupted iterations
read_traffic    [  72% ] 07/20 VUs  4m21.0s/6m0s  7.00 iters/s
write_traffic   [  72% ] 03/20 VUs  4m21.0s/6m0s  3.00 iters/s

running (4m22.0s), 010/040 VUs, 2488 complete and 0 interrupted iterations
read_traffic    [  73% ] 07/20 VUs  4m22.0s/6m0s  7.00 iters/s
write_traffic   [  73% ] 03/20 VUs  4m22.0s/6m0s  3.00 iters/s

running (4m23.0s), 010/040 VUs, 2498 complete and 0 interrupted iterations
read_traffic    [  73% ] 07/20 VUs  4m23.0s/6m0s  7.00 iters/s
write_traffic   [  73% ] 03/20 VUs  4m23.0s/6m0s  3.00 iters/s

running (4m24.0s), 010/040 VUs, 2508 complete and 0 interrupted iterations
read_traffic    [  73% ] 07/20 VUs  4m24.0s/6m0s  7.00 iters/s
write_traffic   [  73% ] 03/20 VUs  4m24.0s/6m0s  3.00 iters/s

running (4m25.0s), 010/040 VUs, 2518 complete and 0 interrupted iterations
read_traffic    [  74% ] 07/20 VUs  4m25.0s/6m0s  7.00 iters/s
write_traffic   [  74% ] 03/20 VUs  4m25.0s/6m0s  3.00 iters/s

running (4m26.0s), 010/040 VUs, 2528 complete and 0 interrupted iterations
read_traffic    [  74% ] 07/20 VUs  4m26.0s/6m0s  7.00 iters/s
write_traffic   [  74% ] 03/20 VUs  4m26.0s/6m0s  3.00 iters/s

running (4m27.0s), 010/040 VUs, 2538 complete and 0 interrupted iterations
read_traffic    [  74% ] 07/20 VUs  4m27.0s/6m0s  7.00 iters/s
write_traffic   [  74% ] 03/20 VUs  4m27.0s/6m0s  3.00 iters/s

running (4m28.0s), 010/040 VUs, 2548 complete and 0 interrupted iterations
read_traffic    [  74% ] 07/20 VUs  4m28.0s/6m0s  7.00 iters/s
write_traffic   [  74% ] 03/20 VUs  4m28.0s/6m0s  3.00 iters/s

running (4m29.0s), 010/040 VUs, 2558 complete and 0 interrupted iterations
read_traffic    [  75% ] 07/20 VUs  4m29.0s/6m0s  7.00 iters/s
write_traffic   [  75% ] 03/20 VUs  4m29.0s/6m0s  3.00 iters/s

running (4m30.0s), 010/040 VUs, 2568 complete and 0 interrupted iterations
read_traffic    [  75% ] 07/20 VUs  4m30.0s/6m0s  7.00 iters/s
write_traffic   [  75% ] 03/20 VUs  4m30.0s/6m0s  3.00 iters/s

running (4m31.0s), 010/040 VUs, 2578 complete and 0 interrupted iterations
read_traffic    [  75% ] 07/20 VUs  4m31.0s/6m0s  7.00 iters/s
write_traffic   [  75% ] 03/20 VUs  4m31.0s/6m0s  3.00 iters/s

running (4m32.0s), 010/040 VUs, 2588 complete and 0 interrupted iterations
read_traffic    [  76% ] 07/20 VUs  4m32.0s/6m0s  7.00 iters/s
write_traffic   [  76% ] 03/20 VUs  4m32.0s/6m0s  3.00 iters/s

running (4m33.0s), 010/040 VUs, 2598 complete and 0 interrupted iterations
read_traffic    [  76% ] 07/20 VUs  4m33.0s/6m0s  7.00 iters/s
write_traffic   [  76% ] 03/20 VUs  4m33.0s/6m0s  3.00 iters/s

running (4m34.0s), 010/040 VUs, 2608 complete and 0 interrupted iterations
read_traffic    [  76% ] 07/20 VUs  4m34.0s/6m0s  7.00 iters/s
write_traffic   [  76% ] 03/20 VUs  4m34.0s/6m0s  3.00 iters/s

running (4m35.0s), 010/040 VUs, 2618 complete and 0 interrupted iterations
read_traffic    [  76% ] 07/20 VUs  4m35.0s/6m0s  7.00 iters/s
write_traffic   [  76% ] 03/20 VUs  4m35.0s/6m0s  3.00 iters/s

running (4m36.0s), 010/040 VUs, 2628 complete and 0 interrupted iterations
read_traffic    [  77% ] 07/20 VUs  4m36.0s/6m0s  7.00 iters/s
write_traffic   [  77% ] 03/20 VUs  4m36.0s/6m0s  3.00 iters/s

running (4m37.0s), 010/040 VUs, 2638 complete and 0 interrupted iterations
read_traffic    [  77% ] 07/20 VUs  4m37.0s/6m0s  7.00 iters/s
write_traffic   [  77% ] 03/20 VUs  4m37.0s/6m0s  3.00 iters/s

running (4m38.0s), 010/040 VUs, 2648 complete and 0 interrupted iterations
read_traffic    [  77% ] 07/20 VUs  4m38.0s/6m0s  7.00 iters/s
write_traffic   [  77% ] 03/20 VUs  4m38.0s/6m0s  3.00 iters/s

running (4m39.0s), 010/040 VUs, 2658 complete and 0 interrupted iterations
read_traffic    [  77% ] 07/20 VUs  4m39.0s/6m0s  7.00 iters/s
write_traffic   [  77% ] 03/20 VUs  4m39.0s/6m0s  3.00 iters/s

running (4m40.0s), 010/040 VUs, 2668 complete and 0 interrupted iterations
read_traffic    [  78% ] 07/20 VUs  4m40.0s/6m0s  7.00 iters/s
write_traffic   [  78% ] 03/20 VUs  4m40.0s/6m0s  3.00 iters/s

running (4m41.0s), 010/040 VUs, 2678 complete and 0 interrupted iterations
read_traffic    [  78% ] 07/20 VUs  4m41.0s/6m0s  7.00 iters/s
write_traffic   [  78% ] 03/20 VUs  4m41.0s/6m0s  3.00 iters/s

running (4m42.0s), 010/040 VUs, 2688 complete and 0 interrupted iterations
read_traffic    [  78% ] 07/20 VUs  4m42.0s/6m0s  7.00 iters/s
write_traffic   [  78% ] 03/20 VUs  4m42.0s/6m0s  3.00 iters/s

running (4m43.0s), 010/040 VUs, 2698 complete and 0 interrupted iterations
read_traffic    [  79% ] 07/20 VUs  4m43.0s/6m0s  7.00 iters/s
write_traffic   [  79% ] 03/20 VUs  4m43.0s/6m0s  3.00 iters/s

running (4m44.0s), 010/040 VUs, 2708 complete and 0 interrupted iterations
read_traffic    [  79% ] 07/20 VUs  4m44.0s/6m0s  7.00 iters/s
write_traffic   [  79% ] 03/20 VUs  4m44.0s/6m0s  3.00 iters/s

running (4m45.0s), 010/040 VUs, 2718 complete and 0 interrupted iterations
read_traffic    [  79% ] 07/20 VUs  4m45.0s/6m0s  7.00 iters/s
write_traffic   [  79% ] 03/20 VUs  4m45.0s/6m0s  3.00 iters/s

running (4m46.0s), 010/040 VUs, 2728 complete and 0 interrupted iterations
read_traffic    [  79% ] 07/20 VUs  4m46.0s/6m0s  7.00 iters/s
write_traffic   [  79% ] 03/20 VUs  4m46.0s/6m0s  3.00 iters/s

running (4m47.0s), 010/040 VUs, 2738 complete and 0 interrupted iterations
read_traffic    [  80% ] 07/20 VUs  4m47.0s/6m0s  7.00 iters/s
write_traffic   [  80% ] 03/20 VUs  4m47.0s/6m0s  3.00 iters/s

running (4m48.0s), 010/040 VUs, 2748 complete and 0 interrupted iterations
read_traffic    [  80% ] 07/20 VUs  4m48.0s/6m0s  7.00 iters/s
write_traffic   [  80% ] 03/20 VUs  4m48.0s/6m0s  3.00 iters/s

running (4m49.0s), 010/040 VUs, 2758 complete and 0 interrupted iterations
read_traffic    [  80% ] 07/20 VUs  4m49.0s/6m0s  7.00 iters/s
write_traffic   [  80% ] 03/20 VUs  4m49.0s/6m0s  3.00 iters/s

running (4m50.0s), 010/040 VUs, 2768 complete and 0 interrupted iterations
read_traffic    [  81% ] 07/20 VUs  4m50.0s/6m0s  7.00 iters/s
write_traffic   [  81% ] 03/20 VUs  4m50.0s/6m0s  3.00 iters/s

running (4m51.0s), 010/040 VUs, 2778 complete and 0 interrupted iterations
read_traffic    [  81% ] 07/20 VUs  4m51.0s/6m0s  7.00 iters/s
write_traffic   [  81% ] 03/20 VUs  4m51.0s/6m0s  3.00 iters/s

running (4m52.0s), 010/040 VUs, 2788 complete and 0 interrupted iterations
read_traffic    [  81% ] 07/20 VUs  4m52.0s/6m0s  7.00 iters/s
write_traffic   [  81% ] 03/20 VUs  4m52.0s/6m0s  3.00 iters/s

running (4m53.0s), 010/040 VUs, 2798 complete and 0 interrupted iterations
read_traffic    [  81% ] 07/20 VUs  4m53.0s/6m0s  7.00 iters/s
write_traffic   [  81% ] 03/20 VUs  4m53.0s/6m0s  3.00 iters/s

running (4m54.0s), 010/040 VUs, 2808 complete and 0 interrupted iterations
read_traffic    [  82% ] 07/20 VUs  4m54.0s/6m0s  7.00 iters/s
write_traffic   [  82% ] 03/20 VUs  4m54.0s/6m0s  3.00 iters/s

running (4m55.0s), 010/040 VUs, 2818 complete and 0 interrupted iterations
read_traffic    [  82% ] 07/20 VUs  4m55.0s/6m0s  7.00 iters/s
write_traffic   [  82% ] 03/20 VUs  4m55.0s/6m0s  3.00 iters/s

running (4m56.0s), 010/040 VUs, 2828 complete and 0 interrupted iterations
read_traffic    [  82% ] 07/20 VUs  4m56.0s/6m0s  7.00 iters/s
write_traffic   [  82% ] 03/20 VUs  4m56.0s/6m0s  3.00 iters/s

running (4m57.0s), 010/040 VUs, 2838 complete and 0 interrupted iterations
read_traffic    [  82% ] 07/20 VUs  4m57.0s/6m0s  7.00 iters/s
write_traffic   [  82% ] 03/20 VUs  4m57.0s/6m0s  3.00 iters/s

running (4m58.0s), 010/040 VUs, 2848 complete and 0 interrupted iterations
read_traffic    [  83% ] 07/20 VUs  4m58.0s/6m0s  7.00 iters/s
write_traffic   [  83% ] 03/20 VUs  4m58.0s/6m0s  3.00 iters/s

running (4m59.0s), 010/040 VUs, 2858 complete and 0 interrupted iterations
read_traffic    [  83% ] 07/20 VUs  4m59.0s/6m0s  7.00 iters/s
write_traffic   [  83% ] 03/20 VUs  4m59.0s/6m0s  3.00 iters/s

running (5m00.0s), 010/040 VUs, 2868 complete and 0 interrupted iterations
read_traffic    [  83% ] 07/20 VUs  5m00.0s/6m0s  7.00 iters/s
write_traffic   [  83% ] 03/20 VUs  5m00.0s/6m0s  3.00 iters/s

running (5m01.0s), 010/040 VUs, 2878 complete and 0 interrupted iterations
read_traffic    [  84% ] 07/20 VUs  5m01.0s/6m0s  7.00 iters/s
write_traffic   [  84% ] 03/20 VUs  5m01.0s/6m0s  3.00 iters/s

running (5m02.0s), 010/040 VUs, 2888 complete and 0 interrupted iterations
read_traffic    [  84% ] 07/20 VUs  5m02.0s/6m0s  7.00 iters/s
write_traffic   [  84% ] 03/20 VUs  5m02.0s/6m0s  3.00 iters/s

running (5m03.0s), 010/040 VUs, 2898 complete and 0 interrupted iterations
read_traffic    [  84% ] 07/20 VUs  5m03.0s/6m0s  7.00 iters/s
write_traffic   [  84% ] 03/20 VUs  5m03.0s/6m0s  3.00 iters/s

running (5m04.0s), 010/040 VUs, 2908 complete and 0 interrupted iterations
read_traffic    [  84% ] 07/20 VUs  5m04.0s/6m0s  7.00 iters/s
write_traffic   [  84% ] 03/20 VUs  5m04.0s/6m0s  3.00 iters/s

running (5m05.0s), 010/040 VUs, 2918 complete and 0 interrupted iterations
read_traffic    [  85% ] 07/20 VUs  5m05.0s/6m0s  7.00 iters/s
write_traffic   [  85% ] 03/20 VUs  5m05.0s/6m0s  3.00 iters/s

running (5m06.0s), 010/040 VUs, 2928 complete and 0 interrupted iterations
read_traffic    [  85% ] 07/20 VUs  5m06.0s/6m0s  7.00 iters/s
write_traffic   [  85% ] 03/20 VUs  5m06.0s/6m0s  3.00 iters/s

running (5m07.0s), 010/040 VUs, 2938 complete and 0 interrupted iterations
read_traffic    [  85% ] 07/20 VUs  5m07.0s/6m0s  7.00 iters/s
write_traffic   [  85% ] 03/20 VUs  5m07.0s/6m0s  3.00 iters/s

running (5m08.0s), 010/040 VUs, 2948 complete and 0 interrupted iterations
read_traffic    [  86% ] 07/20 VUs  5m08.0s/6m0s  7.00 iters/s
write_traffic   [  86% ] 03/20 VUs  5m08.0s/6m0s  3.00 iters/s

running (5m09.0s), 010/040 VUs, 2958 complete and 0 interrupted iterations
read_traffic    [  86% ] 07/20 VUs  5m09.0s/6m0s  7.00 iters/s
write_traffic   [  86% ] 03/20 VUs  5m09.0s/6m0s  3.00 iters/s

running (5m10.0s), 010/040 VUs, 2968 complete and 0 interrupted iterations
read_traffic    [  86% ] 07/20 VUs  5m10.0s/6m0s  7.00 iters/s
write_traffic   [  86% ] 03/20 VUs  5m10.0s/6m0s  3.00 iters/s

running (5m11.0s), 010/040 VUs, 2978 complete and 0 interrupted iterations
read_traffic    [  86% ] 07/20 VUs  5m11.0s/6m0s  7.00 iters/s
write_traffic   [  86% ] 03/20 VUs  5m11.0s/6m0s  3.00 iters/s

running (5m12.0s), 010/040 VUs, 2988 complete and 0 interrupted iterations
read_traffic    [  87% ] 07/20 VUs  5m12.0s/6m0s  7.00 iters/s
write_traffic   [  87% ] 03/20 VUs  5m12.0s/6m0s  3.00 iters/s

running (5m13.0s), 010/040 VUs, 2998 complete and 0 interrupted iterations
read_traffic    [  87% ] 07/20 VUs  5m13.0s/6m0s  7.00 iters/s
write_traffic   [  87% ] 03/20 VUs  5m13.0s/6m0s  3.00 iters/s

running (5m14.0s), 010/040 VUs, 3008 complete and 0 interrupted iterations
read_traffic    [  87% ] 07/20 VUs  5m14.0s/6m0s  7.00 iters/s
write_traffic   [  87% ] 03/20 VUs  5m14.0s/6m0s  3.00 iters/s

running (5m15.0s), 010/040 VUs, 3018 complete and 0 interrupted iterations
read_traffic    [  87% ] 07/20 VUs  5m15.0s/6m0s  7.00 iters/s
write_traffic   [  87% ] 03/20 VUs  5m15.0s/6m0s  3.00 iters/s

running (5m16.0s), 010/040 VUs, 3028 complete and 0 interrupted iterations
read_traffic    [  88% ] 07/20 VUs  5m16.0s/6m0s  7.00 iters/s
write_traffic   [  88% ] 03/20 VUs  5m16.0s/6m0s  3.00 iters/s

running (5m17.0s), 010/040 VUs, 3038 complete and 0 interrupted iterations
read_traffic    [  88% ] 07/20 VUs  5m17.0s/6m0s  7.00 iters/s
write_traffic   [  88% ] 03/20 VUs  5m17.0s/6m0s  3.00 iters/s

running (5m18.0s), 010/040 VUs, 3048 complete and 0 interrupted iterations
read_traffic    [  88% ] 07/20 VUs  5m18.0s/6m0s  7.00 iters/s
write_traffic   [  88% ] 03/20 VUs  5m18.0s/6m0s  3.00 iters/s

running (5m19.0s), 010/040 VUs, 3058 complete and 0 interrupted iterations
read_traffic    [  89% ] 07/20 VUs  5m19.0s/6m0s  7.00 iters/s
write_traffic   [  89% ] 03/20 VUs  5m19.0s/6m0s  3.00 iters/s

running (5m20.0s), 010/040 VUs, 3068 complete and 0 interrupted iterations
read_traffic    [  89% ] 07/20 VUs  5m20.0s/6m0s  7.00 iters/s
write_traffic   [  89% ] 03/20 VUs  5m20.0s/6m0s  3.00 iters/s

running (5m21.0s), 010/040 VUs, 3078 complete and 0 interrupted iterations
read_traffic    [  89% ] 07/20 VUs  5m21.0s/6m0s  7.00 iters/s
write_traffic   [  89% ] 03/20 VUs  5m21.0s/6m0s  3.00 iters/s

running (5m22.0s), 010/040 VUs, 3088 complete and 0 interrupted iterations
read_traffic    [  89% ] 07/20 VUs  5m22.0s/6m0s  7.00 iters/s
write_traffic   [  89% ] 03/20 VUs  5m22.0s/6m0s  3.00 iters/s

running (5m23.0s), 010/040 VUs, 3098 complete and 0 interrupted iterations
read_traffic    [  90% ] 07/20 VUs  5m23.0s/6m0s  7.00 iters/s
write_traffic   [  90% ] 03/20 VUs  5m23.0s/6m0s  3.00 iters/s

running (5m24.0s), 010/040 VUs, 3108 complete and 0 interrupted iterations
read_traffic    [  90% ] 07/20 VUs  5m24.0s/6m0s  7.00 iters/s
write_traffic   [  90% ] 03/20 VUs  5m24.0s/6m0s  3.00 iters/s

running (5m25.0s), 010/040 VUs, 3118 complete and 0 interrupted iterations
read_traffic    [  90% ] 07/20 VUs  5m25.0s/6m0s  7.00 iters/s
write_traffic   [  90% ] 03/20 VUs  5m25.0s/6m0s  3.00 iters/s

running (5m26.0s), 010/040 VUs, 3128 complete and 0 interrupted iterations
read_traffic    [  91% ] 07/20 VUs  5m26.0s/6m0s  7.00 iters/s
write_traffic   [  91% ] 03/20 VUs  5m26.0s/6m0s  3.00 iters/s

running (5m27.0s), 010/040 VUs, 3138 complete and 0 interrupted iterations
read_traffic    [  91% ] 07/20 VUs  5m27.0s/6m0s  7.00 iters/s
write_traffic   [  91% ] 03/20 VUs  5m27.0s/6m0s  3.00 iters/s

running (5m28.0s), 010/040 VUs, 3148 complete and 0 interrupted iterations
read_traffic    [  91% ] 07/20 VUs  5m28.0s/6m0s  7.00 iters/s
write_traffic   [  91% ] 03/20 VUs  5m28.0s/6m0s  3.00 iters/s

running (5m29.0s), 010/040 VUs, 3158 complete and 0 interrupted iterations
read_traffic    [  91% ] 07/20 VUs  5m29.0s/6m0s  7.00 iters/s
write_traffic   [  91% ] 03/20 VUs  5m29.0s/6m0s  3.00 iters/s

running (5m30.0s), 010/040 VUs, 3168 complete and 0 interrupted iterations
read_traffic    [  92% ] 07/20 VUs  5m30.0s/6m0s  7.00 iters/s
write_traffic   [  92% ] 03/20 VUs  5m30.0s/6m0s  3.00 iters/s

running (5m31.0s), 010/040 VUs, 3178 complete and 0 interrupted iterations
read_traffic    [  92% ] 07/20 VUs  5m31.0s/6m0s  6.78 iters/s
write_traffic   [  92% ] 03/20 VUs  5m31.0s/6m0s  2.92 iters/s

running (5m32.0s), 010/040 VUs, 3188 complete and 0 interrupted iterations
read_traffic    [  92% ] 07/20 VUs  5m32.0s/6m0s  6.53 iters/s
write_traffic   [  92% ] 03/20 VUs  5m32.0s/6m0s  2.81 iters/s

running (5m33.0s), 010/040 VUs, 3197 complete and 0 interrupted iterations
read_traffic    [  92% ] 07/20 VUs  5m33.0s/6m0s  6.32 iters/s
write_traffic   [  92% ] 03/20 VUs  5m33.0s/6m0s  2.70 iters/s

running (5m34.0s), 010/040 VUs, 3207 complete and 0 interrupted iterations
read_traffic    [  93% ] 07/20 VUs  5m34.0s/6m0s  6.05 iters/s
write_traffic   [  93% ] 03/20 VUs  5m34.0s/6m0s  2.59 iters/s

running (5m35.0s), 010/040 VUs, 3215 complete and 0 interrupted iterations
read_traffic    [  93% ] 07/20 VUs  5m35.0s/6m0s  5.82 iters/s
write_traffic   [  93% ] 03/20 VUs  5m35.0s/6m0s  2.51 iters/s

running (5m36.0s), 009/040 VUs, 3224 complete and 0 interrupted iterations
read_traffic    [  93% ] 06/20 VUs  5m36.0s/6m0s  5.61 iters/s
write_traffic   [  93% ] 03/20 VUs  5m36.0s/6m0s  2.39 iters/s

running (5m37.0s), 009/040 VUs, 3232 complete and 0 interrupted iterations
read_traffic    [  94% ] 06/20 VUs  5m37.0s/6m0s  5.36 iters/s
write_traffic   [  94% ] 03/20 VUs  5m37.0s/6m0s  2.30 iters/s

running (5m38.0s), 008/040 VUs, 3240 complete and 0 interrupted iterations
read_traffic    [  94% ] 06/20 VUs  5m38.0s/6m0s  5.13 iters/s
write_traffic   [  94% ] 02/20 VUs  5m38.0s/6m0s  2.21 iters/s

running (5m39.0s), 008/040 VUs, 3247 complete and 0 interrupted iterations
read_traffic    [  94% ] 06/20 VUs  5m39.0s/6m0s  4.90 iters/s
write_traffic   [  94% ] 02/20 VUs  5m39.0s/6m0s  2.12 iters/s

running (5m40.0s), 008/040 VUs, 3254 complete and 0 interrupted iterations
read_traffic    [  94% ] 06/20 VUs  5m40.0s/6m0s  4.66 iters/s
write_traffic   [  94% ] 02/20 VUs  5m40.0s/6m0s  2.02 iters/s

running (5m41.0s), 007/040 VUs, 3261 complete and 0 interrupted iterations
read_traffic    [  95% ] 05/20 VUs  5m41.0s/6m0s  4.45 iters/s
write_traffic   [  95% ] 02/20 VUs  5m41.0s/6m0s  1.92 iters/s

running (5m42.0s), 007/040 VUs, 3268 complete and 0 interrupted iterations
read_traffic    [  95% ] 05/20 VUs  5m42.0s/6m0s  4.18 iters/s
write_traffic   [  95% ] 02/20 VUs  5m42.0s/6m0s  1.82 iters/s

running (5m43.0s), 007/040 VUs, 3274 complete and 0 interrupted iterations
read_traffic    [  95% ] 05/20 VUs  5m43.0s/6m0s  3.95 iters/s
write_traffic   [  95% ] 02/20 VUs  5m43.0s/6m0s  1.70 iters/s

running (5m44.0s), 007/040 VUs, 3280 complete and 0 interrupted iterations
read_traffic    [  96% ] 05/20 VUs  5m44.0s/6m0s  3.71 iters/s
write_traffic   [  96% ] 02/20 VUs  5m44.0s/6m0s  1.58 iters/s

running (5m45.0s), 005/040 VUs, 3286 complete and 0 interrupted iterations
read_traffic    [  96% ] 04/20 VUs  5m45.0s/6m0s  3.52 iters/s
write_traffic   [  96% ] 01/20 VUs  5m45.0s/6m0s  1.52 iters/s

running (5m46.0s), 006/040 VUs, 3291 complete and 0 interrupted iterations
read_traffic    [  96% ] 04/20 VUs  5m46.0s/6m0s  3.24 iters/s
write_traffic   [  96% ] 02/20 VUs  5m46.0s/6m0s  1.38 iters/s

running (5m47.0s), 005/040 VUs, 3296 complete and 0 interrupted iterations
read_traffic    [  96% ] 04/20 VUs  5m47.0s/6m0s  3.02 iters/s
write_traffic   [  96% ] 01/20 VUs  5m47.0s/6m0s  1.30 iters/s

running (5m48.0s), 005/040 VUs, 3300 complete and 0 interrupted iterations
read_traffic    [  97% ] 04/20 VUs  5m48.0s/6m0s  2.77 iters/s
write_traffic   [  97% ] 01/20 VUs  5m48.0s/6m0s  1.22 iters/s

running (5m49.0s), 004/040 VUs, 3304 complete and 0 interrupted iterations
read_traffic    [  97% ] 03/20 VUs  5m49.0s/6m0s  2.60 iters/s
write_traffic   [  97% ] 01/20 VUs  5m49.0s/6m0s  1.14 iters/s

running (5m50.0s), 004/040 VUs, 3308 complete and 0 interrupted iterations
read_traffic    [  97% ] 03/20 VUs  5m50.0s/6m0s  2.32 iters/s
write_traffic   [  97% ] 01/20 VUs  5m50.0s/6m0s  1.05 iters/s

running (5m51.0s), 004/040 VUs, 3311 complete and 0 interrupted iterations
read_traffic    [  97% ] 03/20 VUs  5m51.0s/6m0s  2.10 iters/s
write_traffic   [  97% ] 01/20 VUs  5m51.0s/6m0s  0.95 iters/s

running (5m52.0s), 003/040 VUs, 3315 complete and 0 interrupted iterations
read_traffic    [  98% ] 02/20 VUs  5m52.0s/6m0s  1.87 iters/s
write_traffic   [  98% ] 01/20 VUs  5m52.0s/6m0s  0.83 iters/s

running (5m53.0s), 003/040 VUs, 3318 complete and 0 interrupted iterations
read_traffic    [  98% ] 02/20 VUs  5m53.0s/6m0s  1.60 iters/s
write_traffic   [  98% ] 01/20 VUs  5m53.0s/6m0s  0.70 iters/s

running (5m54.0s), 002/040 VUs, 3321 complete and 0 interrupted iterations
read_traffic    [  98% ] 01/20 VUs  5m54.0s/6m0s  1.45 iters/s
write_traffic   [  98% ] 01/20 VUs  5m54.0s/6m0s  0.54 iters/s

running (5m55.0s), 002/040 VUs, 3323 complete and 0 interrupted iterations
read_traffic    [  99% ] 02/20 VUs  5m55.0s/6m0s  1.07 iters/s
write_traffic   [  99% ] 00/20 VUs  5m55.0s/6m0s  0.54 iters/s

running (5m56.0s), 003/040 VUs, 3324 complete and 0 interrupted iterations
read_traffic    [  99% ] 02/20 VUs  5m56.0s/6m0s  0.82 iters/s
write_traffic   [  99% ] 01/20 VUs  5m56.0s/6m0s  0.22 iters/s

running (5m57.0s), 000/040 VUs, 3327 complete and 0 interrupted iterations
read_traffic    [  99% ] 00/20 VUs  5m57.0s/6m0s  0.82 iters/s
write_traffic   [  99% ] 00/20 VUs  5m57.0s/6m0s  0.22 iters/s

running (5m58.0s), 001/040 VUs, 3327 complete and 0 interrupted iterations
read_traffic    [  99% ] 01/20 VUs  5m58.0s/6m0s  0.34 iters/s
write_traffic   [  99% ] 00/20 VUs  5m58.0s/6m0s  0.22 iters/s

running (5m59.0s), 000/040 VUs, 3328 complete and 0 interrupted iterations
read_traffic    [ 100% ] 00/20 VUs  5m59.0s/6m0s  0.34 iters/s
write_traffic   [ 100% ] 00/20 VUs  5m59.0s/6m0s  0.22 iters/s

running (6m00.0s), 000/040 VUs, 3328 complete and 0 interrupted iterations
read_traffic    [ 100% ] 00/20 VUs  6m00.0s/6m0s  0.34 iters/s
write_traffic   [ 100% ] 00/20 VUs  6m00.0s/6m0s  0.22 iters/s

running (6m01.0s), 001/040 VUs, 3328 complete and 0 interrupted iterations
read_traffic  ✓ [ 100% ] 00/20 VUs  6m0s  0.34 iters/s
write_traffic ↓ [ 100% ] 01/20 VUs  6m0s  0.22 iters/s


  █ THRESHOLDS 

    http_req_duration
    ✓ 'p(95)<1500' p(95)=82.42ms

    http_req_failed
    ✓ 'rate<0.01' rate=0.00%


  █ TOTAL RESULTS 

    checks_total.......: 16645   46.090948/s
    checks_succeeded...: 100.00% 16645 out of 16645
    checks_failed......: 0.00%   0 out of 16645

    ✓ login page loaded
    ✓ login response is redirect
    ✓ posts page loaded
    ✓ post page loaded
    ✓ logout successful
    ✓ comment submission redirect

    HTTP
    http_req_duration..............: avg=14.52ms min=149µs med=4.34ms max=110.45ms p(90)=79.05ms p(95)=82.42ms
      { expected_response:true }...: avg=14.52ms min=149µs med=4.34ms max=110.45ms p(90)=79.05ms p(95)=82.42ms
    http_req_failed................: 0.00%  0 out of 23303
    http_reqs......................: 23303  64.527327/s

    EXECUTION
    iteration_duration.............: avg=1.1s    min=1.09s med=1.1s   max=1.14s    p(90)=1.1s    p(95)=1.1s   
    iterations.....................: 3329   9.21819/s
    vus............................: 1      min=0          max=12
    vus_max........................: 40     min=40         max=40

    NETWORK
    data_received..................: 329 MB 912 kB/s
    data_sent......................: 5.0 MB 14 kB/s




running (6m01.1s), 000/040 VUs, 3329 complete and 0 interrupted iterations
read_traffic  ✓ [ 100% ] 00/20 VUs  6m0s  0.34 iters/s
write_traffic ✓ [ 100% ] 00/20 VUs  6m0s  0.22 iters/s
