
         /\      Grafana   /‾‾/  
    /\  /  \     |\  __   /  /   
   /  \/    \    | |/ /  /   ‾‾\ 
  /          \   |   (  |  (‾)  |
 / __________ \  |_|\_\  \_____/ 

     execution: local
        script: /scripts/stress/create-post.stress.js
        output: -

     scenarios: (100.00%) 1 scenario, 1000 max VUs, 2m30s max duration (incl. graceful stop):
              * stress_test: Up to 500.00 iterations/s for 2m0s over 3 stages (maxVUs: 200-1000, gracefulStop: 30s)


running (0m01.0s), 0048/0200 VUs, 0 complete and 0 interrupted iterations
stress_test   [   1% ] 0048/0200 VUs  0m01.0s/2m0s  050.00 iters/s

running (0m02.0s), 0053/0200 VUs, 45 complete and 0 interrupted iterations
stress_test   [   2% ] 0053/0200 VUs  0m02.0s/2m0s  050.00 iters/s

running (0m03.0s), 0053/0200 VUs, 95 complete and 0 interrupted iterations
stress_test   [   2% ] 0053/0200 VUs  0m03.0s/2m0s  050.00 iters/s

running (0m04.0s), 0054/0200 VUs, 145 complete and 0 interrupted iterations
stress_test   [   3% ] 0054/0200 VUs  0m04.0s/2m0s  050.00 iters/s

running (0m05.0s), 0053/0200 VUs, 195 complete and 0 interrupted iterations
stress_test   [   4% ] 0053/0200 VUs  0m05.0s/2m0s  050.00 iters/s

running (0m06.0s), 0054/0200 VUs, 245 complete and 0 interrupted iterations
stress_test   [   5% ] 0054/0200 VUs  0m06.0s/2m0s  050.00 iters/s

running (0m07.0s), 0053/0200 VUs, 295 complete and 0 interrupted iterations
stress_test   [   6% ] 0053/0200 VUs  0m07.0s/2m0s  050.00 iters/s

running (0m08.0s), 0053/0200 VUs, 345 complete and 0 interrupted iterations
stress_test   [   7% ] 0053/0200 VUs  0m08.0s/2m0s  050.00 iters/s

running (0m09.0s), 0054/0200 VUs, 395 complete and 0 interrupted iterations
stress_test   [   7% ] 0054/0200 VUs  0m09.0s/2m0s  050.00 iters/s

running (0m10.0s), 0054/0200 VUs, 445 complete and 0 interrupted iterations
stress_test   [   8% ] 0054/0200 VUs  0m10.0s/2m0s  050.00 iters/s

running (0m11.0s), 0053/0200 VUs, 495 complete and 0 interrupted iterations
stress_test   [   9% ] 0053/0200 VUs  0m11.0s/2m0s  050.00 iters/s

running (0m12.0s), 0054/0200 VUs, 545 complete and 0 interrupted iterations
stress_test   [  10% ] 0054/0200 VUs  0m12.0s/2m0s  050.00 iters/s

running (0m13.0s), 0053/0200 VUs, 595 complete and 0 interrupted iterations
stress_test   [  11% ] 0053/0200 VUs  0m13.0s/2m0s  050.00 iters/s

running (0m14.0s), 0054/0200 VUs, 645 complete and 0 interrupted iterations
stress_test   [  12% ] 0054/0200 VUs  0m14.0s/2m0s  050.00 iters/s

running (0m15.0s), 0053/0200 VUs, 695 complete and 0 interrupted iterations
stress_test   [  12% ] 0053/0200 VUs  0m15.0s/2m0s  050.00 iters/s

running (0m16.0s), 0053/0200 VUs, 745 complete and 0 interrupted iterations
stress_test   [  13% ] 0053/0200 VUs  0m16.0s/2m0s  050.00 iters/s

running (0m17.0s), 0053/0200 VUs, 795 complete and 0 interrupted iterations
stress_test   [  14% ] 0053/0200 VUs  0m17.0s/2m0s  050.00 iters/s

running (0m18.0s), 0053/0200 VUs, 845 complete and 0 interrupted iterations
stress_test   [  15% ] 0053/0200 VUs  0m18.0s/2m0s  050.00 iters/s

running (0m19.0s), 0053/0200 VUs, 895 complete and 0 interrupted iterations
stress_test   [  16% ] 0053/0200 VUs  0m19.0s/2m0s  050.00 iters/s

running (0m20.0s), 0054/0200 VUs, 945 complete and 0 interrupted iterations
stress_test   [  17% ] 0054/0200 VUs  0m20.0s/2m0s  050.00 iters/s

running (0m21.0s), 0053/0200 VUs, 995 complete and 0 interrupted iterations
stress_test   [  17% ] 0053/0200 VUs  0m21.0s/2m0s  050.00 iters/s

running (0m22.0s), 0053/0200 VUs, 1045 complete and 0 interrupted iterations
stress_test   [  18% ] 0053/0200 VUs  0m22.0s/2m0s  050.00 iters/s

running (0m23.0s), 0053/0200 VUs, 1095 complete and 0 interrupted iterations
stress_test   [  19% ] 0053/0200 VUs  0m23.0s/2m0s  050.00 iters/s

running (0m24.0s), 0054/0200 VUs, 1145 complete and 0 interrupted iterations
stress_test   [  20% ] 0054/0200 VUs  0m24.0s/2m0s  050.00 iters/s

running (0m25.0s), 0054/0200 VUs, 1195 complete and 0 interrupted iterations
stress_test   [  21% ] 0054/0200 VUs  0m25.0s/2m0s  050.00 iters/s

running (0m26.0s), 0053/0200 VUs, 1245 complete and 0 interrupted iterations
stress_test   [  22% ] 0053/0200 VUs  0m26.0s/2m0s  050.00 iters/s

running (0m27.0s), 0054/0200 VUs, 1295 complete and 0 interrupted iterations
stress_test   [  22% ] 0054/0200 VUs  0m27.0s/2m0s  050.00 iters/s

running (0m28.0s), 0054/0200 VUs, 1345 complete and 0 interrupted iterations
stress_test   [  23% ] 0054/0200 VUs  0m28.0s/2m0s  050.00 iters/s

running (0m29.0s), 0054/0200 VUs, 1395 complete and 0 interrupted iterations
stress_test   [  24% ] 0054/0200 VUs  0m29.0s/2m0s  050.00 iters/s

running (0m30.0s), 0054/0200 VUs, 1445 complete and 0 interrupted iterations
stress_test   [  25% ] 0054/0200 VUs  0m30.0s/2m0s  050.00 iters/s

running (0m31.0s), 0056/0200 VUs, 1495 complete and 0 interrupted iterations
stress_test   [  26% ] 0056/0200 VUs  0m31.0s/2m0s  054.91 iters/s

running (0m32.0s), 0061/0200 VUs, 1547 complete and 0 interrupted iterations
stress_test   [  27% ] 0061/0200 VUs  0m32.0s/2m0s  059.87 iters/s

running (0m33.0s), 0067/0200 VUs, 1604 complete and 0 interrupted iterations
stress_test   [  27% ] 0067/0200 VUs  0m33.0s/2m0s  064.92 iters/s

running (0m34.0s), 0072/0200 VUs, 1666 complete and 0 interrupted iterations
stress_test   [  28% ] 0072/0200 VUs  0m34.0s/2m0s  069.89 iters/s

running (0m35.0s), 0078/0200 VUs, 1733 complete and 0 interrupted iterations
stress_test   [  29% ] 0078/0200 VUs  0m35.0s/2m0s  074.93 iters/s

running (0m36.0s), 0083/0200 VUs, 1805 complete and 0 interrupted iterations
stress_test   [  30% ] 0083/0200 VUs  0m36.0s/2m0s  079.91 iters/s

running (0m37.0s), 0088/0200 VUs, 1882 complete and 0 interrupted iterations
stress_test   [  31% ] 0088/0200 VUs  0m37.0s/2m0s  084.88 iters/s

running (0m38.0s), 0094/0200 VUs, 1964 complete and 0 interrupted iterations
stress_test   [  32% ] 0094/0200 VUs  0m38.0s/2m0s  089.92 iters/s

running (0m39.0s), 0099/0200 VUs, 2051 complete and 0 interrupted iterations
stress_test   [  32% ] 0099/0200 VUs  0m39.0s/2m0s  094.89 iters/s

running (0m40.0s), 0105/0200 VUs, 2143 complete and 0 interrupted iterations
stress_test   [  33% ] 0105/0200 VUs  0m40.0s/2m0s  099.92 iters/s

running (0m41.0s), 0111/0200 VUs, 2239 complete and 0 interrupted iterations
stress_test   [  34% ] 0111/0200 VUs  0m41.0s/2m0s  104.90 iters/s

running (0m42.0s), 0115/0200 VUs, 2342 complete and 0 interrupted iterations
stress_test   [  35% ] 0115/0200 VUs  0m42.0s/2m0s  109.89 iters/s

running (0m43.0s), 0122/0200 VUs, 2448 complete and 0 interrupted iterations
stress_test   [  36% ] 0122/0200 VUs  0m43.0s/2m0s  114.91 iters/s

running (0m44.0s), 0127/0200 VUs, 2560 complete and 0 interrupted iterations
stress_test   [  37% ] 0127/0200 VUs  0m44.0s/2m0s  119.90 iters/s

running (0m45.0s), 0132/0200 VUs, 2677 complete and 0 interrupted iterations
stress_test   [  37% ] 0132/0200 VUs  0m45.0s/2m0s  124.88 iters/s

running (0m46.0s), 0139/0200 VUs, 2798 complete and 0 interrupted iterations
stress_test   [  38% ] 0139/0200 VUs  0m46.0s/2m0s  129.90 iters/s

running (0m47.0s), 0153/0200 VUs, 2916 complete and 0 interrupted iterations
stress_test   [  39% ] 0152/0200 VUs  0m47.0s/2m0s  134.89 iters/s

running (0m48.0s), 0174/0200 VUs, 3033 complete and 0 interrupted iterations
stress_test   [  40% ] 0174/0200 VUs  0m48.0s/2m0s  139.91 iters/s

running (0m49.0s), 0192/0200 VUs, 3158 complete and 0 interrupted iterations
stress_test   [  41% ] 0192/0200 VUs  0m49.0s/2m0s  144.93 iters/s

running (0m50.0s), 0199/0204 VUs, 3293 complete and 0 interrupted iterations
stress_test   [  42% ] 0199/0204 VUs  0m50.0s/2m0s  149.88 iters/s

running (0m51.0s), 0209/0215 VUs, 3425 complete and 0 interrupted iterations
stress_test   [  42% ] 0209/0215 VUs  0m51.0s/2m0s  154.90 iters/s

running (0m52.0s), 0227/0227 VUs, 3552 complete and 0 interrupted iterations
stress_test   [  43% ] 0227/0227 VUs  0m52.0s/2m0s  159.89 iters/s

running (0m53.0s), 0249/0251 VUs, 3669 complete and 0 interrupted iterations
stress_test   [  44% ] 0249/0251 VUs  0m53.0s/2m0s  164.91 iters/s

running (0m54.0s), 0263/0266 VUs, 3807 complete and 0 interrupted iterations
stress_test   [  45% ] 0263/0266 VUs  0m54.0s/2m0s  169.90 iters/s

running (0m55.0s), 0288/0294 VUs, 3926 complete and 0 interrupted iterations
stress_test   [  46% ] 0288/0294 VUs  0m55.0s/2m0s  174.89 iters/s

running (0m56.0s), 0312/0313 VUs, 4061 complete and 0 interrupted iterations
stress_test   [  47% ] 0312/0313 VUs  0m56.0s/2m0s  179.90 iters/s

running (0m57.0s), 0340/0341 VUs, 4187 complete and 0 interrupted iterations
stress_test   [  47% ] 0340/0341 VUs  0m57.0s/2m0s  184.89 iters/s

running (0m58.0s), 0395/0396 VUs, 4265 complete and 0 interrupted iterations
stress_test   [  48% ] 0395/0396 VUs  0m58.0s/2m0s  189.91 iters/s

running (0m59.0s), 0404/0413 VUs, 4431 complete and 0 interrupted iterations
stress_test   [  49% ] 0404/0413 VUs  0m59.0s/2m0s  194.90 iters/s

running (1m00.0s), 0462/0464 VUs, 4519 complete and 0 interrupted iterations
stress_test   [  50% ] 0462/0464 VUs  1m00.0s/2m0s  199.89 iters/s

running (1m01.0s), 0497/0498 VUs, 4653 complete and 0 interrupted iterations
stress_test   [  51% ] 0497/0498 VUs  1m01.0s/2m0s  204.90 iters/s

running (1m02.0s), 0550/0550 VUs, 4755 complete and 0 interrupted iterations
stress_test   [  52% ] 0550/0550 VUs  1m02.0s/2m0s  209.89 iters/s

running (1m03.0s), 0609/0609 VUs, 4849 complete and 0 interrupted iterations
stress_test   [  52% ] 0609/0609 VUs  1m03.0s/2m0s  214.88 iters/s

running (1m04.0s), 0635/0642 VUs, 5008 complete and 0 interrupted iterations
stress_test   [  53% ] 0635/0642 VUs  1m04.0s/2m0s  219.90 iters/s

running (1m05.0s), 0657/0676 VUs, 5174 complete and 0 interrupted iterations
stress_test   [  54% ] 0657/0676 VUs  1m05.0s/2m0s  224.89 iters/s

running (1m06.0s), 0752/0752 VUs, 5229 complete and 0 interrupted iterations
stress_test   [  55% ] 0752/0752 VUs  1m06.0s/2m0s  229.90 iters/s

running (1m07.0s), 0815/0816 VUs, 5330 complete and 0 interrupted iterations
stress_test   [  56% ] 0815/0816 VUs  1m07.0s/2m0s  234.89 iters/s

running (1m08.0s), 0920/0921 VUs, 5358 complete and 0 interrupted iterations
stress_test   [  57% ] 0920/0921 VUs  1m08.0s/2m0s  239.91 iters/s

running (1m09.0s), 0950/0954 VUs, 5537 complete and 0 interrupted iterations
stress_test   [  57% ] 0950/0954 VUs  1m09.0s/2m0s  244.90 iters/s

running (1m10.0s), 1000/1000 VUs, 5583 complete and 0 interrupted iterations
stress_test   [  58% ] 1000/1000 VUs  1m10.0s/2m0s  249.89 iters/s

running (1m11.0s), 0869/1000 VUs, 5888 complete and 0 interrupted iterations
stress_test   [  59% ] 0869/1000 VUs  1m11.0s/2m0s  254.90 iters/s

running (1m12.0s), 1000/1000 VUs, 5915 complete and 0 interrupted iterations
stress_test   [  60% ] 1000/1000 VUs  1m12.0s/2m0s  259.89 iters/s

running (1m13.0s), 0989/1000 VUs, 6031 complete and 0 interrupted iterations
stress_test   [  61% ] 0989/1000 VUs  1m13.0s/2m0s  264.89 iters/s

running (1m14.0s), 1000/1000 VUs, 6160 complete and 0 interrupted iterations
stress_test   [  62% ] 1000/1000 VUs  1m14.0s/2m0s  269.90 iters/s

running (1m15.0s), 1000/1000 VUs, 6187 complete and 0 interrupted iterations
stress_test   [  62% ] 1000/1000 VUs  1m15.0s/2m0s  274.89 iters/s

running (1m16.0s), 0893/1000 VUs, 6439 complete and 0 interrupted iterations
stress_test   [  63% ] 0893/1000 VUs  1m16.0s/2m0s  279.90 iters/s

running (1m17.0s), 1000/1000 VUs, 6516 complete and 0 interrupted iterations
stress_test   [  64% ] 1000/1000 VUs  1m17.0s/2m0s  284.89 iters/s

running (1m18.0s), 0884/1000 VUs, 6795 complete and 0 interrupted iterations
stress_test   [  65% ] 0885/1000 VUs  1m18.0s/2m0s  289.91 iters/s

running (1m19.0s), 1000/1000 VUs, 6827 complete and 0 interrupted iterations
stress_test   [  66% ] 1000/1000 VUs  1m19.0s/2m0s  294.90 iters/s

running (1m20.0s), 0990/1000 VUs, 6901 complete and 0 interrupted iterations
stress_test   [  67% ] 0990/1000 VUs  1m20.0s/2m0s  299.91 iters/s

running (1m21.0s), 1000/1000 VUs, 7089 complete and 0 interrupted iterations
stress_test   [  67% ] 1000/1000 VUs  1m21.0s/2m0s  304.90 iters/s

running (1m22.0s), 1000/1000 VUs, 7116 complete and 0 interrupted iterations
stress_test   [  68% ] 1000/1000 VUs  1m22.0s/2m0s  309.90 iters/s

running (1m23.0s), 0907/1000 VUs, 7418 complete and 0 interrupted iterations
stress_test   [  69% ] 0907/1000 VUs  1m23.0s/2m0s  314.90 iters/s

running (1m24.0s), 1000/1000 VUs, 7451 complete and 0 interrupted iterations
stress_test   [  70% ] 1000/1000 VUs  1m24.0s/2m0s  319.90 iters/s

running (1m25.0s), 0937/1000 VUs, 7734 complete and 0 interrupted iterations
stress_test   [  71% ] 0937/1000 VUs  1m25.0s/2m0s  324.91 iters/s

running (1m26.0s), 1000/1000 VUs, 7775 complete and 0 interrupted iterations
stress_test   [  72% ] 1000/1000 VUs  1m26.0s/2m0s  329.90 iters/s

running (1m27.0s), 0950/1000 VUs, 7912 complete and 0 interrupted iterations
stress_test   [  72% ] 0950/1000 VUs  1m27.0s/2m0s  334.90 iters/s

running (1m28.0s), 1000/1000 VUs, 8056 complete and 0 interrupted iterations
stress_test   [  73% ] 1000/1000 VUs  1m28.0s/2m0s  339.90 iters/s

running (1m29.0s), 1000/1000 VUs, 8096 complete and 0 interrupted iterations
stress_test   [  74% ] 1000/1000 VUs  1m29.0s/2m0s  344.90 iters/s

running (1m30.0s), 0928/1000 VUs, 8370 complete and 0 interrupted iterations
stress_test   [  75% ] 0928/1000 VUs  1m30.0s/2m0s  349.89 iters/s

running (1m31.0s), 1000/1000 VUs, 8438 complete and 0 interrupted iterations
stress_test   [  76% ] 1000/1000 VUs  1m31.0s/2m0s  354.90 iters/s

running (1m32.0s), 0951/1000 VUs, 8693 complete and 0 interrupted iterations
stress_test   [  77% ] 0951/1000 VUs  1m32.0s/2m0s  359.90 iters/s

running (1m33.0s), 1000/1000 VUs, 8747 complete and 0 interrupted iterations
stress_test   [  77% ] 1000/1000 VUs  1m33.0s/2m0s  364.90 iters/s

running (1m34.0s), 0990/1000 VUs, 8846 complete and 0 interrupted iterations
stress_test   [  78% ] 0990/1000 VUs  1m34.0s/2m0s  369.89 iters/s

running (1m35.0s), 1000/1000 VUs, 9021 complete and 0 interrupted iterations
stress_test   [  79% ] 1000/1000 VUs  1m35.0s/2m0s  374.91 iters/s

running (1m36.0s), 0990/1000 VUs, 9116 complete and 0 interrupted iterations
stress_test   [  80% ] 0990/1000 VUs  1m36.0s/2m0s  379.90 iters/s

running (1m37.0s), 1000/1000 VUs, 9348 complete and 0 interrupted iterations
stress_test   [  81% ] 1000/1000 VUs  1m37.0s/2m0s  384.91 iters/s

running (1m38.0s), 1000/1000 VUs, 9393 complete and 0 interrupted iterations
stress_test   [  82% ] 1000/1000 VUs  1m38.0s/2m0s  389.90 iters/s

running (1m39.0s), 0998/1000 VUs, 9484 complete and 0 interrupted iterations
stress_test   [  82% ] 0998/1000 VUs  1m39.0s/2m0s  394.91 iters/s

running (1m40.0s), 1000/1000 VUs, 9680 complete and 0 interrupted iterations
stress_test   [  83% ] 1000/1000 VUs  1m40.0s/2m0s  399.89 iters/s

running (1m41.0s), 1000/1000 VUs, 9762 complete and 0 interrupted iterations
stress_test   [  84% ] 1000/1000 VUs  1m41.0s/2m0s  404.90 iters/s

running (1m42.0s), 1000/1000 VUs, 10022 complete and 0 interrupted iterations
stress_test   [  85% ] 1000/1000 VUs  1m42.0s/2m0s  409.92 iters/s

running (1m43.0s), 1000/1000 VUs, 10076 complete and 0 interrupted iterations
stress_test   [  86% ] 1000/1000 VUs  1m43.0s/2m0s  414.90 iters/s

running (1m44.0s), 1000/1000 VUs, 10300 complete and 0 interrupted iterations
stress_test   [  87% ] 1000/1000 VUs  1m44.0s/2m0s  419.89 iters/s

running (1m45.0s), 1000/1000 VUs, 10333 complete and 0 interrupted iterations
stress_test   [  87% ] 1000/1000 VUs  1m45.0s/2m0s  424.91 iters/s

running (1m46.0s), 1000/1000 VUs, 10501 complete and 0 interrupted iterations
stress_test   [  88% ] 1000/1000 VUs  1m46.0s/2m0s  429.88 iters/s

running (1m47.0s), 1000/1000 VUs, 10616 complete and 0 interrupted iterations
stress_test   [  89% ] 1000/1000 VUs  1m47.0s/2m0s  434.91 iters/s

running (1m48.0s), 1000/1000 VUs, 10663 complete and 0 interrupted iterations
stress_test   [  90% ] 1000/1000 VUs  1m48.0s/2m0s  439.90 iters/s

running (1m49.0s), 1000/1000 VUs, 10940 complete and 0 interrupted iterations
stress_test   [  91% ] 1000/1000 VUs  1m49.0s/2m0s  444.90 iters/s

running (1m50.0s), 1000/1000 VUs, 10974 complete and 0 interrupted iterations
stress_test   [  92% ] 1000/1000 VUs  1m50.0s/2m0s  449.91 iters/s

running (1m51.0s), 1000/1000 VUs, 11257 complete and 0 interrupted iterations
stress_test   [  92% ] 1000/1000 VUs  1m51.0s/2m0s  454.89 iters/s

running (1m52.0s), 1000/1000 VUs, 11291 complete and 0 interrupted iterations
stress_test   [  93% ] 1000/1000 VUs  1m52.0s/2m0s  459.91 iters/s

running (1m53.0s), 0988/1000 VUs, 11439 complete and 0 interrupted iterations
stress_test   [  94% ] 0988/1000 VUs  1m53.0s/2m0s  464.89 iters/s

running (1m54.0s), 1000/1000 VUs, 11545 complete and 0 interrupted iterations
stress_test   [  95% ] 1000/1000 VUs  1m54.0s/2m0s  469.90 iters/s

running (1m55.0s), 0995/1000 VUs, 11609 complete and 0 interrupted iterations
stress_test   [  96% ] 0995/1000 VUs  1m55.0s/2m0s  474.91 iters/s

running (1m56.0s), 1000/1000 VUs, 11893 complete and 0 interrupted iterations
stress_test   [  97% ] 1000/1000 VUs  1m56.0s/2m0s  479.90 iters/s

running (1m57.0s), 0987/1000 VUs, 11981 complete and 0 interrupted iterations
stress_test   [  97% ] 0987/1000 VUs  1m57.0s/2m0s  484.91 iters/s

running (1m58.0s), 1000/1000 VUs, 12199 complete and 0 interrupted iterations
stress_test   [  98% ] 1000/1000 VUs  1m58.0s/2m0s  489.89 iters/s

running (1m59.0s), 1000/1000 VUs, 12234 complete and 0 interrupted iterations
stress_test   [  99% ] 1000/1000 VUs  1m59.0s/2m0s  494.90 iters/s

running (2m00.0s), 1000/1000 VUs, 12425 complete and 0 interrupted iterations
stress_test   [ 100% ] 1000/1000 VUs  2m00.0s/2m0s  499.91 iters/s

running (2m01.0s), 0891/1000 VUs, 12538 complete and 0 interrupted iterations
stress_test ↓ [ 100% ] 0996/1000 VUs  2m0s  499.99 iters/s

running (2m02.0s), 0778/1000 VUs, 12651 complete and 0 interrupted iterations
stress_test ↓ [ 100% ] 0996/1000 VUs  2m0s  499.99 iters/s

running (2m03.0s), 0588/1000 VUs, 12841 complete and 0 interrupted iterations
stress_test ↓ [ 100% ] 0996/1000 VUs  2m0s  499.99 iters/s

running (2m04.0s), 0126/1000 VUs, 13303 complete and 0 interrupted iterations
stress_test ↓ [ 100% ] 0996/1000 VUs  2m0s  499.99 iters/s


  █ THRESHOLDS 

    failures
    ✓ 'rate<0.01' rate=0.00%

    http_req_duration
    ✗ 'p(95)<1500' p(95)=2.61s

    http_req_failed
    ✓ 'rate<0.01' rate=0.00%


  █ TOTAL RESULTS 

    checks_total.......: 13429   108.181026/s
    checks_succeeded...: 100.00% 13429 out of 13429
    checks_failed......: 0.00%   0 out of 13429

    ✓ post created 302

    CUSTOM
    failures.......................: 0.00%  0 out of 0

    HTTP
    http_req_duration..............: avg=783.48ms min=77.66µs med=426.85ms max=5.01s  p(90)=2.01s p(95)=2.61s p(99)=3.51s
      { expected_response:true }...: avg=783.48ms min=77.66µs med=426.85ms max=5.01s  p(90)=2.01s p(95)=2.61s p(99)=3.51s
    http_req_failed................: 0.00%  0 out of 67145
    http_reqs......................: 67145  540.905131/s

    EXECUTION
    dropped_iterations.............: 12819  103.267002/s
    iteration_duration.............: avg=4.91s    min=1.07s   med=5.26s    max=11.89s p(90)=8.8s  p(95)=9.13s p(99)=9.6s 
    iterations.....................: 13429  108.181026/s
    vus............................: 132    min=48         max=1000
    vus_max........................: 1000   min=200        max=1000

    NETWORK
    data_received..................: 115 MB 924 kB/s
    data_sent......................: 14 MB  112 kB/s




running (2m04.1s), 0000/1000 VUs, 13429 complete and 0 interrupted iterations
stress_test ✓ [ 100% ] 0000/1000 VUs  2m0s  499.99 iters/s
